,headline,timestamp,year,month,day,hour,minute
0," Beyonce 'Renaissance' is Here, S/O Beyhive!!! Thanks for 'Love & Protection' Over Leak ",7/29/2022 7:18 AM,2022,7,29,7,18
1, Supreme Court Justice Alito Mocks Prince Harry For Bashing Decision overturning Roe v. Wade ,7/29/2022 6:49 AM,2022,7,29,6,49
2, Bob Dylan Accuser Drops Sex Abuse Suit ,7/29/2022 6:36 AM,2022,7,29,6,36
3, Jeff Ross Jon Stewart Feels the Pain of Veterans ... He Really Should Run for Prez!!! ,7/29/2022 6:31 AM,2022,7,29,6,31
4, Ukraine Prez Volodymyr Zelensky Strong Support For Vogue Shoot ... From Ukrainian Relief Orgs ,7/29/2022 1:00 AM,2022,7,29,1,0
5, Jeff Bezos' Parents Buy MORE Real Estate ... Real Housewife's $44 Mil FL Mansion!!! ,7/29/2022 12:30 AM,2022,7,29,0,30
6, Ted Cruz Claims Jon Stewart Got the Vet Bill Wrong ,7/29/2022 12:20 AM,2022,7,29,0,20
7, Ric Flair On Vince McMahon's WWE Retirement: ... 'I Hate It' ,7/29/2022 12:10 AM,2022,7,29,0,10
8, Guess Who This Georgia Peach Turned Into! ,7/29/2022 12:01 AM,2022,7,29,0,1
9, Shanna Moakler Cops Respond to 'Domestic Disturbance' Call ,7/28/2022 6:31 PM,2022,7,28,18,31
10, Monkey Attacks Terrorizing Japanese City ... Trying to Snatch Human Babies!!! ,7/28/2022 6:20 PM,2022,7,28,18,20
11," Candace Cameron Bure Vs. JoJo Siwa Daughter Rips JoJo ... Photo Snub's No Biggie, Grow Up!!! ",7/28/2022 5:53 PM,2022,7,28,17,53
12, 'Long Island Medium' Theresa Defends Buying 5-Month-Old Granddaughter Gucci Bag ... Cutest Binki Holder Ever!!! ,7/28/2022 4:19 PM,2022,7,28,16,19
13, Dwight Howard Crashes WWE Tryout ... Cuts Epic Promo!! ,7/28/2022 3:36 PM,2022,7,28,15,36
14," Joey Badass Fans Gotta Chill, Chris Brown Has My Respect And Delta Can Too, IF ... ",7/28/2022 3:33 PM,2022,7,28,15,33
15, Report: Zion Williamson Weight Clause In New Contract Could Lose Guaranteed $$$ ,7/28/2022 2:58 PM,2022,7,28,14,58
16, Beyoncé Catches R&Beef From Kelis!!! Claims Sample Was Stolen ,7/28/2022 1:41 PM,2022,7,28,13,41
17, Mike Evans Unveils New Harry Potter Tattoo 'But I Am The Chosen One' ,7/28/2022 12:19 PM,2022,7,28,12,19
18, Lamar Odom My Social Media's Been Highjacked ... Old Manager Costing Me $$ ,7/28/2022 12:00 PM,2022,7,28,12,0
19, Jon Stewart Obliterates GOP for Blocking Vet Bill ... 'Sen. Toomey Is a F***ing Coward' ,7/28/2022 10:26 AM,2022,7,28,10,26
20," Aniston, Kimmel & Bateman A-List Vacay Pals Return to L.A.!!! Back from the Bahamas ",7/28/2022 9:05 AM,2022,7,28,9,5
21," Hong Kong Concert Video Monitor Falls, Crushing Dancers Below ",7/28/2022 9:01 AM,2022,7,28,9,1
22, Dua Lipa Fans Light Fireworks Inside Arena ... Cops Investigating ,7/28/2022 8:45 AM,2022,7,28,8,45
23," Johnny Depp Oui, We Love You!!! Fans Swarm in Paris ",7/28/2022 6:45 AM,2022,7,28,6,45
24, Sesame Place $25 Million Class Action Suit Claiming Racism ,7/28/2022 6:43 AM,2022,7,28,6,43
25," Gwenyth Paltrow Hey Hailey, I f***ed your Father!!! ... True Bathroom Humor ",7/28/2022 6:23 AM,2022,7,28,6,23
26, Michael Savarino Coach K's Grandson ... Pleads Guilty To DWI ,7/28/2022 6:16 AM,2022,7,28,6,16
27, Angie Everhart Accused of Egging Neighbor's Apartment Cops Called to Scene ,7/28/2022 1:00 AM,2022,7,28,1,0
28, Tichina Arnold Divorce Finalized ... I'm Finally Single!!! ,7/28/2022 12:30 AM,2022,7,28,0,30
29, 'Love & Marriage' Melody Shari Ex Martell Holt Hasn't Changed ... He's Still Disrespectful!!! ,7/28/2022 12:20 AM,2022,7,28,0,20
30, Wrestling Star Hornswoggle Defends Jerry Jones' M-Word Use 'Didn't Need To Apologize' ,7/28/2022 12:10 AM,2022,7,28,0,10
31, Kendall & Kylie's Nanny In Season 1 of 'KUWTK' 'Memba Her?! ,7/28/2022 12:01 AM,2022,7,28,0,1
32, JayDaYoungan Shot and Killed Outside Home ,7/27/2022 8:46 PM,2022,7,27,20,46
33, Mike Tyson Using Cane To Get Around ... But I'm OK!!! ,7/27/2022 3:56 PM,2022,7,27,15,56
34," Britney Spears Will Not Be Deposed, Judge Rules ",7/27/2022 3:26 PM,2022,7,27,15,26
35, Jeff Bezos Parents Buy $34M Mega Mansion in FL ,7/27/2022 3:01 PM,2022,7,27,15,1
36, Joey Chestnut Downs 44 Cane's Chicken Fingers In Five Minutes!!! ... World Record ,7/27/2022 2:06 PM,2022,7,27,14,6
37, Brittney Griner I Flew To Russia Despite Travel Warning ... So I Could Help My Team ,7/27/2022 1:06 PM,2022,7,27,13,6
38, Tony Dow 'Leave It To Beaver' Star Dead At 77 ,7/27/2022 12:27 PM,2022,7,27,12,27
39, Beyoncé ‘Renaissance’ Album Leak Beyhive Says Not So Fast!!! ,7/27/2022 12:02 PM,2022,7,27,12,2
40, Ukrainian Prez Volodymyr Zelensky Dragged Over Vogue Cover Shoot with Wife ,7/27/2022 10:15 AM,2022,7,27,10,15
41, GEORGE FLOYD'S DEATH Former Cops Get Prison Time ... For Violating His Civil Rights ,7/27/2022 10:14 AM,2022,7,27,10,14
42, Kanye West Gifts A$AP Bari New Maybach… Days After He Wrecked His Old One!!! ,7/27/2022 8:18 AM,2022,7,27,8,18
43, Norman Lear Singin' 'That's Amore' At 100 ... The Miracle of Being Alive!!! ,7/27/2022 8:14 AM,2022,7,27,8,14
44, Jamie Foxx Wild Sing-along on Italian Vacay ... 'I'm Jamie Motherf***ing Foxx!!!' ,7/27/2022 8:02 AM,2022,7,27,8,2
45, 'Top Chef' Star Howard Kleinberg Dead at 46 ,7/27/2022 7:39 AM,2022,7,27,7,39
46, Shawn Mendes Cancels Tour ... For Mental Health Break ,7/27/2022 7:17 AM,2022,7,27,7,17
47, Mama June Honey Boo Boo Too Young For Gastric Sleeve!!! ,7/27/2022 1:00 AM,2022,7,27,1,0
48, Britney Spears Lawyer Doubles Down ... She Won't Sit for Depo or Testify at Trial,7/26/2022 4:31 PM,2022,7,26,16,31
49, Jerry Jones Apologizes For Derogatory Term ... At Cowboys Camp ,7/26/2022 4:23 PM,2022,7,26,16,23
50, Buzz Aldrin Apollo 11 Jacket Sells For $2.7 Mil ... Space Artifact Record!!!,7/26/2022 4:17 PM,2022,7,26,16,17
51, Donald Trump Protesters Flood Hotel ... For 1st Speech Back in D.C. Since Jan. 6,7/26/2022 3:27 PM,2022,7,26,15,27
52, Kevin Hart Shames Ex-NFLer Over Nudist Colony Hobby With Wife ... 'You Hear Whatchu Sayin'!?!',7/26/2022 2:27 PM,2022,7,26,14,27
53, Jim Harbaugh I'm Willing To Raise My Players' Baby ... If Pregnancy Unplanned,7/26/2022 10:04 AM,2022,7,26,10,4
54, 'RHONY' Star Sonja Morgan Lists NYC Townhouse ... Let's Try This Again!!!,7/26/2022 9:50 AM,2022,7,26,9,50
55, Tony Dow 'Leave it to Beaver' Star Still Alive ... Despite Facebook Death Post,7/26/2022 8:56 AM,2022,7,26,8,56
56, Helicopter Tragedy Man Dies Walking into Blades ... Cops Fear He Was Attempting Selfie,7/26/2022 6:58 AM,2022,7,26,6,58
57, California Soccer Player Dies Following In-Game Brawl ... Involving Players & Fans,7/26/2022 6:53 AM,2022,7,26,6,53
58, Lana Del Rey Gets TRO Against Alleged Stalker ... He Stole My Car!!!,7/26/2022 6:37 AM,2022,7,26,6,37
59, Taco Bell Employee Allegedly Throws Boiling Hot Water at Customers,7/26/2022 6:27 AM,2022,7,26,6,27
60, Brittney Griner Sends Message To Wife In Court ... 'Good Luck On The Bar Exam',7/26/2022 6:13 AM,2022,7,26,6,13
61, PetSmart Sued Your Groomers Killed My Dog!!!,7/26/2022 1:00 AM,2022,7,26,1,0
62, 'RHOA' STAR SHEREE WHITFIELD Dating Martell Holt ... From 'Love & Marriage Huntsville',7/26/2022 12:50 AM,2022,7,26,0,50
63, 'SHAHS OF SUNSET' Mike CHARGED WITH DOMESTIC VIOLENCE,7/26/2022 12:40 AM,2022,7,26,0,40
