,headline,tags,timestamp,year,month,day,hour,minute
0,Zac Efron Slammed By PETA ... After Appearing In Ad With Captive Bear.,"['Zac Efron', 'PETA', 'Animals', 'Movies', 'Exclusive', 'Controversial S#!T', 'Famous Food']",8/6/2022 12:50 AM,2022,8,6,0,50
1,Stars and Scars You Be the Judge.,[],8/6/2022 12:45 AM,2022,8,6,0,45
2,Yasiel Puig Vin Scully Was A Father Figure ... I'm So Sad He's Gone.,"['Yasiel Puig', 'Vin Scully', 'Tommy Lasorda', 'Los Angeles Dodgers', 'RIP', 'Celebrity Death', 'TMZ Sports', 'Exclusive', 'MLB', 'Baseball']",8/6/2022 12:40 AM,2022,8,6,0,40
3,Stars In Shiny Swimsuits Hollywood Goes Heavy Metal!,"['Hotties & Bodies', 'Hot Bodies', 'Summer', 'Photo Galleries', 'Models']",8/6/2022 12:30 AM,2022,8,6,0,30
4,"Joe Giudice Happy For Teresa's New Marriage ... Good Luck With Gorgas, Luis!","['Teresa Giudice', 'Joe Giudice', 'Joe Gorga', 'Melissa Gorga', 'TV', 'Family', 'Reality TV', 'Relationships', 'Couples', 'Real Housewives', 'Tying The Knot', 'Exclusive']",8/6/2022 12:20 AM,2022,8,6,0,20
5,What's The Big Frigin' Difference?!,"['Dancing with the Stars', ""What's The Big Frigin' Difference""]",8/6/2022 12:01 AM,2022,8,6,0,1
6,"Khloe Kardashain Welcome, New baby Boy!!!","['Khloe Kardashian', 'Tristan Thompson', 'Family', 'Reality TV', 'TMZ Sports', 'celebrity kids', 'Baby Watch', 'Hollywood Exes', 'NBA']",8/5/2022 7:08 PM,2022,8,5,19,8
7,Kim Kardashian and Pete Davidson Call It Quits After 9 Months Together.,"['Kim Kardashian', 'Pete Davidson', 'Kanye West', 'Humor', 'TV', 'Kim Kardashian Dating', 'Reality TV', 'Relationships', 'Breaking News', 'Couples', 'Comedy', 'The Kardashians']",8/5/2022 4:35 PM,2022,8,5,16,35
8,ALEX JONES Must Pay $45.2 Mil in Punitive Damages To Sandy Hook Parents.,"['Alex Jones', 'Weapons & Guns', 'Money', 'Family', 'Kids', 'Controversial S#!T', 'Fairly Legal', 'Stars In Heat']",8/5/2022 4:03 PM,2022,8,5,16,3
9,Anne Heche Crashes Car into a Home Igniting Fire ... New Video Shows Her Speeding.,"['Anne Heche', 'TV', 'Movies', 'Car Crashes', 'Nurse!', 'Drugs & Alcohol', 'Exclusive', 'Health']",8/5/2022 2:04 PM,2022,8,5,14,4
10,Shawn Mendes Takes a Dip in Miami ... The Beach Ain't Canceled!!!,"['Shawn Mendes', 'Miami', 'Summer/Beach', 'Hot Bodies', 'Music', 'Health']",8/5/2022 12:02 PM,2022,8,5,12,2
11,Kanye West 5th Divorce Attorney Quits ... As the Case Drags On.,"['Kim Kardashian', 'Kanye West', 'Family', 'Hip Hop', 'Reality TV', 'Relationships', 'Celebrity Divorce', 'Exclusive', 'Music', 'Fairly Legal']",8/5/2022 10:17 AM,2022,8,5,10,17
12,Italian Decathlete Junk Falls Out During Race ... 'Obviously An Accident',"['Olympics', 'Weird News', 'Nudity', 'TMZ Sports']",8/5/2022 10:08 AM,2022,8,5,10,8
13,Anchorage PD 2 Officers Found in Violation For Selfies with 'White Privilege' Card Driver.,"['You Might Want to Rethink', 'Controversial S#!T', 'Fairly Legal', 'Police']",8/5/2022 8:10 AM,2022,8,5,8,10
14,Wiz Khalifa Sits with Envy & Drama ... Apologizes for Nightclub DJs Rant.,,8/5/2022 7:39 AM,2022,8,5,7,39
15,NASCAR Champ Kyle Busch Escapes Shooting At Mall Of America ... In Chaotic Video.,"['Kyle Busch', 'Weapons & Guns', 'Family', 'TMZ Sports', 'Kids', 'NASCAR']",8/5/2022 7:20 AM,2022,8,5,7,20
16,Terrell Owens 'Karen' Incident 911 Audio ... Woman Claims T.O. 'Threatened' Her.,,8/5/2022 7:01 AM,2022,8,5,7,1
17,Tyler Perry I Don't Want To Talk Race with My 7-Yr-Old Son Yet!!!,,8/5/2022 6:48 AM,2022,8,5,6,48
18,Monkeypox U.S. Asleep at the Wheel in Responding ... Report.,,8/5/2022 6:29 AM,2022,8,5,6,29
19,Trevor Noah Griner's Sentence Is 'Bulls***' 'Get The F*** Out Of Here',"['Trevor Noah', 'Brittney Griner', 'Arrests', 'TMZ Sports', 'Basketball', 'Politix', 'Controversial S#!T', 'Fairly Legal', 'WNBA']",8/5/2022 6:20 AM,2022,8,5,6,20
20,Disney World 'Toy Story' Hug Characters Need to Embrace Kids of All Races ... Says Fam in Viral Video.,,8/5/2022 1:00 AM,2022,8,5,1,0
21,John Lennon Scathing Letter to Paul Up for Auction.,,8/5/2022 12:45 AM,2022,8,5,0,45
22,Alyson Hannigan Finds Buyer For 'This Is Us' House ... With $18 Million Price Tag!!!,,8/5/2022 12:30 AM,2022,8,5,0,30
23,Shannon Sharpe Betting NFL Calls Aaron Rodgers Over Psychedelics ... 'That's Not A Good Look',,8/5/2022 12:15 AM,2022,8,5,0,15
24,Jordan On MTV's 'The Hills' 'Memba Him?!,,8/5/2022 12:01 AM,2022,8,5,0,1
25,Elon Musk Feds Drug Tested Me After Blazing with Joe Rogan.,,8/4/2022 6:16 PM,2022,8,4,18,16
26,Kylie Jenner Fires Back Over 'Unsanitary' Lab Photos ... I Would Never Put My Customers at Risk!!!,,8/4/2022 3:55 PM,2022,8,4,15,55
27,Alex Jones $4.1M In Damages To Sandy Hook Parents ... Jury Decides.,,8/4/2022 3:01 PM,2022,8,4,15,1
28,Ahmaud Arbery Murderers Judge Upholds Federal Hate Crime Conviction.,,8/4/2022 2:34 PM,2022,8,4,14,34
29,"Monkeypox Crisis Yes, It's in Gay Community Now But WHO Expert Says Brace for Spread.",,8/4/2022 2:14 PM,2022,8,4,14,14
30,Mark Zuckerberg Signed Little League Card Going Up For Auction ... Nothin' Quite Like It!!!,,8/4/2022 12:10 PM,2022,8,4,12,10
31,Hockey Player Kicks Opponent In Face With Skate ... Cops Investigating.,,8/4/2022 12:06 PM,2022,8,4,12,6
32,Ne-Yo Wife Files for Divorce ... Says He Had Kid with Another Woman.,,8/4/2022 11:42 AM,2022,8,4,11,42
33,Machine Gun Kelly Tour Bus Vandalized With Homophobic Slur.,,8/4/2022 11:17 AM,2022,8,4,11,17
34,Breonna Taylor Cops Charged in Her Death ... Civil Rights Violations.,,8/4/2022 10:49 AM,2022,8,4,10,49
35,Malia Obama All Smiles While Out With Mystery Man ... Date To Museum?!,,8/4/2022 10:36 AM,2022,8,4,10,36
36,Airplane Tragedy Pilot Who Died May Have Fallen ... Trying to Eyeball Damaged Landing Gear.,,8/4/2022 8:25 AM,2022,8,4,8,25
37,'Selling Sunset' Heather Rae Young Sues Strip Club ... Don't Use My Pic for Promo!!!,,8/4/2022 7:41 AM,2022,8,4,7,41
38,Brittney Griner Sentenced To 9 Years In Russian Prison ... Biden Slams Ruling.,,8/4/2022 7:32 AM,2022,8,4,7,32
39,Gabby Petitio Foundation Mom Announces $100K Donation For Domestic Violence Prevention.,,8/4/2022 7:27 AM,2022,8,4,7,27
40,Prince William & Kate Middleton Happy Bday Wishes for Meghan Markle ... Despite Family Feud.,,8/4/2022 7:11 AM,2022,8,4,7,11
41,Aaron Rodgers Psychedelics Led To My Best Season ... Helped Me Love Myself.,,8/4/2022 6:50 AM,2022,8,4,6,50
42,Terrell Owens Heated Dispute With Neighbor ... Cops Involved.,,8/4/2022 6:45 AM,2022,8,4,6,45
43,Chuck E. Cheese Mom of Snubbed Kid ... Ramping Up to Sue.,,8/4/2022 1:00 AM,2022,8,4,1,0
44,Post Malone Gamin' For Charity ... Raises Over $200K!!!,,8/4/2022 12:50 AM,2022,8,4,0,50
45,"Tory Lanez Chris Brown Is The True King Of Pop, Here's A $200K Chain To Prove It!!!",,8/4/2022 12:40 AM,2022,8,4,0,40
46,'CHEER' STAR JERRY HARRIS Prison Life Nothing to Cheer About.,,8/4/2022 12:30 AM,2022,8,4,0,30
47,UFC Champ Brandon Moreno 4th Fight w/ Figueiredo Biggest Fight In Division History.,,8/4/2022 12:15 AM,2022,8,4,0,15
48,Guess Who This Kid With Cake Turned Into!,,8/4/2022 12:01 AM,2022,8,4,0,1
49,Bob Saget SCLERODERMA FUNDRAISER TURNS INTO TRIBUTE SHOW ... Celeb Friends Step In.,,8/3/2022 4:59 PM,2022,8,3,16,59
50,Aaron Rodgers Open To Fixing Family Relationship ... 'I Believe In Healing',,8/3/2022 3:44 PM,2022,8,3,15,44
51,Chrissy Teigen I'm Pregnant!!! 'Joy Has Filled Our Home and Hearts Again',,8/3/2022 2:53 PM,2022,8,3,14,53
52,Rep. Jackie Walorski (R-IN) Killed In Car Crash.,,8/3/2022 1:27 PM,2022,8,3,13,27
53,NBA's Iman Shumpert Arrested For Felony Weed Possession ... At Dallas Airport.,,8/3/2022 12:03 PM,2022,8,3,12,3
54,Britney Spears Catholic Church Calls BS ... You Never Asked to Get Married Here!!!,,8/3/2022 12:00 PM,2022,8,3,12,0
55,Alex Jones Sandy Hook Trial Confronted with His Own Texts ... Attys Accidentally Leaked.,,8/3/2022 11:04 AM,2022,8,3,11,4
56,Disney World's Woody Makes Sure Black Kids Greeted ... No Sesame Place Drama!!!,,8/3/2022 9:44 AM,2022,8,3,9,44
57,Vin Scully MLB Honoring Legend With Moments Of Silence ... Before Games.,,8/3/2022 8:54 AM,2022,8,3,8,54
58,NICKI MINAJ Dad's Killer Gets Sentenced to 1 Year.,,8/3/2022 8:48 AM,2022,8,3,8,48
59,Crash Landing Mystery 911 Recording After Pilot Jumped Out of Plane ... Minutes Before Emergency Landing.,,8/3/2022 7:28 AM,2022,8,3,7,28
60,"Naomi Osaka, Cordae We're Still Together!!! ... Rumors Are Bogus.",,8/3/2022 7:22 AM,2022,8,3,7,22
61,Jeff Bezos Mega Yacht Towed Away in Early AM ... Amid Dutch Bridge Outrage.,,8/3/2022 7:10 AM,2022,8,3,7,10
62,Beyonce Monica Lewinsky Gets Stung ... For Asking Bey to Change 'Partition' Lyric.,,8/3/2022 7:05 AM,2022,8,3,7,5
63,Tom Brady Gisele Wishes QB Happy 45th Bday ... Teammate Gets Him Custom GOAT Cake!!!,,8/3/2022 6:52 AM,2022,8,3,6,52
64,Post Roe v. Wade Kansas Votes Overwhelmingly for Abortion Rights.,,8/3/2022 6:14 AM,2022,8,3,6,14
65,L.A. Dodgers Fans Mourn Vin Scully's Death At Stadium ... Build Makeshift Memorial.,,8/3/2022 6:13 AM,2022,8,3,6,13
66,Rep. Nancy Pelosi Little Retail Therapy in Hawaii Before Big Taiwan Trip.,,8/3/2022 1:00 AM,2022,8,3,1,0
67,YING YANG TWINS' D-Roc I'm All Good After Collapse On Stage ... Life Changes On Deck.,,8/3/2022 12:45 AM,2022,8,3,0,45
68,'Vanderpump Rules' Lala Kent Hangin' with 50 Cent After '19 Feud ... We All Good?,,8/3/2022 12:30 AM,2022,8,3,0,30
69,Hasim Rahman Sr. I'll Fight Jake And Logan Paul ... Same Night!!,,8/3/2022 12:15 AM,2022,8,3,0,15
70,Harvey In 'Sabrina The Teenage Witch' 'Memba Him?!,,8/3/2022 12:01 AM,2022,8,3,0,1
71,Vin Scully Dodgers Broadcasting Legend ... Dead At 94.,,8/2/2022 8:30 PM,2022,8,2,20,30
72,"Jon Stewart Vet Bill Pressure Works ... GOP Senators Flip, Pass PACT Act.",,8/2/2022 6:22 PM,2022,8,2,18,22
73,Willow Smith Stops Show After Fan Faints in Crowd.,,8/2/2022 6:12 PM,2022,8,2,18,12
74,LeBron James Hits Lakers Facility W/ Sons ... Epic Workout With My Boys!!!,,8/2/2022 2:57 PM,2022,8,2,14,57
75,'Ferris Bueller' Star Edie McClurg Allegedly Elder Abuse Victim ... Caregiver Allegedly Sexually Assaulted.,,8/2/2022 1:41 PM,2022,8,2,13,41
76,Kanye West Rips Adidas For 'Yeezy Day' ... I Didn't Approve!!!,,8/2/2022 1:12 PM,2022,8,2,13,12
77,Demi Lovato Adds She/Her Pronouns to They/Them ... 'I've Been Feeling More Feminine Recently',,8/2/2022 1:09 PM,2022,8,2,13,9
78,Deshaun Watson Ban NFL In 'Really Tricky' Appeal Situation ... Andrew Brandt Says.,,8/2/2022 12:17 PM,2022,8,2,12,17
79,'Twilight' Star Cam Gigandet Wife Files For Divorce.,,8/2/2022 11:49 AM,2022,8,2,11,49
80,Thomas Markle Tabloid Honcho Files for Restraining Order ... He's Gonna Kill Me!!!,,8/2/2022 11:47 AM,2022,8,2,11,47
81,Soccer Player Attacks Female Ref Over Yellow Card ... Arrested.,,8/2/2022 11:30 AM,2022,8,2,11,30
82,Paraglider Narrowly Cheats Death ... Terrifying Scene Caught On Video.,,8/2/2022 10:05 AM,2022,8,2,10,5
83, Dev Patel Breaks Up Knife Fight in Australia ... Lady Allegedly Stabs Man!!! ,,8/2/2022 8:17 AM,2022,8,2,8,17
84,Airbnb Deletes Former Slave Quarters From Platform After Users Find Listing.,,8/2/2022 7:45 AM,2022,8,2,7,45
85, Angelina Jolie Mama's Got Moves!!! Hits Dance Floor at Daughter's College Event ,,8/2/2022 7:33 AM,2022,8,2,7,33
86, Chris Brown Defends Intimate Photos with Fans During Meet-and-Greets ,,8/2/2022 6:34 AM,2022,8,2,6,34
87,Blueface Fights Chrisean Rock on Streets of Hollywood ... Caught on Video.,,8/2/2022 6:25 AM,2022,8,2,6,25
88, Tiger Woods Turned Down LIV Golf's $700-$800 Mil ... Greg Norman Says ,,8/2/2022 6:11 AM,2022,8,2,6,11
89,ANA DE ARMAS Cuban Accent in Marilyn Monroe Pic Defended ... By Marilyn's Estate.,,8/2/2022 1:00 AM,2022,8,2,1,0
90, '90 DAY FIANCE' JORGE NAVA Gets Married in Vegas ,,8/2/2022 12:50 AM,2022,8,2,0,50
91, Ansel Elgort Making Out with Woman in Italy ... Amid GF Breakup Rumors ,,8/2/2022 12:40 AM,2022,8,2,0,40
92," 'WHY DON'T WE' DANIEL SEAVEY Gets Restraining Order Against Fan Who Broke Into House, Slept in Bed ",,8/2/2022 12:30 AM,2022,8,2,0,30
93, Jake Paul Challenged By Bola Osundairo ... Fight Me Saturday!! ,,8/2/2022 12:20 AM,2022,8,2,0,20
94, Guess Who This Toothy Kiddo Turned Into! ,,8/2/2022 12:01 AM,2022,8,2,0,1
95, Ben and Jen See The Marriage Certificate ... From Las Vegas Wedding ,,8/1/2022 5:34 PM,2022,8,1,17,34
96, Chuck E. Cheese Mom Accuses Mouse of Racial Discrimination For Ignoring Kid's High Five ,,8/1/2022 3:33 PM,2022,8,1,15,33
97, Killer Mike & 2 Chainz Rip ATL City Council Over ‘Nuisance’ Ban ... Don’t Silence the Little Guys!!! ,,8/1/2022 2:33 PM,2022,8,1,14,33
98, Deshaun Watson Women Org. Rips 6 Game Suspension ... 'Insulting & Dangerous!' ,,8/1/2022 2:32 PM,2022,8,1,14,32
99, Australia $1.8K McCrackdown on McMuffins ... Passenger Fined for Food in Luggage ,,8/1/2022 1:28 PM,2022,8,1,13,28
100, Jon Stewart D.C. Shouting Match Over Vet Bill ... Makes Peace Afterward ,,8/1/2022 12:51 PM,2022,8,1,12,51
101, Lil Durk Taking Time Off to Recover After Explosion on Stage ,,8/1/2022 10:48 AM,2022,8,1,10,48
102, Beyonce Taking Out Line In 'Renaissance' Album ... Following Ableist Backlash ,,8/1/2022 8:39 AM,2022,8,1,8,39
103, Drake Tests Positive For Covid-19 ... Young Money w/ Wayne and Nicki POSTPONED!!! ,,8/1/2022 8:37 AM,2022,8,1,8,37
104, Donald Trump Blasts Brittney Griner For Going To Russia 'Loaded Up With Drugs' ,,8/1/2022 8:14 AM,2022,8,1,8,14
105," Mystikal Arrested for Rape, DV in Louisiana ",,8/1/2022 7:50 AM,2022,8,1,7,50
106, Justin Bieber I'm Back!!! Performs for 1st Time Since Paralysis ,,8/1/2022 7:16 AM,2022,8,1,7,16
107, Johnny-Amber Unsealed Docs Sis Whitney Allegedly Confessed That Amber Had Cut Off His Finger ,,8/1/2022 6:57 AM,2022,8,1,6,57
108, Pilot Found Dead Exits Plane Midair Without Parachute ... Death Remains Mystery ,,8/1/2022 6:43 AM,2022,8,1,6,43
109, Elon Musk's Dad I'm Not Proud of My Son ... And He Needs to Lose Weight ,,8/1/2022 6:42 AM,2022,8,1,6,42
110, Deshaun Watson Suspended Six Games ... Over Sexual Misconduct Allegations ,,8/1/2022 5:57 AM,2022,8,1,5,57
111," 'Why Don't We' Daniel Seavey Obsessed Fan Breaks Into Home ... Sleeps in His Bed, Puts On His Clothes ",,8/1/2022 1:00 AM,2022,8,1,1,0
112, 'Vanderpump Rules' Tom and Katie Divorce Tension Captured on Camera ,,8/1/2022 12:40 AM,2022,8,1,0,40
113," Ex-UDub Star Ben Burr-Kirven Huskies Should Bolt From Pac-12 ... Join Big Ten, Big 12!!! ",,8/1/2022 12:20 AM,2022,8,1,0,20
114, Machine Gun Kelly Mini-Me Rocks Out Onstage ... Stuns MGK and Crowd!!! ,,8/1/2022 12:10 AM,2022,8,1,0,10
115, Pop Band 'Hanson' 'Memba Them?! ,,8/1/2022 12:01 AM,2022,8,1,0,1
116, 'Little Mermaid' Star Pat Carroll Voice of Ursula Dead at 95 ,,7/31/2022 3:36 PM,2022,7,31,15,36
117, Sylvester Stallone Again Lashes Out at 'Rocky' Producer Over 'Drago' Spin-Off Film ,,7/31/2022 2:47 PM,2022,7,31,14,47
118, 'WandaVision' Star Elizabeth Olsen Rockin' & Rollin' with Hubby ... At Wild Hearts Tour Stop!!! ,,7/31/2022 2:27 PM,2022,7,31,14,27
119, Ana de Armas Spanish Accent Picked Apart ... In New Marilyn Trailer ,,7/31/2022 1:26 PM,2022,7,31,13,26
120, 'Star Trek' Star Nichelle Nichols Dead at 89 ,,7/31/2022 12:22 PM,2022,7,31,12,22
121," Amber Heard Sells Yucca Valley Home, Over $1 Mil ... Scores Major Profit ",,7/31/2022 11:22 AM,2022,7,31,11,22
122, NBA Legend & Celtics Great Bill Russell Dead at 88 ,,7/31/2022 10:42 AM,2022,7,31,10,42
123, Ying Yang Twins D-Roc Collapses on Stage ,,7/31/2022 7:07 AM,2022,7,31,7,7
124, J Lo Enough Honeymoon Already!!! Performs at Ukrainian Relief Concert ,,7/31/2022 7:00 AM,2022,7,31,7,0
125," Chris Rock I Got Slapped by Suge Smith ... Take That, Will! ",,7/31/2022 6:22 AM,2022,7,31,6,22
126, JAYDAYOUNGAN Ambushed By 5 Gunmen ... Dad Details Fatal Shooting ,,7/31/2022 1:00 AM,2022,7,31,1,0
127," Billy Porter SCOTUS IS COMING FOR GAY MARRIAGE ... Slippery Slope, Clarence!!! ",,7/31/2022 12:50 AM,2022,7,31,0,50
128, Ric Flair I'm 'Drinking Every Night' Before Final Fight ... I'm No Good Sober!!! ,,7/31/2022 12:40 AM,2022,7,31,0,40
129, Luci Fang Sink Your Teeth Into Her Hot Shots! ,,7/31/2022 12:30 AM,2022,7,31,0,30
130, Nicky Champa and Pierre Boo TikTok Couple's Bell Canyon Home ... Hittin' The Market for Lots Of Dough!!! ,,7/31/2022 12:15 AM,2022,7,31,0,15
131, Celebrity Scramble Guess Who! ,,7/31/2022 12:01 AM,2022,7,31,0,1
132, Jake Paul Hasim Rahman Jr. Fight Canceled ... Over Weight Issue ,,7/30/2022 5:40 PM,2022,7,30,17,40
133, Taylor Swift Fan Claim She Donated to Environment Charity??? Likely BS Amid Jet Backlash ,,7/30/2022 3:10 PM,2022,7,30,15,10
134," Dave Chappelle Tokes Up, Performs with Snoop ... Wifey Likes to Party Too!!! ",,7/30/2022 2:20 PM,2022,7,30,14,20
135, Kate Bush's 'Wuthering Heights' Fans Gather En Masse to Dance ... All These People in Red!!! ,,7/30/2022 1:18 PM,2022,7,30,13,18
136, President Biden I Got Covid Again ... After Days of Being Negative ,,7/30/2022 12:25 PM,2022,7,30,12,25
137, Arnold Schwarzenegger Shout-Out to My Late Mother ... Day Before My 75th Bday!!! ,,7/30/2022 11:55 AM,2022,7,30,11,55
138, Drake Brings Out Nelly Furtado at OVO Fest ... Crowd Loses It ,,7/30/2022 11:02 AM,2022,7,30,11,2
139, Ivana Trump Pics of Gravesite Go Viral ... Bare at DT's Golf Course ,,7/30/2022 10:33 AM,2022,7,30,10,33
140, China Rocket Debris Expected To Rain Down On Earth ... AGAIN!!! ,,7/30/2022 9:34 AM,2022,7,30,9,34
141, NY Gov. Hochul Orders Disaster Emergency ... As Monkeypox Cases Keep Stacking Up ,,7/30/2022 8:01 AM,2022,7,30,8,1
142, Mega Millions Lottery Single Winner Snags $1.28 BILLION!!! ,,7/30/2022 7:07 AM,2022,7,30,7,7
143, Bill Maher Drags Elon for Celebrating Population Explosion ... Just an Excuse Not to Wear a Condom!!! ,,7/30/2022 6:24 AM,2022,7,30,6,24
144, Britney Spears My Book is Done!!! ... But There's No Paper to Print it On!!! ,,7/30/2022 1:00 AM,2022,7,30,1,0
145," IG Model Gena Tew AIDS Has Taken Away My Mobility, Left Me Blind in One Eye ",,7/30/2022 12:55 AM,2022,7,30,0,55
146, Stars and Scars You Be the judge ,,7/30/2022 12:50 AM,2022,7,30,0,50
147, Congressman Colin Allred U.S. Made Russia 'A Very Good Offer' For Brittney Griner ... 'I Think It's Going To Get Done' ,,7/30/2022 12:45 AM,2022,7,30,0,45
148, July 2022 Hot Shots Bae Watch Alert! ,,7/30/2022 12:30 AM,2022,7,30,0,30
149, HEROIC PIZZA DELIVERY GUY I'm NASCAR's Special Guest ... Catch Me At The Brickyard!!! ,,7/30/2022 12:20 AM,2022,7,30,0,20
150, Polo G Roughed Up During 2021 Miami Arrest ... 'They Are Trying To Lynch Me!!!' ,,7/30/2022 12:10 AM,2022,7,30,0,10
151, What's The Big Frigin' Difference?! ,,7/30/2022 12:01 AM,2022,7,30,0,1
152, Jimmy Sohns 'G-L-O-R-I-A' Singer Dead at 75 ,,7/29/2022 5:29 PM,2022,7,29,17,29
153, Jennifer Lopez Rehearsing For Capri Concert ... Charity Event For Ukraine ,,7/29/2022 5:07 PM,2022,7,29,17,7
154," DJ Khaled & 'Pee' Thomas Yes, We're Millionaires ... But $1.2 Bil Lottos Don't Come Often!!! ",,7/29/2022 4:27 PM,2022,7,29,16,27
155, Beyonce Album Looks High Fashion From B’Day to Lemonade And Now Renaissance!!! ,,7/29/2022 3:41 PM,2022,7,29,15,41
156, Netflix Sues Barlow & Bear for Musical ... Thou Hath Stolen Our 'Bridgerton!!!' ,,7/29/2022 2:29 PM,2022,7,29,14,29
157, Shakira Prosecutors Want Her To Serve 8-Year Prison Sentence ... In Tax Fraud Case ,,7/29/2022 1:51 PM,2022,7,29,13,51
158, Top H.S. Recruit Aidan Mizell Commits To Florida ... Brings Out Gators For Ceremony!!! ,,7/29/2022 12:25 PM,2022,7,29,12,25
159," Jennifer Lopez Gets a Lift, Grabs a Bite in Capri While Ben Hangs in L.A. ",,7/29/2022 11:51 AM,2022,7,29,11,51
160," Taylor Swift, Kim K, Blake Shelton Celebs Flyin' Private ... Leaving Huge Carbon Footprint!!! ",,7/29/2022 10:47 AM,2022,7,29,10,47
161, Rev. Jesse Jackson Sends Letter to Sesame Place ... Ideas to End Racial Discrimination ,,7/29/2022 10:18 AM,2022,7,29,10,18
162, Tyga Sorry for Mocking Mexican-Americans Takes Down Offensive Video ,,7/29/2022 10:16 AM,2022,7,29,10,16
163, Shanna Moakler All Smiles At Dave & Buster's With BF... Hours After Domestic Violence Call ,,7/29/2022 8:14 AM,2022,7,29,8,14
164, Dua Lipa Apologizes for Fireworks Inside Concert ... New Video Shows the Terror ,,7/29/2022 7:39 AM,2022,7,29,7,39
165, Will Smith 'I Am Deeply Remorseful' For Slapping Chris Rock ,,7/29/2022 7:28 AM,2022,7,29,7,28
166," Beyonce 'Renaissance' is Here, S/O Beyhive!!! Thanks for 'Love & Protection' Over Leak ",,7/29/2022 7:18 AM,2022,7,29,7,18
167, Supreme Court Justice Alito Mocks Prince Harry For Bashing Decision overturning Roe v. Wade ,,7/29/2022 6:49 AM,2022,7,29,6,49
168, Bob Dylan Accuser Drops Sex Abuse Suit ,,7/29/2022 6:36 AM,2022,7,29,6,36
169, Jeff Ross Jon Stewart Feels the Pain of Veterans ... He Really Should Run for Prez!!! ,,7/29/2022 6:31 AM,2022,7,29,6,31
170, Ukraine Prez Volodymyr Zelensky Strong Support For Vogue Shoot ... From Ukrainian Relief Orgs ,,7/29/2022 1:00 AM,2022,7,29,1,0
171, Jeff Bezos' Parents Buy MORE Real Estate ... Real Housewife's $44 Mil FL Mansion!!! ,,7/29/2022 12:30 AM,2022,7,29,0,30
172, Jon Stewart Calls BS on Ted Cruz ... You're Lying About the Vet Bill!!! ,,7/29/2022 12:20 AM,2022,7,29,0,20
173, Ric Flair On Vince McMahon's WWE Retirement: ... 'I Hate It' ,,7/29/2022 12:10 AM,2022,7,29,0,10
174, Guess Who This Georgia Peach Turned Into! ,,7/29/2022 12:01 AM,2022,7,29,0,1
175, Shanna Moakler Cops Respond to 'Domestic Disturbance' Call ,,7/28/2022 6:31 PM,2022,7,28,18,31
176, Monkey Attacks Terrorizing Japanese City ... Trying to Snatch Human Babies!!! ,,7/28/2022 6:20 PM,2022,7,28,18,20
177," Candace Cameron Bure Vs. JoJo Siwa Daughter Rips JoJo ... Photo Snub's No Biggie, Grow Up!!! ",,7/28/2022 5:53 PM,2022,7,28,17,53
178, 'Long Island Medium' Theresa Defends Buying 5-Month-Old Granddaughter Gucci Bag ... Cutest Binki Holder Ever!!! ,,7/28/2022 4:19 PM,2022,7,28,16,19
179, Dwight Howard Crashes WWE Tryout ... Cuts Epic Promo!! ,,7/28/2022 3:36 PM,2022,7,28,15,36
180," Joey Badass Fans Gotta Chill, Chris Brown Has My Respect And Delta Can Too, IF ... ",,7/28/2022 3:33 PM,2022,7,28,15,33
181, Report: Zion Williamson Weight Clause In New Contract Could Lose Guaranteed $$$ ,,7/28/2022 2:58 PM,2022,7,28,14,58
182, Beyoncé Catches R&Beef From Kelis!!! Claims Sample Was Stolen ,,7/28/2022 1:41 PM,2022,7,28,13,41
183, Mike Evans Unveils New Harry Potter Tattoo 'But I Am The Chosen One' ,,7/28/2022 12:19 PM,2022,7,28,12,19
184, Lamar Odom My Social Media's Been Highjacked ... Old Manager Costing Me $$ ,,7/28/2022 12:00 PM,2022,7,28,12,0
185, Jon Stewart Obliterates GOP for Blocking Vet Bill ... 'Sen. Toomey Is a F***ing Coward' ,,7/28/2022 10:26 AM,2022,7,28,10,26
186," Aniston, Kimmel & Bateman A-List Vacay Pals Return to L.A.!!! Back from the Bahamas ",,7/28/2022 9:05 AM,2022,7,28,9,5
187," Hong Kong Concert Video Monitor Falls, Crushing Dancers Below ",,7/28/2022 9:01 AM,2022,7,28,9,1
188, Dua Lipa Fans Light Fireworks Inside Arena ... Cops Investigating ,,7/28/2022 8:45 AM,2022,7,28,8,45
189," Johnny Depp Oui, We Love You!!! Fans Swarm in Paris ",,7/28/2022 6:45 AM,2022,7,28,6,45
190, Sesame Place $25 Million Class Action Suit Claiming Racism ,,7/28/2022 6:43 AM,2022,7,28,6,43
191," Gwenyth Paltrow Hey Hailey, I f***ed your Father!!! ... True Bathroom Humor ",,7/28/2022 6:23 AM,2022,7,28,6,23
192, Michael Savarino Coach K's Grandson ... Pleads Guilty To DWI ,,7/28/2022 6:16 AM,2022,7,28,6,16
193, Angie Everhart Accused of Egging Neighbor's Apartment Cops Called to Scene ,,7/28/2022 1:00 AM,2022,7,28,1,0
194, Tichina Arnold Divorce Finalized ... I'm Finally Single!!! ,,7/28/2022 12:30 AM,2022,7,28,0,30
195, 'Love & Marriage' Melody Shari Ex Martell Holt Hasn't Changed ... He's Still Disrespectful!!! ,,7/28/2022 12:20 AM,2022,7,28,0,20
196, Wrestling Star Hornswoggle Defends Jerry Jones' M-Word Use 'Didn't Need To Apologize' ,,7/28/2022 12:10 AM,2022,7,28,0,10
197, Kendall & Kylie's Nanny In Season 1 of 'KUWTK' 'Memba Her?! ,,7/28/2022 12:01 AM,2022,7,28,0,1
198, JayDaYoungan Shot and Killed Outside Home ,,7/27/2022 8:46 PM,2022,7,27,20,46
199, Mike Tyson Using Cane To Get Around ... But I'm OK!!! ,,7/27/2022 3:56 PM,2022,7,27,15,56
200," Britney Spears Will Not Be Deposed, Judge Rules ",,7/27/2022 3:26 PM,2022,7,27,15,26
201, Jeff Bezos Parents Buy $34M Mega Mansion in FL ,,7/27/2022 3:01 PM,2022,7,27,15,1
202, Joey Chestnut Downs 44 Cane's Chicken Fingers In Five Minutes!!! ... World Record ,,7/27/2022 2:06 PM,2022,7,27,14,6
203, Brittney Griner I Flew To Russia Despite Travel Warning ... So I Could Help My Team ,,7/27/2022 1:06 PM,2022,7,27,13,6
204, Tony Dow 'Leave It To Beaver' Star Dead At 77 ,,7/27/2022 12:27 PM,2022,7,27,12,27
205, Beyoncé ‘Renaissance’ Album Leak Beyhive Says Not So Fast!!! ,,7/27/2022 12:02 PM,2022,7,27,12,2
206, Ukrainian Prez Volodymyr Zelensky Dragged Over Vogue Cover Shoot with Wife ,,7/27/2022 10:15 AM,2022,7,27,10,15
207, GEORGE FLOYD'S DEATH Former Cops Get Prison Time ... For Violating His Civil Rights ,,7/27/2022 10:14 AM,2022,7,27,10,14
208, Kanye West Gifts A$AP Bari New Maybach… Days After He Wrecked His Old One!!! ,,7/27/2022 8:18 AM,2022,7,27,8,18
209, Norman Lear Singin' 'That's Amore' At 100 ... The Miracle of Being Alive!!! ,,7/27/2022 8:14 AM,2022,7,27,8,14
210, Jamie Foxx Wild Sing-along on Italian Vacay ... 'I'm Jamie Motherf***ing Foxx!!!' ,,7/27/2022 8:02 AM,2022,7,27,8,2
211, 'Top Chef' Star Howard Kleinberg Dead at 46 ,,7/27/2022 7:39 AM,2022,7,27,7,39
212, Shawn Mendes Cancels Tour ... For Mental Health Break ,,7/27/2022 7:17 AM,2022,7,27,7,17
213, Mama June Honey Boo Boo Too Young For Gastric Sleeve!!! ,,7/27/2022 1:00 AM,2022,7,27,1,0
214, Britney Spears Lawyer Doubles Down ... She Won't Sit for Depo or Testify at Trial,,7/26/2022 4:31 PM,2022,7,26,16,31
215, Jerry Jones Apologizes For Derogatory Term ... At Cowboys Camp ,,7/26/2022 4:23 PM,2022,7,26,16,23
216, Buzz Aldrin Apollo 11 Jacket Sells For $2.7 Mil ... Space Artifact Record!!!,,7/26/2022 4:17 PM,2022,7,26,16,17
217, Donald Trump Protesters Flood Hotel ... For 1st Speech Back in D.C. Since Jan. 6,,7/26/2022 3:27 PM,2022,7,26,15,27
218, Kevin Hart Shames Ex-NFLer Over Nudist Colony Hobby With Wife ... 'You Hear Whatchu Sayin'!?!',,7/26/2022 2:27 PM,2022,7,26,14,27
