,headline,tags,timestamp,year,month,day,hour,minute
125,"Fat Joe Announces One-Man Show To Tell Life Story, With Special Intro From Dave Chappelle!!!","['Fat Joe', 'Dave Chappelle', 'Mike Tyson', 'Humor', 'Hip Hop', 'Comedy', 'Exclusive', 'Music']",8/19/2022 12:10 AM,2022.0,8.0,19.0,0.0,10.0
126,Jonny Drubel From 'Rich Kids Of Beverly Hills' 'Memba Him?!,"['Morgan Stewart', 'Reality TV', 'Memba Them', 'Photo Galleries']",8/19/2022 12:01 AM,2022.0,8.0,19.0,0.0,1.0
127,Mob Boss Whitey Bulger 3 Men Indicted Over Prison Killing.,"['Whitey Bulger', 'Crime & Arrests', 'Celebrity Death', 'Crime', 'Controversial S#!T', 'Fairly Legal']",8/18/2022 3:41 PM,2022.0,8.0,18.0,15.0,41.0
128,J Lo & Ben Low Key Strollin' Before Weekend Wedding Bash!!!,"['Jennifer Lopez', 'Ben Affleck', 'Movies', 'Couples', 'Party All The Time', 'Tying The Knot', 'Music']",8/18/2022 3:37 PM,2022.0,8.0,18.0,15.0,37.0
129,"818 Tequila Kim, Kylie, Orlando & A-Listers Meet ... On The Eve Of 8/18.","['Kendall Jenner', 'Kim Kardashian', 'Khloe Kardashian', 'Kylie Jenner', 'Money', 'Reality TV', 'Drugs & Alcohol', 'Models', 'The Kardashians']",8/18/2022 1:39 PM,2022.0,8.0,18.0,13.0,39.0
130,"Kobe Bryant Photo Trial Supervisor Called Pics 'Plutonium,' Urged Deletion ... LACFD Official Testifies.","['Kobe Bryant', 'Vanessa Bryant', 'Gianna Bryant', 'Family', 'TMZ Sports', 'Basketball', 'celebrity kids', 'NBA', 'Crime', 'Los Angeles Lakers', 'Controversial S#!T', 'Fairly Legal']",8/18/2022 1:19 PM,2022.0,8.0,18.0,13.0,19.0
131,Young Thug Denied Bond AGAIN In YSL Rico Case ... Lawyer Says They're Preparing For Trial.,"['Young Thug', 'Gunna', 'Crime & Arrests', 'Hip Hop', 'Music', 'Fairly Legal']",8/18/2022 1:11 PM,2022.0,8.0,18.0,13.0,11.0
132,R. Kelly Trial Alleged Victim Claims They Had Sex When She Was 15.,"['R. Kelly', 'Hip Hop', 'Sex', 'Kids', 'Music', 'Fairly Legal']",8/18/2022 12:51 PM,2022.0,8.0,18.0,12.0,51.0
133,Chris Brown My Meet & Greets Are a Hit!!! Artists Starting to Care About Their Fans Again.,"['Chris Brown', 'Hip Hop', 'Music']",8/18/2022 12:31 PM,2022.0,8.0,18.0,12.0,31.0
134,Deshaun Watson Women's Orgs Rip Suspension ... 'Nowhere Near Enough',"['Deshaun Watson', 'Cleveland Browns', 'TMZ Sports', 'Controversial S#!T', 'Fairly Legal', 'Football', 'NFL']",8/18/2022 12:15 PM,2022.0,8.0,18.0,12.0,15.0
135,"Brad Pitt 'Grateful' For $20M Settlement In Katrina Suit ... Thanks, Global Green!!!","['Brad Pitt', 'Money', 'Movies', 'Exclusive', 'Fairly Legal']",8/18/2022 10:21 AM,2022.0,8.0,18.0,10.0,21.0
136,"Finnish Prime Minister In Hot Water For Partying Hard On Camera ... Politicians Want Her Drug Tested, Make Results Public.","['You Might Want to Rethink', 'Party All The Time', 'Drugs & Alcohol', 'Politix', 'Controversial S#!T']",8/18/2022 10:08 AM,2022.0,8.0,18.0,10.0,8.0
137,"Nappy Roots Rapper Scales Shot, Robbed & Kidnapped... At His Own Restaurant.","['Hip Hop', 'Nurse!', 'Crime', 'Music', 'Health']",8/18/2022 9:58 AM,2022.0,8.0,18.0,9.0,58.0
138,"Deshaun Watson Suspended 11 Games, Fined $5 Mil ... But QB Says He's Innocent.","['Deshaun Watson', 'Money', 'Cleveland Browns', 'TMZ Sports', 'Controversial S#!T', 'Fairly Legal', 'Football', 'NFL']",8/18/2022 8:56 AM,2022.0,8.0,18.0,8.0,56.0
139,Lamar Odom Check Out My New Pearly Whites!!! ... $80k Veneer Procedure.,"['Lamar Odom', 'Money', 'Cosmetic Surgery', 'TMZ Sports', 'Basketball', 'NBA', 'Exclusive']",8/18/2022 8:47 AM,2022.0,8.0,18.0,8.0,47.0
140,Linda Evangelista still Struggling After Cosmetic Procedure ... Side Effect Is hating Yourself!!!,"['Linda Evangelista', 'Beauty', 'Cosmetic Surgery', 'Models', 'Health']",8/18/2022 8:28 AM,2022.0,8.0,18.0,8.0,28.0
141,Michael BublÃ© Baby #4's Almost Here!!! Named (Sorta) After TMZ Photog!!!,"['Luisana Lopilato', ""Michael Buble'"", 'Family', 'Baby Watch', 'Music']",8/18/2022 8:19 AM,2022.0,8.0,18.0,8.0,19.0
142,"Dick Vitale I'm Cancer Free, Baby!!! 'My Prayers Were Answered'","['Dick Vitale', 'TMZ Sports', 'NCAA', 'Basketball', 'Health', 'ESPN']",8/18/2022 8:16 AM,2022.0,8.0,18.0,8.0,16.0
143,Lil Durk Appears To Be A-OK After Scary Eye Injury ... Resurfaces On DJ Khaled Hype Train!!!,"['DJ Khaled', 'Lil Durk', 'Hip Hop', 'Nurse!', 'Music']",8/18/2022 8:10 AM,2022.0,8.0,18.0,8.0,10.0
144,Kanye West Defends Yeezy Gap 'Trash Bag' Displays Blasts Media for Criticism.,"['Kanye West', 'Hip Hop', 'Fashion', 'Music']",8/18/2022 6:57 AM,2022.0,8.0,18.0,6.0,57.0
145,FIU Linebacker Luke Knox Dead At 22 ... Dawson Knox's Brother.,"['RIP', 'Family', 'TMZ Sports', 'NCAA', 'Buffalo Bills', 'Football']",8/18/2022 6:35 AM,2022.0,8.0,18.0,6.0,35.0
146,Nicholas Brendon Hospitalized After Another 'Cardiac Incident',"['Nicholas Brendon', 'TV', 'Movies', 'Nurse!', 'Health']",8/18/2022 6:12 AM,2022.0,8.0,18.0,6.0,12.0
147,"Dodgers Reporter David Vassegh Breaks Arm, Fractures 6 Ribs ... In Brewers Slide Mishap.","['Justin Turner', 'Los Angeles Dodgers', 'TV', 'TMZ Sports', 'Nurse!', 'Health', 'MLB', 'Baseball']",8/18/2022 5:59 AM,2022.0,8.0,18.0,5.0,59.0
148,Dog The Bounty Hunter Getting Tips on Kiely Rodni Disappearance Reluctant to Jump In.,"['Dog Chapman', 'Gabby Petito', 'TV', 'Reality TV', 'Crime', 'Exclusive', 'Controversial S#!T', 'Police']",8/18/2022 1:00 AM,2022.0,8.0,18.0,1.0,0.0
149,'RuPaul's Drag Race' Star Denies Stealing Hundreds from Audience Member ... Police Investigating.,"['Money', 'Hot Vegas', 'LGBT', 'Reality TV', 'Crime', 'Exclusive', 'Controversial S#!T', 'Fairly Legal', 'Police']",8/18/2022 12:50 AM,2022.0,8.0,18.0,0.0,50.0
150,Styles P I'll Boycott Verzuz if Swizz & Tim Leave Triller ... Culture Vulture Behavior!!!,"['Timbaland', 'Swizz Beatz', 'You Might Want to Rethink', 'Money', 'Hip Hop', 'Exclusive', 'Controversial S#!T', 'Music']",8/18/2022 12:40 AM,2022.0,8.0,18.0,0.0,40.0
151,Antonio Brown Look Out For My 'Put That Sh*t On' Music Video!!!,"['Antonio Brown', 'Bling!', 'Hip Hop', 'TMZ Sports', 'Exclusive', 'Music', 'Football', 'NFL']",8/18/2022 12:30 AM,2022.0,8.0,18.0,0.0,30.0
152,Michael Irvin Attempts To Stop Bar Fight But Patrons Brawl Anyway!!!,"['Michael Irvin', 'Fights', 'TMZ Sports', 'Exclusive', 'ESPN', 'Football', 'Dallas Cowboys', 'NFL']",8/18/2022 12:15 AM,2022.0,8.0,18.0,0.0,15.0
153,Guess Who This Novice Rider Turned Into!,"['Kids', 'celebrity kids', 'Photo Galleries']",8/18/2022 12:01 AM,2022.0,8.0,18.0,0.0,1.0
154,"Anne Heche Cause of Death Revealed Smoke Inhalation, Burn Injuries.","['Anne Heche', 'RIP', 'Celebrity Death', 'Breaking News']",8/17/2022 3:32 PM,2022.0,8.0,17.0,15.0,32.0
155,Selena Gomez Hangin' Out with Tyga After Closing Time ... At Popular L.A. Hot Spot.,"['Tyga', 'Selena Gomez', 'Hip Hop', 'Relationships', 'Restaurants & Nightclubs', 'Music']",8/17/2022 3:10 PM,2022.0,8.0,17.0,15.0,10.0
156,'Texas Flip N Move' Star 'Lone Wolf' Randy Martin Dead at 65 ... After Cancer Battle.,"['RIP', 'TV', 'Reality TV', 'Celebrity Death', 'Exclusive', 'Health']",8/17/2022 2:58 PM,2022.0,8.0,17.0,14.0,58.0
157,Mattel Sues Snack Co. Over Nicki Minaj Chips ... 'Barbie-Que' Not Sitting Right With Them.,"['Nicki Minaj', 'Money', 'Hip Hop', 'Music', 'Fairly Legal', 'Famous Food']",8/17/2022 2:12 PM,2022.0,8.0,17.0,14.0,12.0
158,Christine Quinn Not Coming Back To 'Selling Sunset',"['Christine Quinn', 'TV', 'Netflix', 'Reality TV', 'Fashion', 'Exclusive', 'Coronavirus']",8/17/2022 1:43 PM,2022.0,8.0,17.0,13.0,43.0
159,'Deadliest Catch' Russia Launches Missile After Fishing Dispute 'Did Russia Shoot A F---ing Missile?!!',"['Discovery', 'Insane Videos', 'Viral', 'News']",8/17/2022 1:06 PM,2022.0,8.0,17.0,13.0,6.0
160,Cleveland Browns Replace Field After MGK Concert ... Org. Says It Was Planned.,"['Machine Gun Kelly', 'Cleveland Browns', 'Exclusive Details', 'TMZ Sports', 'Music', 'Football', 'NFL']",8/17/2022 11:20 AM,2022.0,8.0,17.0,11.0,20.0
161,Mullet Championship Finalists Picked ... Whose Got The Best Party in The Back?!!,"['Money', 'Beauty', 'Kids']",8/17/2022 11:14 AM,2022.0,8.0,17.0,11.0,14.0
162,"R. Kelly Chicago Case Opening Statements Underway ... '08 Teen, Tapes Mentioned.","['R. Kelly', 'Hip Hop', 'Sex', 'Kids', 'Controversial S#!T', 'Music', 'Fairly Legal', 'Pornography']",8/17/2022 10:44 AM,2022.0,8.0,17.0,10.0,44.0
163,A$AP Rocky Pleads Not Guilty in Felony Firearms Case.,"['A$AP Rocky', 'Weapons & Guns', 'Hip Hop', 'Music', 'Fairly Legal']",8/17/2022 10:09 AM,2022.0,8.0,17.0,10.0,9.0
164,"Bruce Willis' Daughters Settle 'Die Hard' Debate Jingle All the Yippee-Ki-Yay Way, MF!!!","['Scout Willis', 'Rumer Willis', 'Bruce Willis', 'Family', 'Movies', 'Holidaze']",8/17/2022 9:04 AM,2022.0,8.0,17.0,9.0,4.0
165,The Chainsmokers T.I. Punched Me In The Face ... And I Totally Deserved It!!!,"['T.I.', 'The Chainsmokers', 'You Might Want to Rethink', 'Hip Hop', 'Restaurants & Nightclubs', 'Party All The Time', 'Music', 'Fights & Feuds']",8/17/2022 9:00 AM,2022.0,8.0,17.0,9.0,0.0
166,Chris Brown Houston Woman Files Docs to Get Show Canceled ... Judge Shuts Her Down.,"['Lil Baby', 'Chris Brown', 'Money', 'Hip Hop', 'Music', 'Fairly Legal']",8/17/2022 8:57 AM,2022.0,8.0,17.0,8.0,57.0
167,Ironman Athlete Brian Kozera Dead At 44 After Bicycle Crash ... In Pennsylvania.,"['RIP', 'Car Crashes', 'TMZ Sports', 'Fitness & Exercise', 'Nurse!', 'Health']",8/17/2022 8:37 AM,2022.0,8.0,17.0,8.0,37.0
168,Aqib Talib Incited Brawl Before Fatal Shooting ... Witnesses Claim.,"['Aqib Talib', 'Weapons & Guns', 'TMZ Sports', 'Kids', 'Football']",8/17/2022 8:08 AM,2022.0,8.0,17.0,8.0,8.0
169,Devin Booker Proud Boyfriend ... Salivates Over ðŸ”¥ Kendall Shots.,"['Kendall Jenner', 'Devin Booker', 'Hot Bodies', 'TMZ Sports', 'Basketball', 'Couples', 'NBA', 'Models']",8/17/2022 7:52 AM,2022.0,8.0,17.0,7.0,52.0
170,The Game Blocks White Rapper Who Stuck Up for Eminem Put Your Money Where Your Mouth Is!!!,"['Eminem', 'The Game', 'Hip Hop', 'Instagram', 'Controversial S#!T', 'Music', 'Celebrity Feuds']",8/17/2022 7:50 AM,2022.0,8.0,17.0,7.0,50.0
171,Joe Rogan Invokes 14-Year-Old Daughter ... In Heated Abortion Debate.,"['Joe Rogan', 'TMZ Sports', 'Politix', 'Controversial S#!T']",8/17/2022 7:36 AM,2022.0,8.0,17.0,7.0,36.0
172,Jamie Foxx My Flick Has Been Shelved For Years ... Claims Victim of Cancel Culture.,"['Jamie Foxx', 'Robert Downey Jr.', 'You Might Want to Rethink', 'Movies', 'Comedy', 'Controversial S#!T']",8/17/2022 6:55 AM,2022.0,8.0,17.0,6.0,55.0
173,Motley Crue Concert Fan Apparently Falls from Upper Level ... Rushed to Hospital.,"['Nurse!', 'Music', 'Health', 'Motley Crue']",8/17/2022 6:45 AM,2022.0,8.0,17.0,6.0,45.0
174,Jake Paul Whiffs Badly During BP ... Redeems Himself With First Pitch.,"['Jake Paul', 'TMZ Sports', 'UFC', 'Viral', 'MLB', 'Baseball']",8/17/2022 6:44 AM,2022.0,8.0,17.0,6.0,44.0
175,"Fatal Plane Accident Pilot May Have Jumped After Botched Landing, NTSB Says.","['RIP', 'Viral', 'News']",8/17/2022 6:38 AM,2022.0,8.0,17.0,6.0,38.0
176,Little Leaguer Easton Oliverson Breathing Tube Removed ... After Bunk Bed Fall.,"['TMZ Sports', 'Kids', 'Health', 'Baseball']",8/17/2022 6:04 AM,2022.0,8.0,17.0,6.0,4.0
177,MGK and Megan Fox Spotted Together Despite Breakup Stories.,"['Machine Gun Kelly', 'Megan Fox', 'Breakups', 'Relationships', 'Movies', 'Couples', 'Gossip / Rumors', 'Tying The Knot', 'Exclusive', 'Music']",8/17/2022 1:00 AM,2022.0,8.0,17.0,1.0,0.0
178,A$AP ROCKY Alleged Victim A$AP Relli ... Thrilled Cops and D.A. Believed Him in Shooting Case.,"['A$AP Rocky', 'Weapons & Guns', 'Hip Hop', 'Exclusive', 'Music', 'Fairly Legal']",8/17/2022 12:50 AM,2022.0,8.0,17.0,0.0,50.0
179,Mama June I'm Taking My Ex-Friend to Court ... Watch Me Kick His Ass on Live TV!!!,"['Mama June', 'Money', 'Reality TV', 'YouTube', 'Exclusive', 'Fairly Legal', 'Here Comes Honey Boo Boo']",8/17/2022 12:30 AM,2022.0,8.0,17.0,0.0,30.0
180,LeRoy Butler Opportunities Rolling In After HOF Enshrinement.,"['Money', 'Green Bay Packers', 'TMZ Sports', 'Exclusive', 'Football', 'NFL']",8/17/2022 12:15 AM,2022.0,8.0,17.0,0.0,15.0
181,Big Red Cheerleader In 'Bring It On' 'Memba Her?!,"['Movies', 'Memba Them', 'Photo Galleries']",8/17/2022 12:01 AM,2022.0,8.0,17.0,0.0,1.0
182,Swizz Beatz and Timbaland Suing Triller For $28 Million ... Pay Up For Verzuz!!!,"['Timbaland', 'Swizz Beatz', 'Money', 'Hip Hop', 'CELEBRITY JUSTICE â„¢', 'Exclusive', 'Music', 'Fairly Legal']",8/16/2022 6:27 PM,2022.0,8.0,16.0,18.0,27.0
183,BRITNEY SPEARS Ex-Hubby Facing Felony Charges For Alleged Bracelet Theft.,"['Britney Spears', 'Crime & Arrests', 'Relationships', 'Hollywood Exes', 'Exclusive', 'Controversial S#!T', 'Fairly Legal', 'Police']",8/16/2022 6:04 PM,2022.0,8.0,16.0,18.0,4.0
184,"'Breaking Bad' Cranston, Paul Statues Spur GOP Outrage ... 'Glorifying Meth Makers'!!!","['Bryan Cranston', 'Aaron Paul', 'TV', 'Drugs & Alcohol', 'Politix', 'Controversial S#!T', 'Breaking Bad']",8/16/2022 3:36 PM,2022.0,8.0,16.0,15.0,36.0
185,Christian Slater Unloads MIA Home In Just 3 Days!!!,"['Christian Slater', 'TV', 'Money', 'Movies', 'Exclusive', 'Celebrity Homes']",8/16/2022 1:55 PM,2022.0,8.0,16.0,13.0,55.0
186,Jake Paul Rips KSI For Two Fights In One Night ... Sounds Like Publicity Stunt!!!,"['KSI', 'Jake Paul', 'Boxing', 'TMZ Sports', 'YouTube', 'Fights & Feuds']",8/16/2022 1:19 PM,2022.0,8.0,16.0,13.0,19.0
187,'Kids in the Hall's Dave Foley Swipes at Amazon ... They Ruined the World!!!,"['Humor', 'TV', 'Money', 'Awards / Awards Shows']",8/16/2022 1:06 PM,2022.0,8.0,16.0,13.0,6.0
188,Rick Ross Company Hit w/ Huge Fines Labor Violations at Wingstop Locations.,"['Rick Ross', 'You Might Want to Rethink', 'Money', 'Hip Hop', 'Controversial S#!T', 'Music', 'Stars In Heat']",8/16/2022 12:44 PM,2022.0,8.0,16.0,12.0,44.0
189,"'Missing' Australian Actress No Foul Play, But She's Behind Bars!!!","['Crime & Arrests', 'Family', 'Dating', 'Drugs & Alcohol', 'Exclusive', 'Fairly Legal']",8/16/2022 12:14 PM,2022.0,8.0,16.0,12.0,14.0
190,Kobe Bryant Photo Trial Deputy Testifies In Court ... I Sent Crash Pics To Cop During Video Game Session.,"['Kobe Bryant', 'Gianna Bryant', 'Vanessa Bryant', 'RIP', 'Celebrity Death', 'TMZ Sports', 'Los Angeles Lakers', 'Fairly Legal']",8/16/2022 12:06 PM,2022.0,8.0,16.0,12.0,6.0
191,Angelina Jolie Behind FBI Lawsuit Against Brad Pitt ... Pitt Sources Call BS.,"['Angelina Jolie', 'Brad Pitt', 'Relationships', 'Hollywood Exes', 'Fairly Legal']",8/16/2022 10:28 AM,2022.0,8.0,16.0,10.0,28.0
192,Manti Te'o Jay-Z Inspired Me To Speak Out ... On Catfishing Hoax.,"[""Manti Te'o"", 'Jay-z', 'Catfish', 'Hip Hop', 'Dating', 'TMZ Sports', 'Music', 'Football', 'NFL']",8/16/2022 9:47 AM,2022.0,8.0,16.0,9.0,47.0
193,Anne Heche Desperate 911 Call from Crash Scene ... Someone is Trapped.,"['Anne Heche', 'RIP', 'Movies', 'Car Crashes', 'Nurse!', 'Health', 'Police']",8/16/2022 8:04 AM,2022.0,8.0,16.0,8.0,4.0
194,Little League World Series Player In Coma After Fall From Bunk Bed ... 'We're All Praying For Him',"['TMZ Sports', 'Kids', 'Health', 'Baseball']",8/16/2022 7:37 AM,2022.0,8.0,16.0,7.0,37.0
195,Ryan Garcia Defends AB Calling Off Figueroa Fight ... 'You Got My Support',"['Ryan Garcia', 'Adrien Broner', 'TMZ Sports', 'Health', 'Fights & Feuds']",8/16/2022 7:08 AM,2022.0,8.0,16.0,7.0,8.0
196,Jill Biden Tests Positive For COVID ... Weeks After Husband Contracts It.,"['Jill Biden', 'Joe Biden', 'Summer/Beach', 'White House', 'Politix', 'Health', 'Coronavirus']",8/16/2022 7:01 AM,2022.0,8.0,16.0,7.0,1.0
197,Alec Baldwin Attorney Disputes FBI Findings ... He Speaks to Chris Cuomo.,"['Alec Baldwin', 'Chris Cuomo', 'RIP', 'Weapons & Guns', 'Movies', 'Fairly Legal', 'Police']",8/16/2022 6:31 AM,2022.0,8.0,16.0,6.0,31.0
198,Ezra Miller Getting Help for 'Complex Mental Health Issues',"['Ezra Miller', 'LGBT', 'DC Comics', 'Movies', 'Nurse!', 'Controversial S#!T', 'Health']",8/16/2022 6:15 AM,2022.0,8.0,16.0,6.0,15.0
199,Anne Heche Crash Scene Video From Inside Home ... Looks Like a War Zone.,"['Anne Heche', 'Shawn Holley', 'RIP', 'Money', 'Movies', 'Car Crashes', 'Celebrity Death', 'Exclusive', 'Fairly Legal', 'Health']",8/16/2022 1:00 AM,2022.0,8.0,16.0,1.0,0.0
200,YG Nipseyâ€™s Legacy Will Live On ... Iâ€™d Trade It All To Have Him Back!!!,"['Nipsey Hussle', 'YG', 'RIP', 'Hip Hop', 'Celebrity Death', 'Exclusive', 'Music']",8/16/2022 12:50 AM,2022.0,8.0,16.0,0.0,50.0
201,Eric & Eliza Roberts Scary Intruder Escapes Into the Darkness.,"['Eric Roberts', 'Movies', 'Couples', 'Crime', 'Exclusive', 'Police']",8/16/2022 12:40 AM,2022.0,8.0,16.0,0.0,40.0
202,Anne Heche One Of Her Final Films Says Goodbye ... Adding 'In Memoriam',"['Anne Heche', 'RIP', 'Animals', 'Movies', 'Car Crashes', 'Celebrity Death', 'Exclusive']",8/16/2022 12:30 AM,2022.0,8.0,16.0,0.0,30.0
203,"Jimmie Allen Surprise, Vegas!!! Joins Cheat Codes on Stage.","['Hot Vegas', 'Restaurants & Nightclubs', 'Exclusive', 'Music']",8/16/2022 12:20 AM,2022.0,8.0,16.0,0.0,20.0
204,Byron Allen I'm Getting Next Available NFL Team!!! ... After Losing Broncos Bid.,"['Byron Allen', 'Money', 'Denver Broncos', 'TMZ Sports', 'Exclusive', 'Football', 'NFL']",8/16/2022 12:10 AM,2022.0,8.0,16.0,0.0,10.0
205,Guess Who This Capped Kid Turned Into!,"['Kids', 'celebrity kids', 'Photo Galleries']",8/16/2022 12:01 AM,2022.0,8.0,16.0,0.0,1.0
206,Ex-NFL Star Aqib Talib Near Gunman During Fatal Youth Football Shooting ... New Video Shows.,"['Aqib Talib', 'Weapons & Guns', 'Family', 'TMZ Sports', 'Exclusive', 'Football', 'NFL']",8/15/2022 4:42 PM,2022.0,8.0,15.0,16.0,42.0
207,A$AP Rocky Charged With Assault ... For Alleged Shooting.,"['A$AP Rocky', 'Weapons & Guns', 'Hip Hop', 'Music', 'Fairly Legal']",8/15/2022 4:25 PM,2022.0,8.0,15.0,16.0,25.0
208,Teresa Giudice Catchin' More Rays In Mykonos ... As Honeymoon Continues.,"['Teresa Giudice', 'Summer/Beach', 'Hot Bodies', 'Reality TV', 'Couples', 'Real Housewives', 'Tying The Knot']",8/15/2022 3:45 PM,2022.0,8.0,15.0,15.0,45.0
209,Saweetie Long Live Nipsey Hussle ... Make Memorial The Worldâ€™s 8th Wonder!!!,"['Nipsey Hussle', 'Saweetie', 'RIP', 'Hip Hop', 'Celebrity Death', 'Music']",8/15/2022 2:47 PM,2022.0,8.0,15.0,14.0,47.0
210,Kim Zolciak Daughter Denied Drinking During DUI Bust... Admitted to Smoking THC.,"['Kim Zolciak', 'Crime & Arrests', 'Reality TV', 'DUI', 'Car Crashes', 'Real Housewives', 'Drugs & Alcohol', 'Exclusive', 'Fairly Legal']",8/15/2022 2:30 PM,2022.0,8.0,15.0,14.0,30.0
211,Kobe Bryant Photo Trial Ex-LA Co. FD Cpt. Claims He Was Forced To Take Pics ... Of Crash Site.,"['Kobe Bryant', 'Gianna Bryant', 'Vanessa Bryant', 'TMZ Sports', 'Basketball', 'NBA', 'Fairly Legal']",8/15/2022 2:08 PM,2022.0,8.0,15.0,14.0,8.0
212,Comedian Teddy Ray Died in Apparent Drowning Found in Pool by Maintenance Man.,"['RIP', 'Humor', 'TV', 'Celebrity Death', 'Comedy']",8/15/2022 1:21 PM,2022.0,8.0,15.0,13.0,21.0
213,Ben & Jen Wedding Party Going Down This Weekend!!! ... At Ben's GA Estate.,"['Jennifer Lopez', 'Ben Affleck', 'Relationships', 'Movies', 'Couples', 'Tying The Knot', 'Music']",8/15/2022 12:41 PM,2022.0,8.0,15.0,12.0,41.0
214,Bronny James Dunks All Over Opponent ... LeBron Goes Nuts.,"['Lebron James jr', 'LeBron James', 'Family', 'TMZ Sports', 'Basketball', 'celebrity kids', 'NBA']",8/15/2022 12:28 PM,2022.0,8.0,15.0,12.0,28.0
215,"Nipsey Hussle Honored with Star on Walk of Fame Lauren London, Family Speak At Ceremony.","['Nipsey Hussle', 'Lauren London', 'RIP', 'Family', 'Hip Hop', 'Celebrity Death', 'Birthdays', 'Crime', 'Music']",8/15/2022 12:26 PM,2022.0,8.0,15.0,12.0,26.0
216,"Michelle Branch Files for Divorce On Heels of Cheating Allegations, Arrest.","['Michelle Branch', 'Crime & Arrests', 'Hollywood Exes', 'Celebrity Divorce', 'Music', 'Fairly Legal']",8/15/2022 11:04 AM,2022.0,8.0,15.0,11.0,4.0
217,Capri Sun Thousands of Pouches Recalled ... Possible Cleaning Solution Contamination.,"['Kids', 'Health', 'Famous Food']",8/15/2022 10:20 AM,2022.0,8.0,15.0,10.0,20.0
218,Wayne Gretzky Sued Over Alleged Weight Loss Gum Lie ... You Cost Me $10 Mil!!!,"['Wayne Gretzky', 'Money', 'NHL', 'TMZ Sports', 'Couples', 'Fairly Legal', 'Weight Loss & Weight Gain']",8/15/2022 8:25 AM,2022.0,8.0,15.0,8.0,25.0
219,R. Kelly Asks Judge To Ban Jurors Who've Seen 'Surviving R. Kelly' Doc From Trial.,"['R. Kelly', 'Hip Hop', 'Reality TV', 'Sex', 'Exclusive', 'Controversial S#!T', 'Music', 'Fairly Legal']",8/15/2022 8:04 AM,2022.0,8.0,15.0,8.0,4.0
220,Adele 'Happy As I'll Ever Be' With Rich Paul 'I Might As Well Be Married',"['Adele', 'Rich Paul', 'Dating', 'TMZ Sports', 'Basketball', 'Couples', 'NBA', 'Music']",8/15/2022 7:47 AM,2022.0,8.0,15.0,7.0,47.0
221,Adrien Broner I'm Going Through Mental Health Issues ... Figueroa Calls B.S..,"['Adrien Broner', 'Boxing', 'Fights', 'TMZ Sports', 'Health']",8/15/2022 7:41 AM,2022.0,8.0,15.0,7.0,41.0
222,Bryce Dallas Howard Got 'So Much Less' $$$ For 'Jurassic World' Trilogy ... But Chris Pratt Had My Back!!!,"['Chris Pratt', 'Bryce Dallas Howard', 'Money', 'Movies', 'Controversial S#!T']",8/15/2022 6:50 AM,2022.0,8.0,15.0,6.0,50.0
223,Amber Heard Hires New Legal Team for Appeal ... Scraps Elaine Bredehoft.,"['Amber Heard', 'Sarah Palin', 'Johnny Depp', 'Money', 'Movies', 'Hollywood Exes', 'Politix', 'Fairly Legal', 'Celebrity Feuds']",8/15/2022 6:27 AM,2022.0,8.0,15.0,6.0,27.0
224,Brittney Griner Appealing Drug Conviction ... In Russia.,"['Brittney Griner', 'Crime & Arrests', 'TMZ Sports', 'Ukraine', 'Drugs & Alcohol', 'Politix', 'Controversial S#!T', 'Fairly Legal', 'WNBA']",8/15/2022 6:23 AM,2022.0,8.0,15.0,6.0,23.0
225,Prince Harry UNDERWEAR FROM NAKED VEGAS ROMP GETS $250K BID ... Do I Hear $1 Million???,"['Prince Harry', 'Money', 'Hot Vegas', 'Nudity', 'Strippers', 'Royal Family', 'Party All The Time', 'Prince Harry Vegas Pictures', 'Politix', 'Viral', 'Exclusive']",8/15/2022 1:00 AM,2022.0,8.0,15.0,1.0,0.0
226,Trey Songz Sexual Assault Suit ... Woman Says Attorney Offered Bribe to Lie About Singer.,"['Trey Songz', 'Hip Hop', 'Controversial S#!T', 'Music', 'Fairly Legal']",8/15/2022 12:50 AM,2022.0,8.0,15.0,0.0,50.0
227,"Johnny Damon Phillies Top Pick Is Going To Be A Star ... 500 Steals, 'Couple Hundred Home Runs'","['Johnny Damon', 'Carl Crawford', 'TMZ Sports', 'Philadelphia Phillies', 'Exclusive', 'MLB', 'Baseball']",8/15/2022 12:30 AM,2022.0,8.0,15.0,0.0,30.0
228,'Outer Banks' Star Chase Stokes Don't Drink and Drive!!! Following Death Of Stunt Double.,"['Chase Stokes', 'RIP', 'TV', 'Netflix', 'DUI', 'Car Crashes', 'Drugs & Alcohol', 'Crime', 'Exclusive']",8/15/2022 12:20 AM,2022.0,8.0,15.0,0.0,20.0
229,Tracy Turnblad in 'Hairspray' 'Memba Her?!,"['Nikki Blonsky', 'Movies', 'Memba Them', 'Photo Galleries']",8/15/2022 12:01 AM,2022.0,8.0,15.0,0.0,1.0
230,Anne Heche Taken Off Life Support.,[],8/14/2022 7:48 PM,2022.0,8.0,14.0,19.0,48.0
231,Norwegian Government Euthanizes Walrus Which Got Close to Humans.,"['RIP', 'Animals', 'Viral']",8/14/2022 4:57 PM,2022.0,8.0,14.0,16.0,57.0
232,Dwayne Johnson Wanted 'Black Adam' Separate from 'Shazam!' Comic Nerds Scratch Heads.,"['The Rock', 'Zachary Levi', 'You Might Want to Rethink', 'DC Comics', 'Movies', 'Controversial S#!T']",8/14/2022 4:18 PM,2022.0,8.0,14.0,16.0,18.0
233,Kim Kardashian Posts Sexy Gym Thirst Trap Shots After Pete Davidson Split.,"['Kim Kardashian', 'Pete Davidson', 'Breakups', 'Hot Bodies', 'Reality TV', 'Fitness & Exercise', 'Hollywood Exes']",8/14/2022 2:20 PM,2022.0,8.0,14.0,14.0,20.0
234,Ex-NFL Star Aqib Talib Brother Turns Himself In ... After Youth Football Shooting.,"['Aqib Talib', 'Weapons & Guns', 'Denver Broncos', 'TMZ Sports', 'Kids', 'Crime', 'Football', 'NFL']",8/14/2022 1:11 PM,2022.0,8.0,14.0,13.0,11.0
235,Teresa Giudice Looking Good on Greek Honeymoon ... Pink Bikini Beach Day!!!,"['Teresa Giudice', 'Reality TV', 'Relationships', 'Couples', 'Real Housewives', 'Tying The Knot', 'Vacations']",8/14/2022 12:25 PM,2022.0,8.0,14.0,12.0,25.0
236,"Big Time Rush Compared to Lizzo, Bey ... Over Supposedly Ableist Song Title.","['Beyonce Knowles', 'Lizzo', 'Twitter', 'Viral', 'Controversial S#!T', 'Music']",8/14/2022 11:30 AM,2022.0,8.0,14.0,11.0,30.0
237,"Chicago Hit & Run Car Plows Crowd of People Bodies Fly in the Air, Left for Dead.","['Insane Videos', 'Car Crashes', 'Crime', 'Viral']",8/14/2022 10:58 AM,2022.0,8.0,14.0,10.0,58.0
238,Anne Heche Taken Off Life Support in Hours ... Organ Recipients Located.,"['Anne Heche', 'RIP', 'Celebrity Death']",8/14/2022 9:34 AM,2022.0,8.0,14.0,9.0,34.0
239,"Kylie Jenner He Loves Me, He Loves Me Not ... Travis Scott's Big Birthday Surprise!!!","['Kylie Jenner', 'Travis Scott', 'Reality TV', 'Relationships', 'Couples', 'Birthdays', 'Music']",8/14/2022 7:12 AM,2022.0,8.0,14.0,7.0,12.0
240,"Denise Dowse 'Insecure,' '90210' Star Denise Dowse Dead at 64.","['RIP', 'TV', 'Celebrity Death', 'Health']",8/14/2022 6:45 AM,2022.0,8.0,14.0,6.0,45.0
241,OF MODEL COURTNEY TAILOR Give Her Life Sentence For Murder!!! Slain BF's Family Says.,"['Miami', 'RIP', 'Family', 'Relationships', 'Crime', 'Exclusive', 'Models', 'Fairly Legal']",8/14/2022 1:00 AM,2022.0,8.0,14.0,1.0,0.0
242,Carlos Santana Oye Como Va ... I'm Good After Scary Collapse.,"['Carlos Santana', 'Exclusive', 'Music', 'Health']",8/14/2022 12:50 AM,2022.0,8.0,14.0,0.0,50.0
243,Prince Amukamara Players Choir Down To Get In The Studio ... W/ Justin Timberlake!!!,"['Justin Timberlake', 'Prince Amukamara', ""America's Got Talent"", 'TMZ Sports', 'Exclusive', 'Music', 'Football', 'NFL']",8/14/2022 12:40 AM,2022.0,8.0,14.0,0.0,40.0
244,"Kodak Black POLICE NEED TO GIVE BACK MY CAR, CASH ... Seized In Florida Arrest.","['Kodak Black', 'Money', 'Hip Hop', 'Arrests', 'Drugs & Alcohol', 'Exclusive', 'Music', 'Fairly Legal', 'Police']",8/14/2022 12:35 AM,2022.0,8.0,14.0,0.0,35.0
245,Mayra Veronica Is A Total Babe In Miami Beach!,"['Hotties & Bodies', 'Hot Bodies', 'Summer', 'Photo Galleries', 'Models']",8/14/2022 12:20 AM,2022.0,8.0,14.0,0.0,20.0
246,"GloRilla Earning Cardi B's & Travis Scott's Respect, Through The Power Of 'F.N.F.!!!'","['Cardi B', 'Yo Gotti', 'Travis Scott', 'Money', 'Hip Hop', 'Instagram', 'Exclusive', 'Music']",8/14/2022 12:05 AM,2022.0,8.0,14.0,0.0,5.0
