,headline,tags,timestamp,year,month,day,hour,minute
0,Julia Fox I'm Proud I Left Kanye ... Too Much Baggage!!!,"['Julia Fox', 'Kanye West', 'Breakups', 'Hip Hop', 'Movies', 'Dating', 'Hollywood Exes', 'Music', 'The Kardashians']",9/15/2022 12:15 PM,2022.0,9.0,15.0,12.0,15.0
1,Serena & Venus Williams Childhood Home Headed For Auction ... Worth $1.42 Million.,"['Venus Williams', 'Serena Williams', 'Richard Williams', 'Money', 'Family', 'TMZ Sports', 'Tennis', 'Celebrity Homes']",9/15/2022 11:37 AM,2022.0,9.0,15.0,11.0,37.0
2,Trisha Paytas Baby Malibu Barbie Is Born ... No Royal Ties Over Here!!!,"['Queen Elizabeth', 'Baby Watch', 'Politix', 'YouTube']",9/15/2022 10:42 AM,2022.0,9.0,15.0,10.0,42.0
3,Blake Lively Baby #4 On the Way!!! Debuts Bump at NYC Event.,"['Ryan Reynolds', 'Blake Lively', 'Relationships', 'Movies', 'Baby Watch', 'Couples']",9/15/2022 10:18 AM,2022.0,9.0,15.0,10.0,18.0
4,"Kim Kardashian, Scott Disick Sued Over Alleged Scam 'Lottery' Company Behind Giveaway Says It's All Legit.","['Kim Kardashian', 'Scott Disick', 'Money', 'Reality TV', 'Instagram', 'Exclusive', 'Fairly Legal']",9/15/2022 10:01 AM,2022.0,9.0,15.0,10.0,1.0
5,Prince William Having Flashbacks to Diana's Funeral After Queen's Procession.,"['Princess Diana', 'Queen Elizabeth', 'Prince William', 'RIP', 'Celebrity Death', 'Royal Family', 'Politix']",9/15/2022 9:40 AM,2022.0,9.0,15.0,9.0,40.0
6,Cardi B Takes Plea Deal in Strip Club Beatdown ... No Jail Time.,"['Cardi B', 'Crime & Arrests', 'Hip Hop', 'CELEBRITY JUSTICE ™', 'Fights', 'Strip Club', 'Music', 'Fairly Legal']",9/15/2022 9:13 AM,2022.0,9.0,15.0,9.0,13.0
7,Tom Ford NYFW Show Packed with Celebs ... We're Front & Center!!!,"['Tom Ford', 'Madonna', 'Lourdes Leon', 'Chris Rock', 'Katie Holmes', 'Beauty', 'Fashion', 'TMZ Sports', 'Models']",9/15/2022 7:55 AM,2022.0,9.0,15.0,7.0,55.0
8,Report: Tom Brady Not Living W/ Gisele ... Dealing W/ Marital Issues.,"['Tom Brady', 'Gisele Bundchen', 'Relationships', 'TMZ Sports', 'Couples', 'Tampa Bay Buccaneers', 'Football', 'NFL']",9/15/2022 7:41 AM,2022.0,9.0,15.0,7.0,41.0
9,Queen Elizabeth II Guard Face-Plants Next to Queen's Coffin.,"['Queen Elizabeth', 'Celebrity Death', 'Royal Family', 'Nurse!', 'Politix', 'Viral', 'Health']",9/15/2022 7:21 AM,2022.0,9.0,15.0,7.0,21.0
10,"Bone Thugs-N-Harmony We’re Retiring From the Road!!! Announce Farewell Tour with Snoop, Cube & More.","['Snoop Dogg', 'bone thugs-n-harmony', 'Ice Cube', 'Hip Hop', 'Exclusive', 'Music']",9/15/2022 7:17 AM,2022.0,9.0,15.0,7.0,17.0
11,Kanye West Gap is Whack!!! So I'm Ending the Partnership.,"['Kanye West', 'Hip Hop', 'Fashion']",9/15/2022 7:11 AM,2022.0,9.0,15.0,7.0,11.0
12,"Nick Cannon Surprise, Baby #9 Arrives!!! #10 and #11 On Deck.","['Nick Cannon', 'Family', 'Hip Hop', 'Relationships', 'Kids', 'Baby Watch', 'Hollywood Exes', 'Models']",9/15/2022 7:05 AM,2022.0,9.0,15.0,7.0,5.0
13,Jason Momoa I'm Playin' Head Games!!! Reveals Awesome New Tat.,"['Jason Momoa', 'Movies', 'Tattoo', 'Tattoos']",9/15/2022 6:43 AM,2022.0,9.0,15.0,6.0,43.0
14,Roger Federer I'm Retiring From Tennis ... 'A Bittersweet Decision',"['Roger Federer', 'TMZ Sports', 'Breaking News', 'Tennis']",9/15/2022 6:39 AM,2022.0,9.0,15.0,6.0,39.0
15,Jimmy Kimmel Big Apologies to Quinta It Was a Dumb Bit!!!,"['Jimmy Kimmel', 'TV', 'Emmy Awards', 'Comedy', 'Late Night']",9/15/2022 6:28 AM,2022.0,9.0,15.0,6.0,28.0
16,'Boardwalk Empire' Michael Pitt Strapped to Gurney and Hospitalized After Outburst in NYC.,"['TV', 'Exclusive', 'Health']",9/15/2022 1:00 AM,2022.0,9.0,15.0,1.0,0.0
17,Olivia Newton-John Publicist Heated Over Emmys 'In Memoriam' Snub ... I'm Very Disappointed!!!,"['Olivia Newton-John', 'RIP', 'You Might Want to Rethink', 'TV', 'ABC', 'Celebrity Death', 'Emmy Awards', 'Exclusive', 'Music']",9/15/2022 12:45 AM,2022.0,9.0,15.0,0.0,45.0
18,Bhad Bhabie I'm Following in Einstein's Footsteps!!! Invited to Speak at Oxford.,"['Danielle Bregoli', 'TV', 'Money', 'Hip Hop', 'Nudity', 'Viral', 'Exclusive']",9/15/2022 12:30 AM,2022.0,9.0,15.0,0.0,30.0
19,"Ball Hawk Zack Hample Judge, Pujols Will Get HR Balls Back ... If I Catch Them.","['Aaron Judge', 'Zack Hample', 'Albert Pujols', 'You Might Want to Rethink', 'Money', 'TMZ Sports', 'Exclusive', 'MLB', 'Baseball']",9/15/2022 12:15 AM,2022.0,9.0,15.0,0.0,15.0
20,Guess Who This Cropped Top Cutie Turned Into!,"['Kids', 'celebrity kids', 'Photo Galleries']",9/15/2022 12:01 AM,2022.0,9.0,15.0,0.0,1.0
21,Adam Silver on Robert Sarver 'Dramatically Different' From Donald Sterling.,"['Robert Sarver', 'Adam Silver', 'Donald Sterling', 'Los Angeles Clippers', 'Donald Sterling Racist Comments', 'TMZ Sports', 'Basketball', 'Phoenix Suns', 'NBA', 'Controversial S#!T']",9/14/2022 4:26 PM,2022.0,9.0,14.0,16.0,26.0
22,LeBron James Furious Over Sarver Suspension ... NBA 'Got This Wrong',"['LeBron James', 'You Might Want to Rethink', 'TMZ Sports', 'Basketball', 'NBA', 'Los Angeles Lakers', 'Controversial S#!T']",9/14/2022 4:16 PM,2022.0,9.0,14.0,16.0,16.0
23,Chick-Fil-A Hero Worker Thwarts Alleged Carjacking ... With Wild MMA Takedown.,"['TMZ Sports', 'MMA', 'Crime', 'Viral', 'Police']",9/14/2022 4:03 PM,2022.0,9.0,14.0,16.0,3.0
24,The Game 15-Year-Old 'Murda' Lyrics Eerily Describe PnB Rock's Fate.,"['pnb rock', 'The Game', 'Hip Hop', 'Celebrity Death', 'Music']",9/14/2022 3:04 PM,2022.0,9.0,14.0,15.0,4.0
25,Girls Basketball Player's Mom Forced To Pay $9K ... After Daughter Punched Opponent.,"['Money', 'Fights', 'TMZ Sports', 'Breaking News', 'Basketball']",9/14/2022 2:41 PM,2022.0,9.0,14.0,14.0,41.0
26,R. Kelly Guilty of Child Pornography in Illinois Federal Trial ... Not Guilty on 7 Other Counts.,"['R. Kelly', 'Hip Hop', 'Sex', 'Kids', 'Crime', 'Music', 'Fairly Legal', 'Pornography']",9/14/2022 2:26 PM,2022.0,9.0,14.0,14.0,26.0
27,Tory Lanez Chillin' Outside Court ... Megan Trial Delayed 2 Months.,"['Megan Thee Stallion', 'Tory Lanez', 'Weapons & Guns', 'Hip Hop', 'Music', 'Fairly Legal']",9/14/2022 1:26 PM,2022.0,9.0,14.0,13.0,26.0
28,Brittany Snow Splits from Hubby Tyler Stanaland.,"['Brittany Snow', 'Reality TV', 'Exclusive Details', 'Relationships', 'Movies', 'Celebrity Divorce']",9/14/2022 1:05 PM,2022.0,9.0,14.0,13.0,5.0
29,"Eminem My Competition Is ... Kendrick, Cole, Joyner & Big Sean!!!","['Eminem', 'Kendrick Lamar', 'J. Cole', 'Hip Hop', 'Music']",9/14/2022 12:36 PM,2022.0,9.0,14.0,12.0,36.0
30,Jesse Williams Runs Back to Court Over Custody ... And Another Broadway Run.,"['Jesse Williams', 'Family', 'Relationships', 'Kids', 'Hollywood Exes', 'Fairly Legal']",9/14/2022 11:52 AM,2022.0,9.0,14.0,11.0,52.0
31,"Scooter Braun Settles Divorce Keeps $65M Home, Private Jet, Art ... Will Pay $20M.","['Scooter Braun', 'Yael Cohen Braun', 'Laura Wasser', 'Money', 'Celebrity Divorce', 'Fairly Legal']",9/14/2022 11:51 AM,2022.0,9.0,14.0,11.0,51.0
32,Trae Tha Truth Donating Fresh Water In Jackson ... Damage Control Or Controlling the Damage?!?,"['Hip Hop', 'Exclusive Details', 'Politix', 'Music', 'Health']",9/14/2022 11:30 AM,2022.0,9.0,14.0,11.0,30.0
33,Britney Spears Has a Good Cry on Camera ... During Dance Routine.,"['Britney Spears', 'celebrity kids', 'Instagram', 'Music', 'Celebrity Feuds']",9/14/2022 10:29 AM,2022.0,9.0,14.0,10.0,29.0
34,Nicki Minaj Sues 'Nosey Heaux' I'm No Cokehead!!!,"['Nicki Minaj', 'Hip Hop', 'Drugs & Alcohol', 'YouTube', 'Exclusive', 'Music', 'Fairly Legal']",9/14/2022 9:01 AM,2022.0,9.0,14.0,9.0,1.0
35,Trevor Bauer I Have Video Proving My Accuser Lied ... Dismiss Her Lawsuit.,"['Trevor Bauer', 'Los Angeles Dodgers', 'Sex', 'TMZ Sports', 'Crime', 'Fairly Legal', 'MLB', 'Baseball']",9/14/2022 8:48 AM,2022.0,9.0,14.0,8.0,48.0
36,Nursing Home Hired Stripper Gets Rise Outta Vets!!!,"['You Might Want to Rethink', 'Strippers', 'Nurse!', 'Viral']",9/14/2022 8:10 AM,2022.0,9.0,14.0,8.0,10.0
37,"Kourtney Kardashian Fashion Week Event Takes Dark Turn ... Lights, Please!!!","['Kourtney Kardashian', 'Travis Barker', 'Fashion Week', 'Reality TV', 'Fashion', 'Couples', 'Models', 'Music', 'The Kardashians']",9/14/2022 7:05 AM,2022.0,9.0,14.0,7.0,5.0
38,Queen Elizabeth II William and Harry Walk Behind Coffin Queen Now Lies in State at Westminster Hall.,"['King Charles III', 'Queen Elizabeth', 'Prince Harry', 'Prince William', 'RIP', 'Celebrity Death', 'Royal Family', 'Politix']",9/14/2022 6:50 AM,2022.0,9.0,14.0,6.0,50.0
39,King Charles Freaks Out Over Leaky Pen ... This Bloody Thing!!!,"['King Charles III', 'Camilla Parker Bowles', 'Humor', 'Royal Family', 'Comedy', 'Politix', 'Viral']",9/14/2022 6:31 AM,2022.0,9.0,14.0,6.0,31.0
40,Cavs Legend Zydrunas Ilgauskas Wife Dies At 50.,"['RIP', 'Cleveland Cavaliers', 'TMZ Sports', 'Basketball', 'Couples', 'NBA']",9/14/2022 6:07 AM,2022.0,9.0,14.0,6.0,7.0
41,R&B Sensation Jesse Powell Dead At 51.,"['RIP', 'Hip Hop', 'Celebrity Death', 'Music']",9/14/2022 5:40 AM,2022.0,9.0,14.0,5.0,40.0
42,PnB Rock Cops Alert Pawn Shops Stolen Jewelry Could Lead to Killer.,"['pnb rock', 'Bling!', 'RIP', 'Hip Hop', 'Celebrity Death', 'Exclusive', 'Music', 'Famous Food', 'Police']",9/14/2022 1:00 AM,2022.0,9.0,14.0,1.0,0.0
43,'Bachelorette' Stars Olumide & Riley Weigh In on Blackface ... Hope Erich's Learned.,"['ABC', 'Reality TV', 'The Bachelorette', 'Exclusive', 'Controversial S#!T']",9/14/2022 12:45 AM,2022.0,9.0,14.0,0.0,45.0
44,"New York Fashion Week Bigger They Come, Harder they Fall ... We're Talking Heels.","['You Might Want to Rethink', 'Beauty', 'Fashion', 'Nurse!', 'Exclusive']",9/14/2022 12:30 AM,2022.0,9.0,14.0,0.0,30.0
45,"Montrezl Harrell Police Video NBAer Talked LaMelo Ball, Free Agency With Cops ... During Weed Stop.","['Montrezl Harrell', 'LaMelo Ball', 'TMZ Sports', 'Basketball', 'NBA', 'Crime', 'Exclusive', 'Stars In Heat', 'Police']",9/14/2022 12:15 AM,2022.0,9.0,14.0,0.0,15.0
46,Jeana Keough From 'RHOC' 'Memba Her?!,"['Memba Them', 'Real Housewives', 'Photo Galleries']",9/14/2022 12:01 AM,2022.0,9.0,14.0,0.0,1.0
47,"Tamika Mallory Economics, Poverty to Blame ... For PnB Rock's Murder.","['pnb rock', 'RIP', 'Money', 'Hip Hop', 'Celebrity Death', 'Exclusive', 'Music']",9/13/2022 5:00 PM,2022.0,9.0,13.0,17.0,0.0
48,Thomas Markle Can't Go Near Tabloid Honcho ... After Alleged Death Threat.,"['Meghan Markle', 'Family', 'Royal Family', 'Exclusive', 'Fairly Legal', 'Celebrity Feuds']",9/13/2022 4:26 PM,2022.0,9.0,13.0,16.0,26.0
49,Britney Spears' Ex Jason Alexander Wanted by Cops After Missing Court Date.,"['Britney Spears', 'Hollywood Exes', 'Crime', 'Fairly Legal', 'Police']",9/13/2022 2:15 PM,2022.0,9.0,13.0,14.0,15.0
50,Whitewater Prosecutor Ken Starr Dead at 76.,"['Monica Lewinsky', 'Bill Clinton', 'Hillary Clinton', 'RIP', 'Celebrity Death', 'TMZ Sports', 'White House', 'Politix', 'Fairly Legal']",9/13/2022 2:12 PM,2022.0,9.0,13.0,14.0,12.0
51,PnB Rock Murder Roscoe's Chicken Open for Biz ... 24 Hours After Shooting.,"['pnb rock', 'RIP', 'Weapons & Guns', 'Hip Hop', 'Music', 'Famous Food']",9/13/2022 2:00 PM,2022.0,9.0,13.0,14.0,0.0
52,DJ Drama Stop Blaming PnB Rock's GF For His Murder ... The Streets Love NO ONE!!!,"['pnb rock', 'DJ Drama', 'RIP', 'Hip Hop', 'Relationships', 'Celebrity Death', 'Exclusive', 'Music']",9/13/2022 1:45 PM,2022.0,9.0,13.0,13.0,45.0
53,'Slutty Vegan' Owner Most People Want to Eat Healthy ... My Restaurants Help 'Em Do That!!!,"['Beyonce Knowles', 'TMZ Live', 'Exclusive', 'Famous Food']",9/13/2022 1:17 PM,2022.0,9.0,13.0,13.0,17.0
54,SELMA BLAIR and Ex-BF Drop Restraining Orders Against Each Other ... He Still Faces Possible Criminal Prosecution.,"['Selma Blair', 'Relationships', 'Hollywood Exes', 'Exclusive', 'Fairly Legal']",9/13/2022 12:48 PM,2022.0,9.0,13.0,12.0,48.0
55,"Cardi B VISITS HER OLD MIDDLE SCHOOL Donates $100,000!!!","['Cardi B', 'Money', 'Hip Hop', 'Kids', 'Music']",9/13/2022 11:33 AM,2022.0,9.0,13.0,11.0,33.0
56,LeBron James Shirtless Yacht Workout!!! ... Prep For NBA Season Continues On Vacay.,"['LeBron James', 'savannah James', 'Hot Bodies', 'TMZ Sports', 'Fitness & Exercise', 'Basketball', 'NBA', 'Los Angeles Lakers', 'Vacations']",9/13/2022 10:00 AM,2022.0,9.0,13.0,10.0,0.0
57,Michelle Branch & Patrick Carney We're Calling Off Divorce ... At Least For Now.,"['Michelle Branch', 'Patrick Carney', 'Relationships', 'Kids', 'Couples', 'Celebrity Divorce', 'Music', 'Fairly Legal']",9/13/2022 9:57 AM,2022.0,9.0,13.0,9.0,57.0
58,"Suns Owner Robert Sarver Suspended 1 Year, Fined $10 Million Probe Finds He Used N-Word.","['You Might Want to Rethink', 'Money', 'TMZ Sports', 'Basketball', 'Phoenix Suns', 'NBA', 'Controversial S#!T']",9/13/2022 9:14 AM,2022.0,9.0,13.0,9.0,14.0
59,YouTube Star Steph Pappas Father Killed by Suspected Drunk Driver.,"['Family', 'Car Crashes', 'Nurse!', 'Drugs & Alcohol', 'Crime', 'YouTube']",9/13/2022 8:11 AM,2022.0,9.0,13.0,8.0,11.0
60,"Emmy Awards Inside Netflix, HBO Max After-Parties ... Big Wins, Big Celebrations!!!","['TV', 'Awards / Awards Shows', 'Emmy Awards', 'Photo Galleries']",9/13/2022 7:57 AM,2022.0,9.0,13.0,7.0,57.0
61,'Cheer' Star Cassadee Dunlap Father Shot in Arkansas.,"['TLC', 'Weapons & Guns', 'Family', 'Reality TV', 'TMZ Sports']",9/13/2022 7:32 AM,2022.0,9.0,13.0,7.0,32.0
62,Emmys 2022 A Black & White Fashion Affair ... Behind the Scenes.,"['TV', 'Fashion', 'Awards / Awards Shows', 'Emmy Awards']",9/13/2022 6:54 AM,2022.0,9.0,13.0,6.0,54.0
63,"Jennifer Coolidge to Emmy Orchestra You Play Me, I Play You ... I'm Not Leaving, I'm Dancing!!!","['Jennifer Coolidge', 'Humor', 'TV', 'Awards / Awards Shows', 'Emmy Awards', 'Comedy']",9/13/2022 6:48 AM,2022.0,9.0,13.0,6.0,48.0
64,Jason Sudeikis Thanks Kids at Emmys ... Amid Custody War w/ Olivia.,"['Jason Sudeikis', 'Olivia Wilde', 'TV', 'NBC', 'Kids', 'Custody Battles', 'Emmy Awards', 'Comedy', 'Hollywood Exes', 'Fairly Legal']",9/13/2022 6:33 AM,2022.0,9.0,13.0,6.0,33.0
65,Gisele Bündchen Admitted 'Concerns' Over Brady's Return ... In Offseason.,"['Tom Brady', 'Gisele Bundchen', 'Family', 'TMZ Sports', 'Couples', 'Gossip / Rumors', 'Tampa Bay Buccaneers', 'Football', 'NFL']",9/13/2022 6:27 AM,2022.0,9.0,13.0,6.0,27.0
66,"Alabama Bassist Teddy Gentry Busted for Weed in AL ... Really, it's still Illegal?","['Crime & Arrests', 'Drugs & Alcohol', 'Music', 'Fairly Legal']",9/13/2022 6:25 AM,2022.0,9.0,13.0,6.0,25.0
67,Jimmy Kimmel Slammed Online for Emmys Skit Stealing Moment from Quinta Brunson.,"['Jimmy Kimmel', 'Will Arnett', 'TV', 'NBC', 'Emmy Awards', 'Viral']",9/13/2022 6:20 AM,2022.0,9.0,13.0,6.0,20.0
68,Kim & Ray J Sex Tape Was Early Cash Cow Kim and Ray Got Email Touting Sales Numbers.,"['Kim Kardashian', 'Ray J', 'Money', 'Reality TV', 'Sex Tape', 'Exclusive', 'Music', 'Fairly Legal', 'Pornography', 'Fights & Feuds']",9/13/2022 1:00 AM,2022.0,9.0,13.0,1.0,0.0
69,"Famous Dex Cleaning Up My Act ... Leaves Jail, Goes Straight to Rehab.","['famous dex', 'Hip Hop', 'Drugs & Alcohol', 'Crime', 'Exclusive', 'Music', 'Health']",9/13/2022 12:50 AM,2022.0,9.0,13.0,0.0,50.0
70,Lorde My Little Sis Has Pipes!!! ... Releasing First Song Ever.,"['Lorde', 'Family', 'Exclusive', 'Music']",9/13/2022 12:40 AM,2022.0,9.0,13.0,0.0,40.0
71,'Married To Medicine' Lia Dias Busted For Restraining Order Violation ... After Alleged Death Threat.,"['Exs', 'Crime & Arrests', 'Family', 'Reality TV', 'Relationships', 'Exclusive', 'Fairly Legal']",9/13/2022 12:20 AM,2022.0,9.0,13.0,0.0,20.0
72,"Drew Pearson Cowboys Should Call Cam, Kaep ... After Dak Injury.","['Drew Pearson', 'Dak Prescott', 'Cam Newton', 'Colin Kaepernick', 'TMZ Sports', 'Exclusive', 'Football', 'Dallas Cowboys', 'NFL']",9/13/2022 12:10 AM,2022.0,9.0,13.0,0.0,10.0
73,Guess Who This Precious Kid Turned Into!,"['Kids', 'celebrity kids', 'Photo Galleries']",9/13/2022 12:01 AM,2022.0,9.0,13.0,0.0,1.0
74,PnB Rock Dead at 30 After Shooting at Roscoe's.,"['pnb rock', 'RIP', 'Hip Hop', 'Celebrity Death', 'Music']",9/12/2022 5:21 PM,2022.0,9.0,12.0,17.0,21.0
75,PNB ROCK Shot In Roscoe's Chicken & Waffles Rushed to Hospital.,"['pnb rock', 'Bling!', 'Weapons & Guns', 'Hip Hop', 'Nurse!', 'Crime', 'Exclusive', 'Music', 'Health', 'Famous Food']",9/12/2022 3:00 PM,2022.0,9.0,12.0,15.0,0.0
76,Mariah Carey Huge ATL House On The Market ... Recording Booth Included!!!,"['Mariah Carey', 'Money', 'Crime', 'Music', 'Celebrity Homes']",9/12/2022 2:17 PM,2022.0,9.0,12.0,14.0,17.0
77,R. KELLY TRIAL Juror Suffers Panic Attack ... Excused and Replaced.,"['R. Kelly', 'Hip Hop', 'Crime', 'Fairly Legal', 'Health']",9/12/2022 2:00 PM,2022.0,9.0,12.0,14.0,0.0
78,Drakeo The Ruler Late Rapper's Estate Sued For Over $100K ... Landlord Wants Rent Money.,"['RIP', 'Money', 'Hip Hop', 'Music', 'Fairly Legal']",9/12/2022 12:46 PM,2022.0,9.0,12.0,12.0,46.0
79,"Jake Paul Hey, Dana White ... Let's Put $5 Million On Silva Fight!!!","['Anderson Silva', 'Dana White', 'Jake Paul', 'TMZ Sports']",9/12/2022 11:45 AM,2022.0,9.0,12.0,11.0,45.0
80,Britney Spears Dad Fires Back ... Make Her Sit for a Deposition!!!,"['Britney Spears', 'Jamie Spears', 'Money', 'Family', 'Exclusive', 'Music', 'Fairly Legal', 'Health', 'Fights & Feuds']",9/12/2022 11:21 AM,2022.0,9.0,12.0,11.0,21.0
81,Prince Andrew 'You're a sick old man!!!' Heckler Arrested at Queen's Funeral Procession.,"['Queen Elizabeth', 'Jeffrey Epstein', 'RIP', 'Crime & Arrests', 'Celebrity Death', 'Royal Family', 'Politix', 'Controversial S#!T', 'Fairly Legal']",9/12/2022 8:58 AM,2022.0,9.0,12.0,8.0,58.0
82,Mike Tyson Suite Life With Robert Kraft ... At Patriots Game.,"['Mike Tyson', 'Robert Kraft', 'Boxing', 'New England Patriots', 'Miami Dolphins', 'TMZ Sports', 'Football', 'NFL']",9/12/2022 7:59 AM,2022.0,9.0,12.0,7.0,59.0
83,MMA's Elias Theodorou Dead At 34 After Cancer Battle.,"['Elias Theodorou', 'RIP', 'Celebrity Death', 'TMZ Sports', 'MMA', 'UFC', 'Health']",9/12/2022 7:55 AM,2022.0,9.0,12.0,7.0,55.0
84,Jason Oppenheim Not All Belly Kisses Are For Babies ... ALL Over GF in Mykonos!!!,"['Jason Oppenheim', 'Netflix', 'Reality TV', 'Relationships', 'Baby Watch', 'Couples', 'Gossip / Rumors', 'Models', 'Vacations']",9/12/2022 7:49 AM,2022.0,9.0,12.0,7.0,49.0
85,"Britney Spears I (Probably) Won't Perform Again!!! Rips Her Dad, Conservatorship.","['Britney Spears', 'Jamie Spears', 'Family', 'Controversial S#!T', 'Music', 'Fairly Legal']",9/12/2022 7:40 AM,2022.0,9.0,12.0,7.0,40.0
86,"Kris Jenner, Corey Gamble Do We Look Like We're Havin Fun??? Insane Downpour During NY Fashion Week.","['Kate Moss', 'Kris Jenner', 'Kourtney Kardashian', 'Travis Barker', 'Fashion Week', 'Reality TV', 'Fashion', 'Music', 'The Kardashians']",9/12/2022 7:06 AM,2022.0,9.0,12.0,7.0,6.0
87,Prince Harry You're Already 'Sorely Missed' ... Emotional Message to QE2.,"['King Charles III', 'Queen Elizabeth', 'Prince Harry', 'RIP', 'Celebrity Death', 'Royal Family', 'Politix']",9/12/2022 6:44 AM,2022.0,9.0,12.0,6.0,44.0
88,Raiders vs. Chargers Fans Get In Wild Brawl ... Woman Punched In Face.,"['Las Vegas Raiders', 'Fights', 'TMZ Sports', 'Viral', 'Football', 'NFL']",9/12/2022 6:42 AM,2022.0,9.0,12.0,6.0,42.0
89,Gisele Bündchen Shows Support For Tom Brady ... But Skips QB's Game.,"['Tom Brady', 'Gisele Bundchen', 'Family', 'Relationships', 'TMZ Sports', 'Couples', 'Tampa Bay Buccaneers', 'Football', 'NFL']",9/12/2022 6:20 AM,2022.0,9.0,12.0,6.0,20.0
90,YNW Melly I've Got a Diamond Grill Tooth Infection!!! Denied Pass for Dentist.,"['Bling!', 'Hip Hop', 'Nurse!', 'Exclusive', 'Music', 'Fairly Legal', 'Health']",9/12/2022 1:00 AM,2022.0,9.0,12.0,1.0,0.0
91,'Arrow' Star Stephen Amell Suing Neighbor Over Kennel Biz ... Illegal and a Racket!!!,"['Pets', 'TV', 'Animals', 'Exclusive', 'Controversial S#!T', 'Fairly Legal']",9/12/2022 12:40 AM,2022.0,9.0,12.0,0.0,40.0
92,Ryan Fitzpatrick If Bills Win Super Bowl ... I'll Jump Through A Table!!!,"['Ryan Fitzpatrick', 'TMZ Sports', 'Super Bowl', 'Exclusive', 'Buffalo Bills', 'Football', 'NFL']",9/12/2022 12:20 AM,2022.0,9.0,12.0,0.0,20.0
93,Maitland Ward Danielle Might Hate Me ... I Think I Was Too Hot on 'BMW'!!!,"['Danielle Fishel', 'TV', 'Hot Bodies', 'Exclusive', 'Boy Meets World', 'Disney', 'Pornography', 'Celebrity Feuds']",9/12/2022 12:10 AM,2022.0,9.0,12.0,0.0,10.0
94,'What Does The Fox Say' Singer Bard Ylvisaker 'Memba Him?!,"['Memba Them', 'Photo Galleries']",9/12/2022 12:01 AM,2022.0,9.0,12.0,0.0,1.0
95,Brie Larson Acknowledges 'Capt. Marvel' Hate ... Catches Flak Anew.,"['Brie Larson', 'Twitter', 'Movies', 'Disney']",9/11/2022 2:57 PM,2022.0,9.0,11.0,14.0,57.0
96,Wolves Star Anthony Edwards Apologizes for Homophobic Comment.,"['Anthony Edwards', 'LGBT', 'TMZ Sports', 'NBA', 'Controversial S#!T']",9/11/2022 1:02 PM,2022.0,9.0,11.0,13.0,2.0
97,President Biden Quotes QE2 in 9/11 Speech ... The Price We Pay for Love.,"['Joe Biden', 'Queen Elizabeth', 'White House', 'Royal Family', 'Politix', 'News']",9/11/2022 12:54 PM,2022.0,9.0,11.0,12.0,54.0
98,Ray J Threatens to Sue Kim K ... For Suggesting Assault on Hulu Show.,"['Kim Kardashian', 'Ray J', 'Reality TV', 'Sex Tape', 'Hollywood Exes', 'Instagram', 'Fairly Legal', 'The Kardashians']",9/11/2022 12:03 PM,2022.0,9.0,11.0,12.0,3.0
99,Beyoncé Not My Bey-Day Anymore But Let's Party Anyway!!!,"['Beyonce Knowles', 'Jay-z', 'TMZ Sports', 'Birthdays', 'Party All The Time', 'Music']",9/11/2022 11:11 AM,2022.0,9.0,11.0,11.0,11.0
100,"Steven Spielberg New Movie 'The Fabelmans' Gets Standing O at Tiff, Oscar Buzz.","['Steven Spielberg', 'Movies', 'Awards / Awards Shows', 'Viral']",9/11/2022 10:20 AM,2022.0,9.0,11.0,10.0,20.0
101,Ray J Goes Off On Kim and Kris Says They Lied About Sex Tape.,"['Kim Kardashian', 'Ray J', 'Kris Jenner', 'Money', 'Reality TV', 'Sex Tape', 'Hollywood Exes', 'Instagram', 'Late Night']",9/11/2022 9:39 AM,2022.0,9.0,11.0,9.0,39.0
102,Leo DiCaprio I'm Hangin' Alone These Days ... Parties with Jared Leto After Breakup.,"['Leonardo DiCaprio', 'Jared Leto', 'Breakups', 'Fashion Week', 'Relationships', 'Party All The Time']",9/11/2022 6:20 AM,2022.0,9.0,11.0,6.0,20.0
103,Britney Spears Since My Estrangement with My Sons ... 'I Feel Like a Part of Me Has Died',"['Britney Spears', 'Jayden James', 'Sean Preston', 'Family', 'Relationships', 'celebrity kids', 'Instagram']",9/11/2022 6:17 AM,2022.0,9.0,11.0,6.0,17.0
104,Swae Lee I have a 1-Year-Old Daughter ... I Want Joint Custody!!!,"['Swae Lee', 'Exs', 'Baby Mama', 'Money', 'Hip Hop', 'Baby Watch', 'Exclusive', 'Music']",9/11/2022 1:00 AM,2022.0,9.0,11.0,1.0,0.0
105,ONLYFANS STAR COURTNEY TILLIA Gets Support From Teachers ... After Becoming a Millionaire.,"['Money', 'Nudity', 'Viral', 'Exclusive', 'Models']",9/11/2022 12:50 AM,2022.0,9.0,11.0,0.0,50.0
106,Vegas Sex Worker Offering VIP Deal To Raiders ... For 2022 Season.,"['Las Vegas Raiders', 'Sex', 'TMZ Sports', 'Exclusive', 'Football', 'NFL']",9/11/2022 12:45 AM,2022.0,9.0,11.0,0.0,45.0
107,Larsa Pippen Scoops Up Miami Penthouse!!!,"['Larsa Pippen', 'Miami', 'Money', 'Reality TV', 'TMZ Sports', 'Real Housewives', 'Exclusive', 'Celebrity Homes']",9/11/2022 12:25 AM,2022.0,9.0,11.0,0.0,25.0
108,Sarah Snook Good Genes or Good Docs?!,"['Photo Galleries', 'Good Genes or Good Docs']",9/11/2022 12:20 AM,2022.0,9.0,11.0,0.0,20.0
109,2KBABY I Hope My 15 Face Tats Piss Off Haters ... Zero F***s to Give!!!,"['Hip Hop', 'Instagram', 'Exclusive', 'Music', 'Tattoo', 'Tattoos']",9/11/2022 12:15 AM,2022.0,9.0,11.0,0.0,15.0
110,Celebrity Scramble Guess Who!,['Celebrity Scramble'],9/11/2022 12:01 AM,2022.0,9.0,11.0,0.0,1.0
111,Josh Duhamel Appears to Have Married ... Parties in Local Fargo Bar!!!,"['Josh Duhamel', 'Relationships', 'Couples', 'Party All The Time', 'Tying The Knot']",9/10/2022 6:00 PM,2022.0,9.0,10.0,18.0,0.0
112,Tommy Lee I'm on OnlyFans!!!,"['Tommy Lee', 'Nudity', 'Instagram', 'Controversial S#!T', 'Music']",9/10/2022 1:46 PM,2022.0,9.0,10.0,13.0,46.0
113,Harrison Ford Emotional Over New 'Indy' Flick ... This One'll Kick Your Ass!!!,"['Harrison Ford', 'Movies', 'Disney']",9/10/2022 12:12 PM,2022.0,9.0,10.0,12.0,12.0
114,OG 'Little Mermaid' Jodi Benson's Ariel Besmirched ... Amid Halle Bailey's 1st Look.,"['You Might Want to Rethink', 'Movies', 'Controversial S#!T', 'Music', 'Disney']",9/10/2022 11:25 AM,2022.0,9.0,10.0,11.0,25.0
115,Swedish House Mafia Pull Off Epic Show in Rain Despite Damage to Millions of $$ in Equipment.,"['Swedish House Mafia', 'You Might Want to Rethink', 'Money', 'Exclusive', 'Music']",9/10/2022 11:21 AM,2022.0,9.0,10.0,11.0,21.0
116,"A$AP Rocky So Over Rihanna ... In This Case, Literally!!!","['A$AP Rocky', 'Rihanna', 'Hip Hop', 'Party All The Time', 'Exclusive', 'Music']",9/10/2022 10:36 AM,2022.0,9.0,10.0,10.0,36.0
117,Harry and Meghan Join Will and Kate at Windsor ... Observe Flowers for Queen.,"['Queen Elizabeth', 'Meghan Markle', 'Prince Harry', 'Kate Middleton', 'Prince William', 'RIP', 'Family', 'Celebrity Death', 'Royal Family']",9/10/2022 10:15 AM,2022.0,9.0,10.0,10.0,15.0
118,Drake I'm a Stand-Up Comic Now!!! ... Hosts Nike Maxim Awards.,"['Drake', 'Humor', 'Hip Hop', 'Fashion', 'TMZ Sports', 'Comedy', 'Music']",9/10/2022 6:59 AM,2022.0,9.0,10.0,6.0,59.0
119,Harper's BAZAAR Icons  Bash Jack Harlow Performs to Swanky Celeb Crowd!!!,"['Jared Leto', 'Heidi Klum', 'Jack Harlow', 'TV', 'Fashion', 'Movies', 'Exclusive', 'Music']",9/10/2022 6:57 AM,2022.0,9.0,10.0,6.0,57.0
120,Queen Elizabeth II The Queen is Dead ... Long Live Latifah!!!,"['Queen Latifah', 'Queen Elizabeth', 'RIP', 'Twitter', 'Movies', 'Royal Family', 'celebrity kids']",9/10/2022 6:22 AM,2022.0,9.0,10.0,6.0,22.0
121,"Aaron Rodgers Leans Pro-Life But Supports Pro-Choice ... Government, Stay Out of Our F**king Business!!!","['Aaron Rodgers', 'Bill Maher', 'Donald Trump', 'Green Bay Packers', 'TMZ Sports', 'Politix', 'Controversial S#!T', 'Football', 'NFL']",9/10/2022 6:13 AM,2022.0,9.0,10.0,6.0,13.0
122,Harry & Meghan Royal Family Could Collapse ... Unless 'Dark Skin' Comments Are Explained.,"['Archie Harrison Mountbatten-Windsor', 'Meghan Markle', 'Prince Harry', 'Oprah Winfrey', 'Royal Family', 'celebrity kids', 'Politix', 'Exclusive', 'Controversial S#!T', 'Royal Baby', 'Celebrity Feuds']",9/10/2022 1:00 AM,2022.0,9.0,10.0,1.0,0.0
