,headline,tags,timestamp,year,month,day,hour,minute
1368,Rihanna Glamorous Exit From Dinner ... Days After Super Bowl Announcement.,['Rihanna'],10/1/2022 5:57 AM,2022.0,10.0,1.0,5.0,57.0
1369,Bill Maher Now That Everyone's Back to Work ... 'Let them F***!!!',"['Bill Maher', 'Humor', 'TV', 'Relationships', 'Sex', 'Comedy', 'Politix', 'Controversial S#!T']",10/1/2022 5:42 AM,2022.0,10.0,1.0,5.0,42.0
1370,Japanese Pro Wrestling Legend Antonio Inoki Who Fought Ali Dead at 79.,"['Muhammad Ali', 'RIP', 'Boxing', 'Celebrity Death', 'TMZ Sports', 'Politix']",10/1/2022 5:40 AM,2022.0,10.0,1.0,5.0,40.0
1371,Roy Wood Jr. The Next 'Daily Show' Host?!? Comic's In The Mix.,"['Trevor Noah', 'Humor', 'TV', 'Comedy', 'Politix', 'Exclusive', 'Comedy Central']",10/1/2022 1:00 AM,2022.0,10.0,1.0,1.0,0.0
1372,Coolio Website Crashes After Death  ... Too Many Fans Trying To Grab Merch.,"['Coolio', 'RIP', 'Hip Hop', 'Fashion', 'Celebrity Death', 'Exclusive', 'Music']",10/1/2022 12:55 AM,2022.0,10.0,1.0,0.0,55.0
1373,Stars and Scars You Be the Judge.,[],10/1/2022 12:50 AM,2022.0,10.0,1.0,0.0,50.0
1374,Shaquille O'Neal Down To Join Bezos In Bid To Buy Suns ... 'Big Man JB!!!',"[""Shaquille O'Neal"", 'Jeff Bezos', 'Money', 'TMZ Sports', 'Basketball', 'Phoenix Suns', 'NBA', 'Exclusive']",10/1/2022 12:45 AM,2022.0,10.0,1.0,0.0,45.0
1375,Remy Ma Was Up for 'Real Housewives NYC' ... Screwed by One Big Hurdle.,"['Remy Ma', 'Hip Hop', 'Reality TV', 'Exclusive', 'Music', 'Real Housewives of New York', 'Celebrity Homes']",10/1/2022 12:40 AM,2022.0,10.0,1.0,0.0,40.0
1376,"September 2022 Hot Shots ... Spice, Spice Baby!","['Summer/Beach', 'Hotties & Bodies', 'Hot Bodies', 'Summer', 'Photo Galleries']",10/1/2022 12:20 AM,2022.0,10.0,1.0,0.0,20.0
1377,Columbus Short Domestic Violence Case Dropped ... 'I've Never Abused A Woman',"['Columbus Short', 'TV', 'Crime & Arrests', 'Relationships', 'Exclusive', 'Fairly Legal']",10/1/2022 12:10 AM,2022.0,10.0,1.0,0.0,10.0
1378,What's The Big Frigin' Difference?!,"['Fashion', 'Photo Galleries', ""What's The Big Frigin' Difference""]",10/1/2022 12:01 AM,2022.0,10.0,1.0,0.0,1.0
1379,Bella Hadid Hits Runway Topless ... Gets Dress Spray-Painted On.,"['Bella Hadid', 'Fashion Week', 'Beauty', 'Fashion', 'Nudity']",9/30/2022 5:38 PM,2022.0,9.0,30.0,17.0,38.0
1380,CA Gov. Newsom Signs Bill Limiting Rap Lyric Evidence ... Ice Cube's On Board!!!,"['Gavin Newsom', 'Hip Hop', 'Politix', 'Music', 'Fairly Legal']",9/30/2022 2:08 PM,2022.0,9.0,30.0,14.0,8.0
1381,Todrick Hall Judge Orders Him To Pay $102k ... In Unpaid Rent Lawsuit.,"['Money', 'Reality TV', 'Exclusive', 'Fairly Legal']",9/30/2022 12:50 PM,2022.0,9.0,30.0,12.0,50.0
1382,Nick Cannon Welcomes Baby #10!!! It's 'Another Blessing',"['Brittany Bell', 'Nick Cannon', 'TV', 'Kids', 'celebrity kids', 'Baby Watch', 'Music']",9/30/2022 12:19 PM,2022.0,9.0,30.0,12.0,19.0
1383,Coolio Supposed To Film 'Wild 'N Out' Show ... Nixed By Travel Issues.,"['Coolio', 'Nick Cannon', 'RIP', 'TV', 'Hip Hop', 'Celebrity Death', 'Exclusive', 'Music']",9/30/2022 12:10 PM,2022.0,9.0,30.0,12.0,10.0
1384,Tua Tagovailoa 'Feeling Much Better' ... After Scary Head Injury.,"['Tua Tagovailoa', 'Miami Dolphins', 'TMZ Sports', 'Nurse!', 'Health', 'Football', 'NFL']",9/30/2022 12:00 PM,2022.0,9.0,30.0,12.0,0.0
1385,Luis Quinones Boxer Dead At 25 ... 5 Days After KO Loss.,"['RIP', 'Boxing', 'Celebrity Death', 'Fights', 'TMZ Sports', 'Nurse!', 'Health']",9/30/2022 11:00 AM,2022.0,9.0,30.0,11.0,0.0
1386,Myles Garrett Rollover Crash Was 'Wakeup Call' ... Promises To Drive Safer.,"['Myles Garrett', 'Cleveland Browns', 'Car Crashes', 'TMZ Sports', 'Football', 'Police', 'NFL']",9/30/2022 10:52 AM,2022.0,9.0,30.0,10.0,52.0
1387,Tua Tagovailoa Should Never Play For Dolphins Again ... Says CTE Expert Chris Nowinski.,"['Tua Tagovailoa', 'Miami Dolphins', 'TMZ Sports', 'Nurse!', 'Exclusive', 'Health', 'WWE', 'TMZ Podcast', 'Football', 'NFL']",9/30/2022 10:42 AM,2022.0,9.0,30.0,10.0,42.0
1388,Gigi & Leo Say 'Oui' to Paris Fashion Week ... Spotted at Same Hotel.,"['Leonardo DiCaprio', 'Gigi Hadid', 'Fashion Week', 'Fashion', 'Relationships', 'Movies', 'Exclusive', 'Models']",9/30/2022 10:40 AM,2022.0,9.0,30.0,10.0,40.0
1389,Sylvester Stallone Cozied Up to Wife Jennifer ... Weeks After Divorce Filing.,"['Sylvester Stallone', 'Jennifer Flavin', 'Beauty', 'Relationships', 'Movies', 'TMZ Sports', 'Celebrity Divorce']",9/30/2022 8:19 AM,2022.0,9.0,30.0,8.0,19.0
1390,Amber Heard The Blame in Spain Falls Silent So I'm Game.,"['Johnny Depp', 'Amber Heard', 'Breakups', 'Movies', 'Hollywood Exes', 'Exclusive', 'Fairly Legal', 'Vacations']",9/30/2022 8:18 AM,2022.0,9.0,30.0,8.0,18.0
1391,Elon Musk's Dad Call Me 'Dirty Errol' ... I Killed 3 Men with 2 Bullets.,"['Elon Musk', 'Weapons & Guns', 'Crime & Arrests', 'Money', 'Family', 'Kids', 'Fairly Legal']",9/30/2022 7:45 AM,2022.0,9.0,30.0,7.0,45.0
1392,George & Amal Clooney Host First Ever Albie Awards ... A Night Full Of Stars.,"['George Clooney', 'Amal Clooney', 'Fashion', 'Movies', 'Awards / Awards Shows', 'Photo Galleries']",9/30/2022 7:01 AM,2022.0,9.0,30.0,7.0,1.0
1393,Wisconsin News Anchor Dies By Suicide Can't Bear the Pain After fiance Calls off Wedding.,"['RIP', 'Breakups', 'TMZ Sports', 'News']",9/30/2022 6:52 AM,2022.0,9.0,30.0,6.0,52.0
1394,Tom Girardi & Erika Jayne Court-Ordered Auction Scores Big $$$ With Fancy Items.,"['Erika Jayne', 'Money', 'Reality TV', 'TMZ Sports', 'Real Housewives', 'Exclusive', 'Fairly Legal', 'Celebrity Homes']",9/30/2022 6:18 AM,2022.0,9.0,30.0,6.0,18.0
1395,Ex-Cowboys TE Gavin Escobar Dead At 31 ... After Rock Climbing Accident.,"['RIP', 'Celebrity Death', 'TMZ Sports', 'Football', 'Dallas Cowboys', 'NFL']",9/30/2022 6:12 AM,2022.0,9.0,30.0,6.0,12.0
1396,Coolio Happy and in Good Health ... Just Days Before Death.,"['Coolio', 'Vanilla Ice', 'RIP', 'Hip Hop', 'Celebrity Death', 'Exclusive', 'Music', 'Health']",9/30/2022 1:00 AM,2022.0,9.0,30.0,1.0,0.0
1397,Coolio Tribute Show Put On by Haddaway ... Trying 'Our Best Not to Cry',"['Coolio', 'RIP', 'Hip Hop', 'Celebrity Death', 'Exclusive', 'Music']",9/30/2022 12:45 AM,2022.0,9.0,30.0,0.0,45.0
1398,'Queen of Versailles' Jackie Siegel Hurricane Wrecks Mega-Mansion!!!,"['Weather', 'Money', 'Exclusive', 'Celebrity Homes']",9/30/2022 12:30 AM,2022.0,9.0,30.0,0.0,30.0
1399,"Jimmy Haslam Bottle Incident Arrested Fan Asked Cops, 'Am I Going To Jail For A While?!?' ... Police Video Shows.","['Crime & Arrests', 'Cleveland Browns', 'TMZ Sports', 'Exclusive', 'Football', 'Police', 'NFL']",9/30/2022 12:15 AM,2022.0,9.0,30.0,0.0,15.0
1400,Samantha The Babysitter In 'Obsessed' 'Memba Her?!,"['Movies', 'Memba Them', 'Photo Galleries']",9/30/2022 12:01 AM,2022.0,9.0,30.0,0.0,1.0
1401,Trevor Noah Leaving 'The Daily Show',"['Trevor Noah', 'Humor', 'TV', 'Exclusive Details', 'White House', 'Emmy Awards', 'Comedy', 'Grammy Awards', 'Comedy Central']",9/29/2022 7:11 PM,2022.0,9.0,29.0,19.0,11.0
1402,Dolphins QB Tua Tagovailoa Returns Home After Suffering Head Injury ... 'In Good Spirits',"['Tua Tagovailoa', 'Miami Dolphins', 'TMZ Sports', 'Health', 'TMZ Podcast', 'Football', 'Cincinnati Bengals', 'NFL']",9/29/2022 7:08 PM,2022.0,9.0,29.0,19.0,8.0
1403,Chris D'Elia Woman Who Filed Restraining Order is Lying ... I've Never Met Her & She's Threatened My Family.,"[""Chris D'Elia"", 'Humor', 'TV', 'Comedy', 'Instagram', 'Exclusive', 'Controversial S#!T', 'Fairly Legal', 'OnlyFans']",9/29/2022 5:06 PM,2022.0,9.0,29.0,17.0,6.0
1404,"Buccaneers $1 Million For Hurricane Victims ... NFL, Magic Match.","['Tom Brady', 'Weather', 'Money', 'TMZ Sports', 'Tampa Bay Buccaneers', 'Football', 'NFL']",9/29/2022 3:52 PM,2022.0,9.0,29.0,15.0,52.0
1405,Joel Embiid Sworn In As U.S. Citizen ... I'm An American!!!,"['Joel Embiid', 'TMZ Sports', 'Basketball', 'NBA', 'Philadelphia 76ers', 'Politix']",9/29/2022 2:59 PM,2022.0,9.0,29.0,14.0,59.0
1406,Coolio Featured On 'Futurama' Next Season ... Recorded Lines & Raps Before Death.,"['Coolio', 'TV', 'Hip Hop', 'Exclusive', 'Music']",9/29/2022 1:53 PM,2022.0,9.0,29.0,13.0,53.0
1407,"Carole Baskin We're Always Ready For Hurricanes!!! Sometimes Tigers Know in Advance, Too.","['Carole Baskin', 'Weather', 'Animals', 'Reality TV', 'Exclusive']",9/29/2022 1:32 PM,2022.0,9.0,29.0,13.0,32.0
1408,Kel Mitchell Coolio Was Joy To Be Around ... Like a Favorite Uncle!!!,"['Kel Mitchell', 'Coolio', 'RIP', 'TV', 'Hip Hop', 'Celebrity Death', 'Nickelodeon', 'TMZ Live', 'Exclusive', 'Music']",9/29/2022 1:19 PM,2022.0,9.0,29.0,13.0,19.0
1409,PnB Rock Father & Son Duo Charged with Murder In Shooting Death ... Father Arrested In Vegas.,"['pnb rock', 'Hip Hop', 'Celebrity Death', 'Crime', 'Exclusive', 'Music', 'Police']",9/29/2022 12:52 PM,2022.0,9.0,29.0,12.0,52.0
1410,L.A. Dodgers Man Socked In Face By Padres Fan ... Insane Fistfight At Game.,"['Los Angeles Dodgers', 'Fights', 'TMZ Sports', 'MLB', 'Baseball']",9/29/2022 12:46 PM,2022.0,9.0,29.0,12.0,46.0
1411,Boosie Badazz Black People Should Take a Stand ... To Ban Netflix's 'Dahmer'!!!,"['Boosie Badazz', 'Jeffrey Dahmer', 'TV', 'Netflix', 'Hip Hop', 'Crime', 'Music']",9/29/2022 11:04 AM,2022.0,9.0,29.0,11.0,4.0
1412,Sarah Jessica Parker Exits NYC Gala To Be With Dying Stepfather... In His Final Moments.,"['Sarah Jessica Parker', 'RIP', 'Family', 'Fashion', 'Movies', 'Health']",9/29/2022 10:43 AM,2022.0,9.0,29.0,10.0,43.0
1413,MacKenzie Scott Settles Money Issues with Estranged Husband Before She Filed for Divorce.,"['MacKenzie Bezos', 'Breakups', 'Money', 'Relationships', 'Celebrity Divorce', 'Fairly Legal']",9/29/2022 10:08 AM,2022.0,9.0,29.0,10.0,8.0
1414,Myles Garrett Admitted To Speeding Before Rollover Crash ... Police Video Shows.,"['Myles Garrett', 'Car Crashes', 'TMZ Sports', 'Health', 'Football', 'NFL']",9/29/2022 9:43 AM,2022.0,9.0,29.0,9.0,43.0
1415,"Vanilla Ice Coolio's Last Gig Was With Me ... I'm In Shock, Devastated.","['Vanilla Ice', 'Coolio', 'RIP', 'Hip Hop', 'Celebrity Death', 'Exclusive', 'Music', 'TMZ Podcast']",9/29/2022 9:20 AM,2022.0,9.0,29.0,9.0,20.0
1416,"Report: Brett Favre's Charity Gifted Donated $ Meant For Kids, Cancer Patients To Univ. Of Southern Miss.","['Brett Favre', 'You Might Want to Rethink', 'Money', 'TMZ Sports', 'Controversial S#!T', 'Football', 'NFL']",9/29/2022 8:51 AM,2022.0,9.0,29.0,8.0,51.0
1417,Myles Garrett Issued Citation Over Car Crash ... Cops Say Browns Star Appeared To Be Speeding.,"['Myles Garrett', 'Cleveland Browns', 'Car Crashes', 'TMZ Sports', 'Football', 'NFL']",9/29/2022 8:20 AM,2022.0,9.0,29.0,8.0,20.0
1418,Mike Breen Home Destroyed In Massive Fire ... Officials Investigating.,"['Money', 'TMZ Sports', 'NBA', 'Health', 'ESPN', 'Celebrity Homes']",9/29/2022 8:01 AM,2022.0,9.0,29.0,8.0,1.0
1419,"'Try Guys' Ned Fulmer 'Working Things Out,' Says Wife ... Amid Cheating Scandal.","['Relationships', 'Couples', 'YouTube', 'Influencers']",9/29/2022 7:30 AM,2022.0,9.0,29.0,7.0,30.0
1420,Khloe Kardashian Tristan's Cheating Caused Me Brain Trauma And I Have Medical Receipts.,"['Khloe Kardashian', 'Tristan Thompson', 'Reality TV', 'Relationships', 'TMZ Sports', 'Hollywood Exes', 'The Kardashians']",9/29/2022 7:08 AM,2022.0,9.0,29.0,7.0,8.0
1421,Queen Elizabeth II Death Certificate States Obvious ... It Was 'Old Age',"['Queen Elizabeth', 'RIP', 'Celebrity Death', 'Royal Family', 'Politix', 'Health']",9/29/2022 7:05 AM,2022.0,9.0,29.0,7.0,5.0
1422,Hurricane Ian Woman Saved From Car As Flood Rises ... Crazy Video Shows.,"['You Might Want to Rethink', 'Weather', 'Insane Videos', 'Viral']",9/29/2022 7:00 AM,2022.0,9.0,29.0,7.0,0.0
1423,Coolio Frantic Effort to Revive Him for 45 Minutes.,"['Coolio', 'RIP', 'Hip Hop', 'Celebrity Death', 'Nurse!', 'Music', 'Health', 'TMZ Podcast']",9/29/2022 6:35 AM,2022.0,9.0,29.0,6.0,35.0
1424,Aaron Judge Jays Fan Drops 61st Home Run Ball Misses Payday By Inches!!!,"['Aaron Judge', 'Money', 'Toronto Blue Jays', 'TMZ Sports', 'MLB', 'Baseball']",9/29/2022 6:06 AM,2022.0,9.0,29.0,6.0,6.0
1425,Shaq I Support Adam Levine ... He's a Solid Dude!!!,"['Adam Levine', ""Shaquille O'Neal"", 'Money', 'Relationships', 'TMZ Sports', 'Basketball', 'Couples', 'NBA', 'Exclusive', 'Controversial S#!T']",9/29/2022 1:00 AM,2022.0,9.0,29.0,1.0,0.0
1426,Carole Baskin I'm Bunkerin' Down With My Big Cats ... As Hurricane Ian Hits.,"['Carole Baskin', 'TV', 'Weather', 'Animals', 'Exclusive']",9/29/2022 12:45 AM,2022.0,9.0,29.0,0.0,45.0
1427,'Stranger Things' New Owner for Byers House ... Show-Themed Airbnb Coming!!!,"['TV', 'Netflix', 'Money', 'Exclusive', 'Celebrity Homes']",9/29/2022 12:30 AM,2022.0,9.0,29.0,0.0,30.0
1428,"'BIG BRO' MIKE 'BOOGIE' MALIN Arrest Warrant Issued, Probation Revoked.","[""Mike 'Boogie' Malin"", 'Big Brother', 'Money', 'Reality TV', 'Exclusive', 'Fairly Legal']",9/29/2022 12:15 AM,2022.0,9.0,29.0,0.0,15.0
1429,Guess Who This Lil' Fairy Turned Into!,"['Kids', 'celebrity kids', 'Photo Galleries']",9/29/2022 12:01 AM,2022.0,9.0,29.0,0.0,1.0
1430,MARK ZUCKERBERG SIGNED LITTLE LEAGUE CARD SELLS FOR $120K.,"['Mark Zuckerberg', 'Money', 'TMZ Sports', 'Facebook', 'Baseball']",9/28/2022 5:57 PM,2022.0,9.0,28.0,17.0,57.0
1431,Coolio Dead at 59.,"['Coolio', 'RIP', 'Hip Hop', 'Celebrity Death', 'Music', 'TMZ Podcast']",9/28/2022 5:41 PM,2022.0,9.0,28.0,17.0,41.0
1432,REP. MARJORIE TAYLOR GREENE Husband Files For Divorce.,"['Couples', 'Celebrity Divorce', 'Politix', 'Exclusive']",9/28/2022 5:35 PM,2022.0,9.0,28.0,17.0,35.0
1433,Hurricane Ian Here's a Tip ... Real Reporters Use Condoms!!!,"['TV', 'Weather', 'Sex', 'Viral', 'News']",9/28/2022 4:00 PM,2022.0,9.0,28.0,16.0,0.0
1434,Hurricane Ian FL Weatherman Slammed on Twitter ... After Posting Vid of Struggling Kitten in Storm.,"['Weather', 'Twitter', 'Viral', 'News']",9/28/2022 3:32 PM,2022.0,9.0,28.0,15.0,32.0
1435,Mackenzie Scott Files for Divorce from Husband #2.,"['MacKenzie Bezos', 'Jeff Bezos', 'Exs', 'Relationships', 'Celebrity Divorce', 'Fairly Legal']",9/28/2022 2:22 PM,2022.0,9.0,28.0,14.0,22.0
1436,'Try Guys' Ned Fulmer & Wife Still Wearing Wedding Rings Amid Cheating Allegations.,"['Relationships', 'Couples', 'YouTube', 'Influencers']",9/28/2022 1:49 PM,2022.0,9.0,28.0,13.0,49.0
1437,Ernest Hemingway Hurricane Batters Key West House ... But All 59 Cats Survive!!!,"['Pets', 'Weather', 'Animals', 'Exclusive', 'Celebrity Homes']",9/28/2022 12:49 PM,2022.0,9.0,28.0,12.0,49.0
1438,R. Kelly's NY Criminal Case Ordered to Pay Sex Abuse Victim $300k Herpes & Psych Treatment.,"['R. Kelly', 'Money', 'Hip Hop', 'Music', 'Fairly Legal', 'Health']",9/28/2022 11:58 AM,2022.0,9.0,28.0,11.0,58.0
1439,Washington Nationals Fan Arrested Over Altercation With Usher ... At Braves Game.,"['You Might Want to Rethink', 'Crime & Arrests', 'Insane Videos', 'TMZ Sports', 'MLB', 'Baseball', 'Fights & Feuds']",9/28/2022 11:33 AM,2022.0,9.0,28.0,11.0,33.0
1440,Bishop Robbery 2 Men Charged With Armed Robbery ... Allegedly Stole Jewelry Mid-Service.,"['Bling!', 'You Might Want to Rethink', 'Religion/ Spirituality', 'Crime & Arrests', 'Fairly Legal']",9/28/2022 10:49 AM,2022.0,9.0,28.0,10.0,49.0
1441,Dana White Donates $10K To Muay Thai Fighter ... Who Lost Legs In Tragic Accident.,"['Dana White', 'Money', 'TMZ Sports', 'UFC', 'Health']",9/28/2022 10:01 AM,2022.0,9.0,28.0,10.0,1.0
1442,Ye Hires Melinda Gates' Divorce Lawyer ... To Rep Him in Kim Case.,"['Kim Kardashian', 'Kanye West', 'Melinda Gates', 'Hip Hop', 'Reality TV', 'Relationships', 'celebrity kids', 'Hollywood Exes', 'Celebrity Divorce', 'Music', 'Fairly Legal']",9/28/2022 9:46 AM,2022.0,9.0,28.0,9.0,46.0
1443,The Weather Channel Reporter Struck by Tree Branch During Ian Coverage.,"['Weather', 'Viral', 'News']",9/28/2022 9:36 AM,2022.0,9.0,28.0,9.0,36.0
1444,Lizzo I Just Made Flute History!!! Plays James Madison's 200-Year-Old Flute.,"['Lizzo', 'Politix', 'Music']",9/28/2022 7:58 AM,2022.0,9.0,28.0,7.0,58.0
1445,Ski-Climbing Star Hilaree Nelson Found Dead At 49 ... After Avalanche On Peak In Nepal.,"['RIP', 'Weather', 'Celebrity Death', 'TMZ Sports']",9/28/2022 7:37 AM,2022.0,9.0,28.0,7.0,37.0
1446,Navy SEAL PED Use Under Scrutiny ... Amid Hell Week Death.,"['Drugs & Alcohol', 'News', 'CNN']",9/28/2022 7:34 AM,2022.0,9.0,28.0,7.0,34.0
1447,"Hailey Bieber I Didn't Steal Justin Away from Selena ... Here's the Truth, Fans.","['Justin Bieber', 'Selena Gomez', 'Hailey Baldwin', 'Relationships', 'Couples', 'Justin Bieber & Selena Gomez', 'Hollywood Exes', 'Controversial S#!T', 'Models', 'Music', 'TMZ Podcast']",9/28/2022 7:15 AM,2022.0,9.0,28.0,7.0,15.0
1448,Hurricane Ian Florida Man Wakeboards ... In Flooded Streets.,"['Weather', 'Insane Videos', 'TMZ Sports', 'News']",9/28/2022 7:05 AM,2022.0,9.0,28.0,7.0,5.0
1449,'Jeopardy!' Champ Amy Schneider I'm Married!!! Ties Knot with Partner.,"['TV', 'Relationships', 'Couples', 'Tying The Knot']",9/28/2022 6:49 AM,2022.0,9.0,28.0,6.0,49.0
1450,Post Malone Back Onstage After Fall ... Performs in Pain.,"['Post Malone', 'Exclusive', 'Music', 'Health']",9/28/2022 6:33 AM,2022.0,9.0,28.0,6.0,33.0
1451,PnB Rock 17-Year-Old Arrested for Murder ... Alleged Shooter's Dad Still Wanted by Cops.,"['pnb rock', 'RIP', 'Hip Hop', 'Celebrity Death', 'Crime', 'Music', 'Police']",9/28/2022 6:30 AM,2022.0,9.0,28.0,6.0,30.0
1452,"Taylor Hawkins Tribute Chappelle Performs 'Creep' Miley, Joan Jett, Alanis & Foo Fighters, Too!!!","['Taylor Hawkins', 'Dave Grohl', 'Dave Chappelle', 'RIP', 'Family', 'Celebrity Death', 'Music']",9/28/2022 6:27 AM,2022.0,9.0,28.0,6.0,27.0
1453,Katie Couric I Have Breast Cancer.,"['Katie Couric', 'TV', 'Today Show', 'Health']",9/28/2022 6:24 AM,2022.0,9.0,28.0,6.0,24.0
1454,'Heartland' Actor Robert Cormier Dies After Apparent Fall.,"['RIP', 'TV', 'Celebrity Death', 'Nurse!', 'Health']",9/28/2022 6:06 AM,2022.0,9.0,28.0,6.0,6.0
1455,'Hocus Pocus' Sanderson Sisters Cottage Hits Airbnb ... Form a Calming Circle!!!,"['Sarah Jessica Parker', 'Bette Midler', 'Money', 'Movies', 'Holidaze', 'Exclusive', 'Disney', 'Celebrity Homes']",9/28/2022 6:00 AM,2022.0,9.0,28.0,6.0,0.0
1456,Jeffrey Dahmer Prosecutor Backs Milwaukee Cops ... No Racial/Gay Bias in Case.,"['Jeffrey Dahmer', 'TV', 'Netflix', 'LGBT', 'Crime', 'Exclusive', 'Controversial S#!T', 'Fairly Legal', 'Police']",9/28/2022 1:00 AM,2022.0,9.0,28.0,1.0,0.0
1457,Tekashi 6ix9ine Punched DJ Wants Rematch... Let's Fight on Mayweather Undercard!!!,"['Tekashi 6ix9ine', 'Floyd Mayweather', 'Hip Hop', 'Boxing', 'TMZ Sports', 'Exclusive', 'Music', 'Fights & Feuds']",9/28/2022 12:40 AM,2022.0,9.0,28.0,0.0,40.0
1458,UFC's Maryna Moroz I'm Goin' Nakey For Playboy ... It Changed My Life!!!,"['Nudity', 'TMZ Sports', 'MMA', 'UFC', 'Exclusive']",9/28/2022 12:20 AM,2022.0,9.0,28.0,0.0,20.0
1459,Singer Rebecca Black 'Memba her?!,"['Memba Them', 'Kids', 'celebrity kids']",9/28/2022 12:01 AM,2022.0,9.0,28.0,0.0,1.0
1460,ADAM LEVINE & BEHATI PRINSLOO Let's Go To Vegas ... What Cheating Scandal?!?,"['Adam Levine', 'Behati Prinsloo', 'Relationships', 'Couples', 'Music']",9/27/2022 6:40 PM,2022.0,9.0,27.0,18.0,40.0
1461,Oregon State Robot Breaks World Record ... In 100-Meter Dash.,"['You Might Want to Rethink', 'Weird News', 'TMZ Sports', 'Viral']",9/27/2022 3:56 PM,2022.0,9.0,27.0,15.0,56.0
1462,Post Malone Returning To the Stage in Cleveland After Boston Hospitalization.,"['Post Malone', 'Exclusive', 'Music', 'Health']",9/27/2022 2:55 PM,2022.0,9.0,27.0,14.0,55.0
1463,Chris Redd Dating Kenan Thompson's Ex ... But No Hard Feelings!!!,"['Kenan Thompson', 'Relationships', 'Dating', 'SNL', 'Comedy', 'Hollywood Exes']",9/27/2022 1:29 PM,2022.0,9.0,27.0,13.0,29.0
1464,NASA's DART Mission Nailed Asteroid 6 Million Miles Away ... NASA Amazed by Up Close View!!!,"['Space', 'Money', 'Exclusive', 'NASA']",9/27/2022 1:14 PM,2022.0,9.0,27.0,13.0,14.0
1465,"Myles Garrett Suffered Bicep Strain, Shoulder Sprain, Lacerations ... In Car Crash.","['Myles Garrett', 'Cleveland Browns', 'Car Crashes', 'TMZ Sports', 'Breaking News', 'Nurse!', 'Health', 'Football', 'NFL']",9/27/2022 12:16 PM,2022.0,9.0,27.0,12.0,16.0
1466,'Try Guys' Ned Fulmer Fired After Cheating Allegations.,"['Fired', 'Relationships', 'YouTube', 'Viral']",9/27/2022 12:11 PM,2022.0,9.0,27.0,12.0,11.0
1467,Myles Garrett Crash Female Passenger Complained Of Head Injury ... According to 911 Caller.,"['Myles Garrett', 'Cleveland Browns', 'Car Crashes', 'TMZ Sports', 'Nurse!', 'Health', 'Football', 'NFL']",9/27/2022 11:45 AM,2022.0,9.0,27.0,11.0,45.0
1468,Victoria Beckham Sparks Marriage Trouble Concerns ... Over Faded 'DB' Tattoo.,"['David Beckham', 'Victoria Beckham', 'Exclusive Details', 'Relationships', 'TMZ Sports', 'Couples', 'Soccer', 'Gossip / Rumors', 'Music', 'Tattoo']",9/27/2022 11:37 AM,2022.0,9.0,27.0,11.0,37.0
1469,Diddy Sued By Woman Claiming to be Kim Porter's Niece ... He Calls It a Shakedown.,"['Kim Porter', 'P. Diddy', 'Hip Hop', 'Relationships', 'celebrity kids', 'Baby Watch', 'Music', 'Fairly Legal']",9/27/2022 10:43 AM,2022.0,9.0,27.0,10.0,43.0
1470,Lil Wayne My Miami Mansion's For Sale!!!,"['Lil Wayne', 'Money', 'Hip Hop', 'Music', 'Celebrity Homes']",9/27/2022 10:34 AM,2022.0,9.0,27.0,10.0,34.0
1471,Pusha T Ribbin' On McDonald's Again... New Arby's Wild West Diss Track!!!,"['Pusha T', 'Hip Hop', 'Music', 'Famous Food']",9/27/2022 10:20 AM,2022.0,9.0,27.0,10.0,20.0
1472,Jeffrey Dahmer Victims Memorial in Early Stages ... Concerns In Milwaukee.,"['Jeffrey Dahmer', 'RIP', 'You Might Want to Rethink', 'Crime', 'Politix', 'Exclusive', 'Police']",9/27/2022 9:54 AM,2022.0,9.0,27.0,9.0,54.0
1473,The Walking Dead Negan's Barbed Wire Bat 'Lucille' ... Hits Auction Block.,"['Jeffrey Dean Morgan', 'TV', 'Money', 'TMZ Sports', 'The Walking Dead']",9/27/2022 9:00 AM,2022.0,9.0,27.0,9.0,0.0
1474,"Rihanna 50+ Possibilities for SB Show Guest ... Could Go Solo, Too!!!","['Rihanna', 'Hip Hop', 'TMZ Sports', 'Super Bowl', 'Exclusive', 'Music', 'Football', 'NFL']",9/27/2022 8:50 AM,2022.0,9.0,27.0,8.0,50.0
1475,"Ted Cruz Says Chrissy Teigen's Lying ... Claims She Had Miscarriage, Not Abortion.","['Ted Cruz', 'Chrissy Teigen', 'Family', 'Baby Watch', 'Politix', 'Controversial S#!T']",9/27/2022 8:39 AM,2022.0,9.0,27.0,8.0,39.0
1476,Rachel Dolezal Started OnlyFans to Honor Rihanna ... Lingerie Photos Leak!!!,"['Rachel Dolezal', 'Rihanna', 'Weird News', 'Fashion', 'Exclusive Details', 'Viral', 'Music', 'OnlyFans']",9/27/2022 8:04 AM,2022.0,9.0,27.0,8.0,4.0
1477,Tom Cruise & Nicole Kidman Scientology Caused Their Split ... Says Former High-Ranking Church Officer.,"['Nicole Kidman', 'Tom Cruise', 'David Miscavige', 'Breakups', 'Religion/ Spirituality', 'Relationships', 'Hollywood Exes', 'Scientology']",9/27/2022 7:53 AM,2022.0,9.0,27.0,7.0,53.0
1478,Rihanna Hits Studio with A$AP Rocky ... After Super Bowl News.,"['A$AP Rocky', 'Rihanna', 'Hip Hop', 'Relationships', 'TMZ Sports', 'Couples', 'Super Bowl', 'Gossip / Rumors', 'Music']",9/27/2022 7:39 AM,2022.0,9.0,27.0,7.0,39.0
1479,American Airlines Is Someone in 13A About to Orgasm?,"['Humor', 'TikTok', 'Weird News', 'Sex', 'Comedy', 'Viral']",9/27/2022 7:29 AM,2022.0,9.0,27.0,7.0,29.0
1480,China Rescue Kid Dangling from Balcony ... Saved by Super Neighbor.,"['Kids', 'Viral', 'Health', 'Heroes']",9/27/2022 6:55 AM,2022.0,9.0,27.0,6.0,55.0
1481,Adam Levine Doing A Vegas Residency with M5... Cheating Scandal Be Damned!!!,"['Adam Levine', 'Relationships', 'Music']",9/27/2022 6:45 AM,2022.0,9.0,27.0,6.0,45.0
1482,Roger Stone Pre-Election Day 'F*** the Voting' ... 'Let's Get Right to the Violence',"['Roger Stone', 'Donald Trump', 'Fights', 'White House', 'Politix', 'Controversial S#!T']",9/27/2022 6:38 AM,2022.0,9.0,27.0,6.0,38.0
1483,Myles Garrett Released From Hospital After Rollover Crash ... Agent Says 'Nothing Is Broken',"['Myles Garrett', 'Cleveland Browns', 'Car Crashes', 'TMZ Sports', 'Nurse!', 'Health', 'Football', 'NFL']",9/27/2022 6:02 AM,2022.0,9.0,27.0,6.0,2.0
1484,LARSA PIPPEN Snuggles with Marcus Jordan ... Looking Real Couple-ish!!!,"['Larsa Pippen', 'Hip Hop', 'Relationships', 'Dating', 'TMZ Sports', 'Couples', 'Exclusive', 'Music']",9/27/2022 1:00 AM,2022.0,9.0,27.0,1.0,0.0
1485,'Riverdale' Actor Ryan Grantham Afraid He'll Be Brutalized in Prison.,"['TV', 'Crime & Arrests', 'Family', 'Exclusive']",9/27/2022 12:50 AM,2022.0,9.0,27.0,0.0,50.0
1486,David Bowie Iconic Spacesuit Up for Grabs ... Part of $1.7M Auction!!!,"['David Bowie', 'Space', 'Money', 'Fashion', 'Exclusive', 'Music']",9/27/2022 12:40 AM,2022.0,9.0,27.0,0.0,40.0
1487,Lamar Odom Showin' Support At Daughter's First Fashion Show ... I'm Your #1 Fan!!!,"['Lamar Odom', 'Family', 'Fashion', 'TMZ Sports', 'Kids', 'NBA', 'Exclusive', 'Models']",9/27/2022 12:30 AM,2022.0,9.0,27.0,0.0,30.0
1488,'Concussion' Doc Bennet Omalu Slams Tua For Returning To Game ... 'Your Life Is Worth More Than $10 Billion!!!',"['Tua Tagovailoa', 'Dr. Bennet Omalu', 'Miami Dolphins', 'TMZ Sports', 'Nurse!', 'Health', 'Buffalo Bills', 'Football', 'NFL']",9/27/2022 12:20 AM,2022.0,9.0,27.0,0.0,20.0
1489,Guess Who This Lil' Goofball Turned Into!,"['Kids', 'celebrity kids', 'Photo Galleries', 'Music']",9/27/2022 12:01 AM,2022.0,9.0,27.0,0.0,1.0
1490,NASA's DART Mission Spacecraft Smacks Into Asteroid ... In Planetary Defense Test.,"['Space', 'Viral', 'NASA']",9/26/2022 6:24 PM,2022.0,9.0,26.0,18.0,24.0
1491,Tom Daley Hubby Suffered Serious Head Injury ... Recovering In Greece.,"['Tom Daley', 'Olympics', 'Movies', 'TMZ Sports', 'Couples', 'Nurse!', 'Health', 'Vacations']",9/26/2022 5:07 PM,2022.0,9.0,26.0,17.0,7.0
1492,Myles Garrett Single-Car Crash After Practice ... Video Shows Mangled Porsche.,"['Myles Garrett', 'Cleveland Browns', 'Car Crashes', 'TMZ Sports', 'Nurse!', 'Football', 'NFL']",9/26/2022 2:20 PM,2022.0,9.0,26.0,14.0,20.0
1493,"Hunt Gone Wrong MT Woman Kills, Skins Husky Dog ... Thought It Was a Wolf?!?","['Pets', 'You Might Want to Rethink', 'Weapons & Guns', 'Animals', 'Controversial S#!T']",9/26/2022 2:12 PM,2022.0,9.0,26.0,14.0,12.0
