,headline,tags,timestamp,year,month,day,hour,minute
369,Josh Allen Rips Autograph Seeker Over Football Throw ... 'Disrespectful!!!',"['Josh Allen', 'Stefon Diggs', 'TMZ Sports', 'Controversial S#!T', 'Buffalo Bills', 'Football', 'NFL']",8/8/2022 10:32 AM,2022.0,8.0,8.0,10.0,32.0
370,"Lori Loughlin Oh Canada, I Want to Visit ... Judge Approves, but Canada Could Shut Her Down.","['Lori Loughlin', 'Full House', 'CELEBRITY JUSTICE â„¢', 'Movies', 'Crime', 'Fairly Legal']",8/8/2022 9:55 AM,2022.0,8.0,8.0,9.0,55.0
371,Anne Heche New Video Shows She Almost Hit Woman ... Before Crashing into House.,"['Anne Heche', 'TV', 'Movies', 'Car Crashes', 'Nurse!', 'Drugs & Alcohol', 'Exclusive', 'Health']",8/8/2022 9:30 AM,2022.0,8.0,8.0,9.0,30.0
372,'Street Outlaws' Driver Ryan Fellows Dies in Crash ... Filming for Show in Vegas.,"['RIP', 'Hot Vegas', 'Reality TV', 'Car Crashes', 'Celebrity Death', 'TMZ Sports', 'Exclusive']",8/8/2022 8:25 AM,2022.0,8.0,8.0,8.0,25.0
373,"Attorney Bert Fields Repped Beatles, Cruise, Madonna, MJ Dead at 92.","['Bert Fields', 'Tom Cruise', 'Michael Jackson', 'RIP', 'CELEBRITY JUSTICE â„¢', 'Movies', 'Celebrity Death', 'Music', 'Fairly Legal', 'Health', 'The Beatles']",8/8/2022 7:01 AM,2022.0,8.0,8.0,7.0,1.0
374,Anne Heche Cops Think She was Intoxicated During Wreck into House ... Get Warrant for Blood.,"['Anne Heche', 'Movies', 'Nurse!', 'Drugs & Alcohol', 'Exclusive', 'Fairly Legal', 'Health', 'Police']",8/8/2022 6:50 AM,2022.0,8.0,8.0,6.0,50.0
375,Kanye 'Skete is Dead!!!' Celebratory Post After Kim & Pete Split.,"['Kanye West', 'Pete Davidson', 'Kid Cudi', 'Kim Kardashian', 'Hip Hop', 'Relationships', 'Celebrity Divorce', 'Instagram', 'Music', 'Celebrity Feuds']",8/8/2022 6:23 AM,2022.0,8.0,8.0,6.0,23.0
376,Prince Harry Underwear From Naked Vegas Romp Going Up For Sale ... Ex-Stripper Running Auction.,"['Prince Harry', 'Money', 'Hot Vegas', 'Strippers', 'Party All The Time', 'Prince Harry Vegas Pictures', 'Viral', 'Exclusive']",8/8/2022 1:00 AM,2022.0,8.0,8.0,1.0,0.0
377,'Grease' Actor Eddie Deezen Not Competent to Stand Trial ... In Maryland Assault Case.,"['Crime & Arrests', 'CELEBRITY JUSTICE â„¢', 'Movies', 'Exclusive', 'Fairly Legal', 'Health']",8/8/2022 12:40 AM,2022.0,8.0,8.0,0.0,40.0
378,Barry Sanders Saquon Will Rebound This Year ... Book It!!!,"['Barry Sanders', 'Saquon Barkley', 'TMZ Sports', 'Exclusive', 'Football', 'NFL']",8/8/2022 12:20 AM,2022.0,8.0,8.0,0.0,20.0
379,"Billie Eilish Night Racing Go-Karts ... I'm the Fast Guy, Duh!!!","['Billie Eilish', 'Family', 'TMZ Sports', 'Exclusive', 'Music']",8/8/2022 12:10 AM,2022.0,8.0,8.0,0.0,10.0
380,Guess Who This Confident Kid Turned Into!,"['Kids', 'celebrity kids', 'Photo Galleries']",8/8/2022 12:01 AM,2022.0,8.0,8.0,0.0,1.0
381,Bernie Sanders Sparks New Meme w/ Capitol Steps Pic ... Amid Vote-A-Rama in D.C.!!!,"['Bernie Sanders', 'Politix', 'Viral']",8/7/2022 3:12 PM,2022.0,8.0,7.0,15.0,12.0
382,Pink Floyd's Roger Waters Argues with CNN Host ... About Conflicts in Ukraine and China.,"['Ukraine', 'Music', 'CNN']",8/7/2022 1:54 PM,2022.0,8.0,7.0,13.0,54.0
383,Pete Rose Phillies Ceremony Criticized ... Amid Old Rape Claims/Qs.,"['Pete Rose', 'TMZ Sports', 'Philadelphia Phillies', 'MLB', 'Baseball']",8/7/2022 12:52 PM,2022.0,8.0,7.0,12.0,52.0
384,'Magnum P.I.' Star Roger E. Mosley Dead at 83.,"['RIP', 'TV', 'Celebrity Death']",8/7/2022 11:43 AM,2022.0,8.0,7.0,11.0,43.0
385,'Top Gun: Maverick' Beats 'Titanic' to Become #7 ... Highest Grossing Film.,"['Tom Cruise', 'Money', 'Movies']",8/7/2022 11:14 AM,2022.0,8.0,7.0,11.0,14.0
386,Drake Here Are the GOATs of Rap ... Lil Wayne and Nicki Minaj!!!,"['Nicki Minaj', 'Lil Wayne', 'Drake', 'Hip Hop', 'Music']",8/7/2022 10:31 AM,2022.0,8.0,7.0,10.0,31.0
387,Britney and Sam Attack Kevin Federline ... How Dare You Say Her Kids Avoid Her!!!,"['Britney Spears', 'Kevin Federline', 'Sam Asghari', 'Family', 'Relationships', 'Kids', 'Hollywood Exes', 'Music']",8/7/2022 7:15 AM,2022.0,8.0,7.0,7.0,15.0
388,Travis Scott Kylie and Stormi Go Nuts for Him ... During Sold-Out London Concert.,"['Kylie Jenner', 'Stormi Webster', 'Travis Scott', 'Family', 'Hip Hop', 'TMZ Sports', 'Music']",8/7/2022 6:42 AM,2022.0,8.0,7.0,6.0,42.0
389,"Teresa Giudice Luis, I Say 'I Do' to You!!! Glitzy Wedding Brings Out 'Real Housewives'","['Teresa Giudice', 'Reality TV', 'Relationships', 'Couples', 'Real Housewives', 'Tying The Knot']",8/7/2022 6:16 AM,2022.0,8.0,7.0,6.0,16.0
390,"Fred Durst Married Man Once Again ... Wedding #4, Sucka!!!","['Fred Durst', 'Relationships', 'Couples', 'Tying The Knot', 'Exclusive', 'Music']",8/7/2022 1:00 AM,2022.0,8.0,7.0,1.0,0.0
391,Kourtney & Travis Flying Commercial Works for Us ... What Carbon Footprint???,"['Kourtney Kardashian', 'Travis Barker', 'Family', 'Reality TV', 'Couples', 'Exclusive', 'Controversial S#!T', 'Music']",8/7/2022 12:50 AM,2022.0,8.0,7.0,0.0,50.0
392,WWE Legend X-Pac Blown Away By Logan Paul ... 'Huge Future',"['X-Pac', 'Logan Paul', 'Fights', 'TMZ Sports', 'YouTube', 'Exclusive', 'WWE']",8/7/2022 12:45 AM,2022.0,8.0,7.0,0.0,45.0
393,Maxwell Jameson Sizzles In Spain W/ Sexy Swimsuit Shots!,"['Hot Bodies', 'Summer', 'Photo Galleries', 'Models']",8/7/2022 12:35 AM,2022.0,8.0,7.0,0.0,35.0
394,Meek Mill Drops $200K On DreamChasers Chain!!! Leveling Up Post-Roc Nation.,"['Meek Mill', 'Bling!', 'Money', 'Hip Hop', 'Exclusive', 'Music']",8/7/2022 12:10 AM,2022.0,8.0,7.0,0.0,10.0
395,Mindy Kaling Good Genes or Good Docs?!,['Good Genes or Good Docs'],8/7/2022 12:01 AM,2022.0,8.0,7.0,0.0,1.0
396,Kevin Federline Me & Britney's Boys Are Purposely Avoiding Her.,"['Britney Spears', 'Kevin Federline', 'Family', 'Kids', 'Custody Battles', 'Hollywood Exes', 'Viral', 'Controversial S#!T', 'Music']",8/6/2022 5:27 PM,2022.0,8.0,6.0,17.0,27.0
397,"Nelly Performs with Ashanti, Takes Jab? ... Amid Irv Gotti 'DC' Story.","['Nelly', 'Ashanti', 'You Might Want to Rethink', 'Hip Hop', 'Relationships', 'Couples', 'Music']",8/6/2022 3:20 PM,2022.0,8.0,6.0,15.0,20.0
398,Travis Scott Headlines First Arena Concert ... Since Astroworld.,"['Travis Scott', 'Hip Hop', 'Controversial S#!T', 'Music']",8/6/2022 1:55 PM,2022.0,8.0,6.0,13.0,55.0
399,James Franco as Castro Casting Defended by Producer ... After Leguizamo Bashing.,"['John Leguizamo', 'James Franco', 'Fidel Castro', 'You Might Want to Rethink', 'Movies', 'Controversial S#!T', 'Stars In Heat', 'Celebrity Feuds']",8/6/2022 12:18 PM,2022.0,8.0,6.0,12.0,18.0
400,Obamas Crash African-American Film Fest ... At Martha's Vineyard.,"['Michelle Obama', 'Barack Obama', 'Netflix', 'Movies', 'Couples', 'Politix']",8/6/2022 11:34 AM,2022.0,8.0,6.0,11.0,34.0
401,Anne Heche Crash New Vid Shows Her Speeding Earlier ... Podcast Suggests Drinking.,"['Anne Heche', 'TV', 'Movies', 'Nurse!', 'Drugs & Alcohol', 'Crime', 'Exclusive', 'Health']",8/6/2022 10:38 AM,2022.0,8.0,6.0,10.0,38.0
402,Bill Maher Rails on Obesity and 'Body Positivity' ... It's Killing Americans.,"['Bill Maher', 'You Might Want to Rethink', 'Humor', 'TV', 'Fitness & Exercise', 'Comedy', 'Politix', 'Weight Loss & Weight Gain', 'Health']",8/6/2022 6:39 AM,2022.0,8.0,6.0,6.0,39.0
403,The Seekers Judith Durham 'Georgy Girl' Singer Dead at 79.,"['RIP', 'Celebrity Death', 'Music', 'Health']",8/6/2022 6:19 AM,2022.0,8.0,6.0,6.0,19.0
404,Terrell Owens Dispute W/ Neighbor Could've Turned Deadly.,"['Terrell Owens', '911 Call', 'Stars In Danger', 'TMZ Sports', 'Exclusive', 'Football', 'Police', 'Fights & Feuds', 'NFL']",8/6/2022 6:00 AM,2022.0,8.0,6.0,6.0,0.0
405,Travis Scott Kylie & Stormi Take London to Support ... Countdown to First Big Show.,"['Kylie Jenner', 'Stormi Webster', 'Travis Scott', 'Hip Hop', 'celebrity kids', 'Couples', 'Exclusive', 'Controversial S#!T', 'Music', 'Fairly Legal']",8/6/2022 1:00 AM,2022.0,8.0,6.0,1.0,0.0
406,Zac Efron Slammed By PETA ... After Appearing In Ad With Captive Bear.,"['Zac Efron', 'PETA', 'Animals', 'Movies', 'Exclusive', 'Controversial S#!T', 'Famous Food']",8/6/2022 12:50 AM,2022.0,8.0,6.0,0.0,50.0
407,Stars and Scars You Be the Judge.,[],8/6/2022 12:45 AM,2022.0,8.0,6.0,0.0,45.0
408,Yasiel Puig Vin Scully Was A Father Figure ... I'm So Sad He's Gone.,"['Yasiel Puig', 'Vin Scully', 'Tommy Lasorda', 'Los Angeles Dodgers', 'RIP', 'Celebrity Death', 'TMZ Sports', 'Exclusive', 'MLB', 'Baseball']",8/6/2022 12:40 AM,2022.0,8.0,6.0,0.0,40.0
409,Stars In Shiny Swimsuits Hollywood Goes Heavy Metal!,"['Hotties & Bodies', 'Hot Bodies', 'Summer', 'Photo Galleries', 'Models']",8/6/2022 12:30 AM,2022.0,8.0,6.0,0.0,30.0
410,"Joe Giudice Happy For Teresa's New Marriage ... Good Luck With Gorgas, Luis!","['Teresa Giudice', 'Joe Giudice', 'Joe Gorga', 'Melissa Gorga', 'TV', 'Family', 'Reality TV', 'Relationships', 'Couples', 'Real Housewives', 'Tying The Knot', 'Exclusive']",8/6/2022 12:20 AM,2022.0,8.0,6.0,0.0,20.0
411,What's The Big Frigin' Difference?!,"['Dancing with the Stars', ""What's The Big Frigin' Difference""]",8/6/2022 12:01 AM,2022.0,8.0,6.0,0.0,1.0
412,"Khloe Kardashian Welcome, New baby Boy!!!","['Khloe Kardashian', 'Tristan Thompson', 'Family', 'Reality TV', 'TMZ Sports', 'celebrity kids', 'Baby Watch', 'Hollywood Exes', 'NBA']",8/5/2022 7:08 PM,2022.0,8.0,5.0,19.0,8.0
413,Kim Kardashian and Pete Davidson Call It Quits After 9 Months Together.,"['Kim Kardashian', 'Pete Davidson', 'Kanye West', 'Humor', 'TV', 'Kim Kardashian Dating', 'Reality TV', 'Relationships', 'Breaking News', 'Couples', 'Comedy', 'The Kardashians']",8/5/2022 4:35 PM,2022.0,8.0,5.0,16.0,35.0
414,ALEX JONES Must Pay $45.2 Mil in Punitive Damages To Sandy Hook Parents.,"['Alex Jones', 'Weapons & Guns', 'Money', 'Family', 'Kids', 'Controversial S#!T', 'Fairly Legal', 'Stars In Heat']",8/5/2022 4:03 PM,2022.0,8.0,5.0,16.0,3.0
415,Anne Heche Crashes Car into a Home Igniting Fire ... New Video Shows Her Speeding.,"['Anne Heche', 'TV', 'Movies', 'Car Crashes', 'Nurse!', 'Drugs & Alcohol', 'Exclusive', 'Health']",8/5/2022 2:04 PM,2022.0,8.0,5.0,14.0,4.0
416,Shawn Mendes Takes a Dip in Miami ... The Beach Ain't Canceled!!!,"['Shawn Mendes', 'Miami', 'Summer/Beach', 'Hot Bodies', 'Music', 'Health']",8/5/2022 12:02 PM,2022.0,8.0,5.0,12.0,2.0
417,Kanye West 5th Divorce Attorney Quits ... As the Case Drags On.,,8/5/2022 10:17 AM,2022.0,8.0,5.0,10.0,17.0
418,Italian Decathlete Junk Falls Out During Race ... 'Obviously An Accident',"['Olympics', 'Weird News', 'Nudity', 'TMZ Sports']",8/5/2022 10:08 AM,2022.0,8.0,5.0,10.0,8.0
419,Anchorage PD 2 Officers Found in Violation For Selfies with 'White Privilege' Card Driver.,,8/5/2022 8:10 AM,2022.0,8.0,5.0,8.0,10.0
420,Wiz Khalifa Sits with Envy & Drama ... Apologizes for Nightclub DJs Rant.,,8/5/2022 7:39 AM,2022.0,8.0,5.0,7.0,39.0
421,NASCAR Champ Kyle Busch Escapes Shooting At Mall Of America ... In Chaotic Video.,,8/5/2022 7:20 AM,2022.0,8.0,5.0,7.0,20.0
422,Terrell Owens 'Karen' Incident 911 Audio ... Woman Claims T.O. 'Threatened' Her.,,8/5/2022 7:01 AM,2022.0,8.0,5.0,7.0,1.0
423,Tyler Perry I Don't Want To Talk Race with My 7-Yr-Old Son Yet!!!,,8/5/2022 6:48 AM,2022.0,8.0,5.0,6.0,48.0
424,Monkeypox U.S. Asleep at the Wheel in Responding ... Report.,,8/5/2022 6:29 AM,2022.0,8.0,5.0,6.0,29.0
425,Trevor Noah Griner's Sentence Is 'Bulls***' 'Get The F*** Out Of Here',,8/5/2022 6:20 AM,2022.0,8.0,5.0,6.0,20.0
426,Disney World 'Toy Story' Hug Characters Need to Embrace Kids of All Races ... Says Fam in Viral Video.,,8/5/2022 1:00 AM,2022.0,8.0,5.0,1.0,0.0
427,John Lennon Scathing Letter to Paul Up for Auction.,,8/5/2022 12:45 AM,2022.0,8.0,5.0,0.0,45.0
428,Alyson Hannigan Finds Buyer For 'This Is Us' House ... With $18 Million Price Tag!!!,,8/5/2022 12:30 AM,2022.0,8.0,5.0,0.0,30.0
429,Shannon Sharpe Betting NFL Calls Aaron Rodgers Over Psychedelics ... 'That's Not A Good Look',,8/5/2022 12:15 AM,2022.0,8.0,5.0,0.0,15.0
430,Jordan On MTV's 'The Hills' 'Memba Him?!,,8/5/2022 12:01 AM,2022.0,8.0,5.0,0.0,1.0
431,Elon Musk Feds Drug Tested Me After Blazing with Joe Rogan.,,8/4/2022 6:16 PM,2022.0,8.0,4.0,18.0,16.0
432,Kylie Jenner Fires Back Over 'Unsanitary' Lab Photos ... I Would Never Put My Customers at Risk!!!,,8/4/2022 3:55 PM,2022.0,8.0,4.0,15.0,55.0
433,Alex Jones $4.1M In Damages To Sandy Hook Parents ... Jury Decides.,,8/4/2022 3:01 PM,2022.0,8.0,4.0,15.0,1.0
434,Ahmaud Arbery Murderers Judge Upholds Federal Hate Crime Conviction.,,8/4/2022 2:34 PM,2022.0,8.0,4.0,14.0,34.0
435,"Monkeypox Crisis Yes, It's in Gay Community Now But WHO Expert Says Brace for Spread.",,8/4/2022 2:14 PM,2022.0,8.0,4.0,14.0,14.0
436,Mark Zuckerberg Signed Little League Card Going Up For Auction ... Nothin' Quite Like It!!!,,8/4/2022 12:10 PM,2022.0,8.0,4.0,12.0,10.0
437,Hockey Player Kicks Opponent In Face With Skate ... Cops Investigating.,,8/4/2022 12:06 PM,2022.0,8.0,4.0,12.0,6.0
438,Ne-Yo Wife Files for Divorce ... Says He Had Kid with Another Woman.,,8/4/2022 11:42 AM,2022.0,8.0,4.0,11.0,42.0
439,Machine Gun Kelly Tour Bus Vandalized With Homophobic Slur.,,8/4/2022 11:17 AM,2022.0,8.0,4.0,11.0,17.0
440,Breonna Taylor Cops Charged in Her Death ... Civil Rights Violations.,,8/4/2022 10:49 AM,2022.0,8.0,4.0,10.0,49.0
441,Malia Obama All Smiles While Out With Mystery Man ... Date To Museum?!,,8/4/2022 10:36 AM,2022.0,8.0,4.0,10.0,36.0
442,Airplane Tragedy Pilot Who Died May Have Fallen ... Trying to Eyeball Damaged Landing Gear.,,8/4/2022 8:25 AM,2022.0,8.0,4.0,8.0,25.0
443,'Selling Sunset' Heather Rae Young Sues Strip Club ... Don't Use My Pic for Promo!!!,,8/4/2022 7:41 AM,2022.0,8.0,4.0,7.0,41.0
444,Brittney Griner Sentenced To 9 Years In Russian Prison ... Biden Slams Ruling.,,8/4/2022 7:32 AM,2022.0,8.0,4.0,7.0,32.0
445,Gabby Petitio Foundation Mom Announces $100K Donation For Domestic Violence Prevention.,,8/4/2022 7:27 AM,2022.0,8.0,4.0,7.0,27.0
446,Prince William & Kate Middleton Happy Bday Wishes for Meghan Markle ... Despite Family Feud.,,8/4/2022 7:11 AM,2022.0,8.0,4.0,7.0,11.0
447,Aaron Rodgers Psychedelics Led To My Best Season ... Helped Me Love Myself.,,8/4/2022 6:50 AM,2022.0,8.0,4.0,6.0,50.0
448,Terrell Owens Heated Dispute With Neighbor ... Cops Involved.,,8/4/2022 6:45 AM,2022.0,8.0,4.0,6.0,45.0
449,Chuck E. Cheese Mom of Snubbed Kid ... Ramping Up to Sue.,,8/4/2022 1:00 AM,2022.0,8.0,4.0,1.0,0.0
450,Post Malone Gamin' For Charity ... Raises Over $200K!!!,,8/4/2022 12:50 AM,2022.0,8.0,4.0,0.0,50.0
451,"Tory Lanez Chris Brown Is The True King Of Pop, Here's A $200K Chain To Prove It!!!",,8/4/2022 12:40 AM,2022.0,8.0,4.0,0.0,40.0
452,'CHEER' STAR JERRY HARRIS Prison Life Nothing to Cheer About.,,8/4/2022 12:30 AM,2022.0,8.0,4.0,0.0,30.0
453,UFC Champ Brandon Moreno 4th Fight w/ Figueiredo Biggest Fight In Division History.,,8/4/2022 12:15 AM,2022.0,8.0,4.0,0.0,15.0
454,Guess Who This Kid With Cake Turned Into!,,8/4/2022 12:01 AM,2022.0,8.0,4.0,0.0,1.0
455,Bob Saget SCLERODERMA FUNDRAISER TURNS INTO TRIBUTE SHOW ... Celeb Friends Step In.,,8/3/2022 4:59 PM,2022.0,8.0,3.0,16.0,59.0
456,Aaron Rodgers Open To Fixing Family Relationship ... 'I Believe In Healing',,8/3/2022 3:44 PM,2022.0,8.0,3.0,15.0,44.0
457,Chrissy Teigen I'm Pregnant!!! 'Joy Has Filled Our Home and Hearts Again',,8/3/2022 2:53 PM,2022.0,8.0,3.0,14.0,53.0
458,Rep. Jackie Walorski (R-IN) Killed In Car Crash.,,8/3/2022 1:27 PM,2022.0,8.0,3.0,13.0,27.0
459,NBA's Iman Shumpert Arrested For Felony Weed Possession ... At Dallas Airport.,,8/3/2022 12:03 PM,2022.0,8.0,3.0,12.0,3.0
460,Britney Spears Catholic Church Calls BS ... You Never Asked to Get Married Here!!!,,8/3/2022 12:00 PM,2022.0,8.0,3.0,12.0,0.0
461,Alex Jones Sandy Hook Trial Confronted with His Own Texts ... Attys Accidentally Leaked.,,8/3/2022 11:04 AM,2022.0,8.0,3.0,11.0,4.0
462,Disney World's Woody Makes Sure Black Kids Greeted ... No Sesame Place Drama!!!,,8/3/2022 9:44 AM,2022.0,8.0,3.0,9.0,44.0
463,Vin Scully MLB Honoring Legend With Moments Of Silence ... Before Games.,,8/3/2022 8:54 AM,2022.0,8.0,3.0,8.0,54.0
464,NICKI MINAJ Dad's Killer Gets Sentenced to 1 Year.,,8/3/2022 8:48 AM,2022.0,8.0,3.0,8.0,48.0
465,Crash Landing Mystery 911 Recording After Pilot Jumped Out of Plane ... Minutes Before Emergency Landing.,,8/3/2022 7:28 AM,2022.0,8.0,3.0,7.0,28.0
466,"Naomi Osaka, Cordae We're Still Together!!! ... Rumors Are Bogus.",,8/3/2022 7:22 AM,2022.0,8.0,3.0,7.0,22.0
467,Jeff Bezos Mega Yacht Towed Away in Early AM ... Amid Dutch Bridge Outrage.,,8/3/2022 7:10 AM,2022.0,8.0,3.0,7.0,10.0
468,Beyonce Monica Lewinsky Gets Stung ... For Asking Bey to Change 'Partition' Lyric.,,8/3/2022 7:05 AM,2022.0,8.0,3.0,7.0,5.0
469,Tom Brady Gisele Wishes QB Happy 45th Bday ... Teammate Gets Him Custom GOAT Cake!!!,,8/3/2022 6:52 AM,2022.0,8.0,3.0,6.0,52.0
470,Post Roe v. Wade Kansas Votes Overwhelmingly for Abortion Rights.,,8/3/2022 6:14 AM,2022.0,8.0,3.0,6.0,14.0
471,L.A. Dodgers Fans Mourn Vin Scully's Death At Stadium ... Build Makeshift Memorial.,,8/3/2022 6:13 AM,2022.0,8.0,3.0,6.0,13.0
472,Rep. Nancy Pelosi Little Retail Therapy in Hawaii Before Big Taiwan Trip.,,8/3/2022 1:00 AM,2022.0,8.0,3.0,1.0,0.0
473,YING YANG TWINS' D-Roc I'm All Good After Collapse On Stage ... Life Changes On Deck.,,8/3/2022 12:45 AM,2022.0,8.0,3.0,0.0,45.0
474,'Vanderpump Rules' Lala Kent Hangin' with 50 Cent After '19 Feud ... We All Good?,,8/3/2022 12:30 AM,2022.0,8.0,3.0,0.0,30.0
475,Hasim Rahman Sr. I'll Fight Jake And Logan Paul ... Same Night!!,,8/3/2022 12:15 AM,2022.0,8.0,3.0,0.0,15.0
476,Harvey In 'Sabrina The Teenage Witch' 'Memba Him?!,,8/3/2022 12:01 AM,2022.0,8.0,3.0,0.0,1.0
477,Vin Scully Dodgers Broadcasting Legend ... Dead At 94.,,8/2/2022 8:30 PM,2022.0,8.0,2.0,20.0,30.0
478,"Jon Stewart Vet Bill Pressure Works ... GOP Senators Flip, Pass PACT Act.",,8/2/2022 6:22 PM,2022.0,8.0,2.0,18.0,22.0
479,Willow Smith Stops Show After Fan Faints in Crowd.,,8/2/2022 6:12 PM,2022.0,8.0,2.0,18.0,12.0
480,LeBron James Hits Lakers Facility W/ Sons ... Epic Workout With My Boys!!!,,8/2/2022 2:57 PM,2022.0,8.0,2.0,14.0,57.0
481,'Ferris Bueller' Star Edie McClurg Allegedly Elder Abuse Victim ... Caregiver Allegedly Sexually Assaulted.,,8/2/2022 1:41 PM,2022.0,8.0,2.0,13.0,41.0
482,Kanye West Rips Adidas For 'Yeezy Day' ... I Didn't Approve!!!,,8/2/2022 1:12 PM,2022.0,8.0,2.0,13.0,12.0
483,Demi Lovato Adds She/Her Pronouns to They/Them ... 'I've Been Feeling More Feminine Recently',,8/2/2022 1:09 PM,2022.0,8.0,2.0,13.0,9.0
484,Deshaun Watson Ban NFL In 'Really Tricky' Appeal Situation ... Andrew Brandt Says.,,8/2/2022 12:17 PM,2022.0,8.0,2.0,12.0,17.0
485,'Twilight' Star Cam Gigandet Wife Files For Divorce.,,8/2/2022 11:49 AM,2022.0,8.0,2.0,11.0,49.0
486,Thomas Markle Tabloid Honcho Files for Restraining Order ... He's Gonna Kill Me!!!,,8/2/2022 11:47 AM,2022.0,8.0,2.0,11.0,47.0
487,Soccer Player Attacks Female Ref Over Yellow Card ... Arrested.,,8/2/2022 11:30 AM,2022.0,8.0,2.0,11.0,30.0
488,Paraglider Narrowly Cheats Death ... Terrifying Scene Caught On Video.,,8/2/2022 10:05 AM,2022.0,8.0,2.0,10.0,5.0
489, Dev Patel Breaks Up Knife Fight in Australia ... Lady Allegedly Stabs Man!!! ,,8/2/2022 8:17 AM,2022.0,8.0,2.0,8.0,17.0
490,Airbnb Deletes Former Slave Quarters From Platform After Users Find Listing.,,8/2/2022 7:45 AM,2022.0,8.0,2.0,7.0,45.0
491, Angelina Jolie Mama's Got Moves!!! Hits Dance Floor at Daughter's College Event ,,8/2/2022 7:33 AM,2022.0,8.0,2.0,7.0,33.0
492, Chris Brown Defends Intimate Photos with Fans During Meet-and-Greets ,,8/2/2022 6:34 AM,2022.0,8.0,2.0,6.0,34.0
493,Blueface Fights Chrisean Rock on Streets of Hollywood ... Caught on Video.,,8/2/2022 6:25 AM,2022.0,8.0,2.0,6.0,25.0
494, Tiger Woods Turned Down LIV Golf's $700-$800 Mil ... Greg Norman Says ,,8/2/2022 6:11 AM,2022.0,8.0,2.0,6.0,11.0
495,ANA DE ARMAS Cuban Accent in Marilyn Monroe Pic Defended ... By Marilyn's Estate.,,8/2/2022 1:00 AM,2022.0,8.0,2.0,1.0,0.0
496, '90 DAY FIANCE' JORGE NAVA Gets Married in Vegas ,,8/2/2022 12:50 AM,2022.0,8.0,2.0,0.0,50.0
497, Ansel Elgort Making Out with Woman in Italy ... Amid GF Breakup Rumors ,,8/2/2022 12:40 AM,2022.0,8.0,2.0,0.0,40.0
498," 'WHY DON'T WE' DANIEL SEAVEY Gets Restraining Order Against Fan Who Broke Into House, Slept in Bed ",,8/2/2022 12:30 AM,2022.0,8.0,2.0,0.0,30.0
499, Jake Paul Challenged By Bola Osundairo ... Fight Me Saturday!! ,,8/2/2022 12:20 AM,2022.0,8.0,2.0,0.0,20.0
500, Guess Who This Toothy Kiddo Turned Into! ,,8/2/2022 12:01 AM,2022.0,8.0,2.0,0.0,1.0
501, Ben and Jen See The Marriage Certificate ... From Las Vegas Wedding ,,8/1/2022 5:34 PM,2022.0,8.0,1.0,17.0,34.0
502, Chuck E. Cheese Mom Accuses Mouse of Racial Discrimination For Ignoring Kid's High Five ,,8/1/2022 3:33 PM,2022.0,8.0,1.0,15.0,33.0
503, Killer Mike & 2 Chainz Rip ATL City Council Over â€˜Nuisanceâ€™ Ban ... Donâ€™t Silence the Little Guys!!! ,,8/1/2022 2:33 PM,2022.0,8.0,1.0,14.0,33.0
504, Deshaun Watson Women Org. Rips 6 Game Suspension ... 'Insulting & Dangerous!' ,,8/1/2022 2:32 PM,2022.0,8.0,1.0,14.0,32.0
505, Australia $1.8K McCrackdown on McMuffins ... Passenger Fined for Food in Luggage ,,8/1/2022 1:28 PM,2022.0,8.0,1.0,13.0,28.0
506, Jon Stewart D.C. Shouting Match Over Vet Bill ... Makes Peace Afterward ,,8/1/2022 12:51 PM,2022.0,8.0,1.0,12.0,51.0
507, Lil Durk Taking Time Off to Recover After Explosion on Stage ,,8/1/2022 10:48 AM,2022.0,8.0,1.0,10.0,48.0
508, Beyonce Taking Out Line In 'Renaissance' Album ... Following Ableist Backlash ,,8/1/2022 8:39 AM,2022.0,8.0,1.0,8.0,39.0
509, Drake Tests Positive For Covid-19 ... Young Money w/ Wayne and Nicki POSTPONED!!! ,,8/1/2022 8:37 AM,2022.0,8.0,1.0,8.0,37.0
510, Donald Trump Blasts Brittney Griner For Going To Russia 'Loaded Up With Drugs' ,,8/1/2022 8:14 AM,2022.0,8.0,1.0,8.0,14.0
511," Mystikal Arrested for Rape, DV in Louisiana ",,8/1/2022 7:50 AM,2022.0,8.0,1.0,7.0,50.0
512, Justin Bieber I'm Back!!! Performs for 1st Time Since Paralysis ,,8/1/2022 7:16 AM,2022.0,8.0,1.0,7.0,16.0
513, Johnny-Amber Unsealed Docs Sis Whitney Allegedly Confessed That Amber Had Cut Off His Finger ,,8/1/2022 6:57 AM,2022.0,8.0,1.0,6.0,57.0
514, Pilot Found Dead Exits Plane Midair Without Parachute ... Death Remains Mystery ,,8/1/2022 6:43 AM,2022.0,8.0,1.0,6.0,43.0
515, Elon Musk's Dad I'm Not Proud of My Son ... And He Needs to Lose Weight ,,8/1/2022 6:42 AM,2022.0,8.0,1.0,6.0,42.0
516, Deshaun Watson Suspended Six Games ... Over Sexual Misconduct Allegations ,,8/1/2022 5:57 AM,2022.0,8.0,1.0,5.0,57.0
517," 'Why Don't We' Daniel Seavey Obsessed Fan Breaks Into Home ... Sleeps in His Bed, Puts On His Clothes ",,8/1/2022 1:00 AM,2022.0,8.0,1.0,1.0,0.0
518, 'Vanderpump Rules' Tom and Katie Divorce Tension Captured on Camera ,,8/1/2022 12:40 AM,2022.0,8.0,1.0,0.0,40.0
519," Ex-UDub Star Ben Burr-Kirven Huskies Should Bolt From Pac-12 ... Join Big Ten, Big 12!!! ",,8/1/2022 12:20 AM,2022.0,8.0,1.0,0.0,20.0
520, Machine Gun Kelly Mini-Me Rocks Out Onstage ... Stuns MGK and Crowd!!! ,,8/1/2022 12:10 AM,2022.0,8.0,1.0,0.0,10.0
521, Pop Band 'Hanson' 'Memba Them?! ,,8/1/2022 12:01 AM,2022.0,8.0,1.0,0.0,1.0
522, 'Little Mermaid' Star Pat Carroll Voice of Ursula Dead at 95 ,,7/31/2022 3:36 PM,2022.0,7.0,31.0,15.0,36.0
523, Sylvester Stallone Again Lashes Out at 'Rocky' Producer Over 'Drago' Spin-Off Film ,,7/31/2022 2:47 PM,2022.0,7.0,31.0,14.0,47.0
524, 'WandaVision' Star Elizabeth Olsen Rockin' & Rollin' with Hubby ... At Wild Hearts Tour Stop!!! ,,7/31/2022 2:27 PM,2022.0,7.0,31.0,14.0,27.0
525, Ana de Armas Spanish Accent Picked Apart ... In New Marilyn Trailer ,,7/31/2022 1:26 PM,2022.0,7.0,31.0,13.0,26.0
526, 'Star Trek' Star Nichelle Nichols Dead at 89 ,,7/31/2022 12:22 PM,2022.0,7.0,31.0,12.0,22.0
527," Amber Heard Sells Yucca Valley Home, Over $1 Mil ... Scores Major Profit ",,7/31/2022 11:22 AM,2022.0,7.0,31.0,11.0,22.0
528, NBA Legend & Celtics Great Bill Russell Dead at 88 ,,7/31/2022 10:42 AM,2022.0,7.0,31.0,10.0,42.0
529, Ying Yang Twins D-Roc Collapses on Stage ,,7/31/2022 7:07 AM,2022.0,7.0,31.0,7.0,7.0
530, J Lo Enough Honeymoon Already!!! Performs at Ukrainian Relief Concert ,,7/31/2022 7:00 AM,2022.0,7.0,31.0,7.0,0.0
531," Chris Rock I Got Slapped by Suge Smith ... Take That, Will! ",,7/31/2022 6:22 AM,2022.0,7.0,31.0,6.0,22.0
532, JAYDAYOUNGAN Ambushed By 5 Gunmen ... Dad Details Fatal Shooting ,,7/31/2022 1:00 AM,2022.0,7.0,31.0,1.0,0.0
533," Billy Porter SCOTUS IS COMING FOR GAY MARRIAGE ... Slippery Slope, Clarence!!! ",,7/31/2022 12:50 AM,2022.0,7.0,31.0,0.0,50.0
534, Ric Flair I'm 'Drinking Every Night' Before Final Fight ... I'm No Good Sober!!! ,,7/31/2022 12:40 AM,2022.0,7.0,31.0,0.0,40.0
535, Luci Fang Sink Your Teeth Into Her Hot Shots! ,,7/31/2022 12:30 AM,2022.0,7.0,31.0,0.0,30.0
536, Nicky Champa and Pierre Boo TikTok Couple's Bell Canyon Home ... Hittin' The Market for Lots Of Dough!!! ,,7/31/2022 12:15 AM,2022.0,7.0,31.0,0.0,15.0
537, Celebrity Scramble Guess Who! ,,7/31/2022 12:01 AM,2022.0,7.0,31.0,0.0,1.0
538, Jake Paul Hasim Rahman Jr. Fight Canceled ... Over Weight Issue ,,7/30/2022 5:40 PM,2022.0,7.0,30.0,17.0,40.0
539, Taylor Swift Fan Claim She Donated to Environment Charity??? Likely BS Amid Jet Backlash ,,7/30/2022 3:10 PM,2022.0,7.0,30.0,15.0,10.0
540," Dave Chappelle Tokes Up, Performs with Snoop ... Wifey Likes to Party Too!!! ",,7/30/2022 2:20 PM,2022.0,7.0,30.0,14.0,20.0
541, Kate Bush's 'Wuthering Heights' Fans Gather En Masse to Dance ... All These People in Red!!! ,,7/30/2022 1:18 PM,2022.0,7.0,30.0,13.0,18.0
542, President Biden I Got Covid Again ... After Days of Being Negative ,,7/30/2022 12:25 PM,2022.0,7.0,30.0,12.0,25.0
543, Arnold Schwarzenegger Shout-Out to My Late Mother ... Day Before My 75th Bday!!! ,,7/30/2022 11:55 AM,2022.0,7.0,30.0,11.0,55.0
544, Drake Brings Out Nelly Furtado at OVO Fest ... Crowd Loses It ,,7/30/2022 11:02 AM,2022.0,7.0,30.0,11.0,2.0
545, Ivana Trump Pics of Gravesite Go Viral ... Bare at DT's Golf Course ,,7/30/2022 10:33 AM,2022.0,7.0,30.0,10.0,33.0
546, China Rocket Debris Expected To Rain Down On Earth ... AGAIN!!! ,,7/30/2022 9:34 AM,2022.0,7.0,30.0,9.0,34.0
