,headline,tags,timestamp,year,month,day,hour,minute
1986,Warren Moon Gronk Could Save The Bucs ... If He'd Just Come Back!!!,"['Warren Moon', 'Rob Gronkowski', 'You Might Want to Rethink', 'TMZ Sports', 'Exclusive', 'Tampa Bay Buccaneers', 'Football', 'NFL']",10/26/2022 12:15 AM,2022.0,10.0,26.0,0.0,15.0
1987,Guess Who This Candy Lover Turned Into!,"['Kids', 'celebrity kids', 'Halloween']",10/26/2022 12:01 AM,2022.0,10.0,26.0,0.0,1.0
1988,Antonio Brown Issues Support For Kanye West ... Claims 'Selective Outrage' Over Comments.,"['Kanye West', 'Antonio Brown', 'You Might Want to Rethink', 'Hip Hop', 'TMZ Sports', 'Controversial S#!T', 'Music', 'Football', 'NFL']",10/25/2022 7:31 PM,2022.0,10.0,25.0,19.0,31.0
1989,Sylvester Stallone I Need Some Hair Product ... Jennifer's Got My Back!!!,"['Sylvester Stallone', 'Jennifer Flavin', 'Beauty', 'Relationships', 'Movies', 'TMZ Sports', 'Couples', 'The Kardashians']",10/25/2022 5:57 PM,2022.0,10.0,25.0,17.0,57.0
1990,"Aaron Donald, Jaylen Brown Leaving Donda Sports ... Amid Kanye Controversy.","['Aaron Donald', 'Jaylen Brown', 'Kanye West', 'Los Angeles Rams', 'Boston Celtics', 'TMZ Sports', 'Controversial S#!T', 'Football', 'NFL']",10/25/2022 3:47 PM,2022.0,10.0,25.0,15.0,47.0
1991,Russell Wilson Pours Heart Out For Ciara ... Emotional Bday Post.,"['Ciara', 'Russell Wilson', 'Denver Broncos', 'TMZ Sports', 'Couples', 'Birthdays', 'Football', 'NFL']",10/25/2022 1:56 PM,2022.0,10.0,25.0,13.0,56.0
1992,Jacob Elordi I'm The King Too ... Better Elvis Than Butler???,"['Priscilla Presley', 'Elvis Presley', 'Movies', 'Music']",10/25/2022 11:34 AM,2022.0,10.0,25.0,11.0,34.0
1993,McDonald's Shooting Teen Shot By Cop Battling Pneumonia in Hospital.,"['Weapons & Guns', 'Family', 'Crime', 'Health', 'Police']",10/25/2022 11:24 AM,2022.0,10.0,25.0,11.0,24.0
1994,Leslie Jordan Complained of Shortness of Breath ... Scheduled Cardiologist Appt.,"['Leslie Jordan', 'Dolly Parton', 'RIP', 'TV', 'LGBT', 'Movies', 'Car Crashes', 'Celebrity Death', 'Nurse!', 'Exclusive', 'Music', 'Health']",10/25/2022 10:09 AM,2022.0,10.0,25.0,10.0,9.0
1995,Kourtney & Travis We Bought Conan O'Brien's Home ... Steps From the Beach!!!,"[""Conan O'Brien"", 'Kourtney Kardashian', 'Travis Barker', 'Money', 'Reality TV', 'Couples', 'Comedy', 'Late Night', 'Celebrity Homes']",10/25/2022 9:43 AM,2022.0,10.0,25.0,9.0,43.0
1996,Kanye West Loses Billionaire Status ... After Adidas Deal Nixed.,"['Kanye West', 'Money', 'Hip Hop', 'TMZ Sports', 'Music']",10/25/2022 8:17 AM,2022.0,10.0,25.0,8.0,17.0
1997,Steve Lacy Destroys Fan's Phone on Stage ... In Fit of Rage.,"['Hip Hop', 'Controversial S#!T', 'Music']",10/25/2022 8:08 AM,2022.0,10.0,25.0,8.0,8.0
1998,Drake It's My Birthday ... Let's Party!!! Celebs Hit Miami Bash.,"['Drake', 'Hip Hop', 'Birthdays', 'Party All The Time', 'Music']",10/25/2022 6:41 AM,2022.0,10.0,25.0,6.0,41.0
1999,"Amazon Driver Killed, Apparent Dog Attack in MO.","['Pets', 'RIP', 'Viral', 'News']",10/25/2022 6:27 AM,2022.0,10.0,25.0,6.0,27.0
2000,James Corden Sorry Again for Acting Like a Jerk at Restaurant ... I Wanna Make It Right.,"['James Corden', 'TV', 'Controversial S#!T', 'Late Night', 'Famous Food']",10/25/2022 6:11 AM,2022.0,10.0,25.0,6.0,11.0
2001,Brittney Griner Appeal In Russia Denied ... 9-Year Sentence Upheld.,"['Brittney Griner', 'TMZ Sports', 'Breaking News', 'Basketball', 'Fairly Legal', 'WNBA']",10/25/2022 6:08 AM,2022.0,10.0,25.0,6.0,8.0
2002,Kanye West Adidas Ends Partnership.,"['Kanye West', 'Adidas', 'You Might Want to Rethink', 'Money', 'Hip Hop', 'Fashion', 'TMZ Sports', 'Controversial S#!T', 'Music']",10/25/2022 4:45 AM,2022.0,10.0,25.0,4.0,45.0
2003,"Erika Jayne Accuses Kathy of Using Gay Slur in Aspen ... Kathy, Others Deny It.","['Erika Jayne', 'Kathy Hilton', 'Reality TV', 'Real Housewives', 'Controversial S#!T']",10/25/2022 1:00 AM,2022.0,10.0,25.0,1.0,0.0
2004,"'Entourage' Creator Doug Ellin Hell Yes, Let's Boycott Adidas ... Silence On Kanye Is All About Money!!!","['Doug Ellin', 'Kanye West', 'Entourage', 'TV', 'Hip Hop', 'Exclusive', 'Controversial S#!T', 'Music']",10/25/2022 12:50 AM,2022.0,10.0,25.0,0.0,50.0
2005,ELVIS PRESLEY Buyer Can't Help Falling in Love With $5.65M Desert Home.,"['Elvis Presley', 'Priscilla Presley', 'Exclusive', 'Music', 'Celebrity Homes']",10/25/2022 12:40 AM,2022.0,10.0,25.0,0.0,40.0
2006,Celebs On Halloween Group Costumes With the Fam!!!,"['Family', 'celebrity kids', 'Holidaze', 'Photo Galleries', 'Halloween']",10/25/2022 12:30 AM,2022.0,10.0,25.0,0.0,30.0
2007,Roy Jones Jr. Fighting NDO Champ ... Gets Celebrity Boxing Opponent!,"['Roy Jones Jr.', 'Boxing', 'TMZ Sports', 'YouTube', 'Exclusive']",10/25/2022 12:20 AM,2022.0,10.0,25.0,0.0,20.0
2008,Guess Who This Monster Athlete Turned Into!,"['Olympics', 'celebrity kids', 'Photo Galleries']",10/25/2022 12:01 AM,2022.0,10.0,25.0,0.0,1.0
2009,"Barack Obama Joins Eli, Peyton On 'Manningcast' ... Manning's 'Dream Guest'","['Eli Manning', 'Barack Obama', 'Peyton Manning', 'TMZ Sports']",10/24/2022 6:48 PM,2022.0,10.0,24.0,18.0,48.0
2010,TYCOON RAINER SCHALLER Missing Plane Crashed ... But No Confirmation on Deaths.,"['TMZ Sports', 'Fitness & Exercise', 'News']",10/24/2022 5:35 PM,2022.0,10.0,24.0,17.0,35.0
2011,Kanye West 'Jeen-Yuhs' Doc Staying On Netflix.,"['Kanye West', 'TV', 'Netflix', 'Hip Hop', 'Music']",10/24/2022 5:12 PM,2022.0,10.0,24.0,17.0,12.0
2012,Armie Hammer Sued by AmEx ... He's Dodging $67k Balance!!!,"['Armie Hammer', 'Elizabeth Chambers', 'Money', 'Movies', 'Exclusive', 'Fairly Legal']",10/24/2022 3:05 PM,2022.0,10.0,24.0,15.0,5.0
2013,NFL's Lance Kendricks Arrested For DUI ... Allegedly Passed Out Behind Wheel.,"['Lance Kendricks', 'Crime & Arrests', 'DUI', 'TMZ Sports', 'Exclusive', 'Football', 'Police', 'NFL']",10/24/2022 3:04 PM,2022.0,10.0,24.0,15.0,4.0
2014,"Iggy Azalea Checks Raiders Reporter... Stay Mad, I Slayed & Got Paid!!! 💸.","['Iggy Azalea', 'Las Vegas Raiders', 'Hip Hop', 'TMZ Sports', 'Music', 'Football', 'NFL']",10/24/2022 1:23 PM,2022.0,10.0,24.0,13.0,23.0
2015,Kanye West Anti-Semitism Has Domino Effect ... Jewish Fed. Exec Says.,"['Kanye West', 'Religion/ Spirituality', 'Hip Hop', 'Exclusive', 'Controversial S#!T', 'Music']",10/24/2022 12:26 PM,2022.0,10.0,24.0,12.0,26.0
2016,Leslie Jordan Dead at 67.,"['Leslie Jordan', 'RIP', 'Humor', 'TV', 'LGBT', 'Movies', 'Celebrity Death', 'Comedy', 'Exclusive']",10/24/2022 11:13 AM,2022.0,10.0,24.0,11.0,13.0
2017,Blac Chyna Sex Trafficking Claims Are BS ... TikToker Sticks By Story.,"['Blac Chyna', 'Kim Kardashian', 'Kanye West', 'Kris Jenner', 'Sex', 'Models', 'Fairly Legal', 'OnlyFans']",10/24/2022 10:33 AM,2022.0,10.0,24.0,10.0,33.0
2018,Lil Durk Cleared in 2019 Shooting Case ... 5 Felonies Dropped.,"['Lil Durk', 'Weapons & Guns', 'Crime & Arrests', 'Hip Hop', 'Exclusive Details', 'Music']",10/24/2022 9:54 AM,2022.0,10.0,24.0,9.0,54.0
2019,"Sen. Ted Cruz Heckled on 'The View' ... 'F*** You!!!"".","['Ted Cruz', 'TV', 'The View', 'Politix']",10/24/2022 9:47 AM,2022.0,10.0,24.0,9.0,47.0
2020,Kim Kardashian 'I Stand With Jewish Community' ... In Wake of Kanye's Anti-Semitic Rant.,"['Kim Kardashian', 'Kanye West', 'Religion/ Spirituality', 'Hollywood Exes', 'Controversial S#!T']",10/24/2022 9:34 AM,2022.0,10.0,24.0,9.0,34.0
2021,Kanye West No Longer with Johnny Depp's Attorney ... After Refusing to Retract Hateful Statements.,"['Kanye West', 'Johnny Depp', 'Hip Hop', 'Fashion', 'Exclusive', 'Controversial S#!T', 'Music', 'Fairly Legal', 'TMZ Podcast']",10/24/2022 9:23 AM,2022.0,10.0,24.0,9.0,23.0
2022,Fyre Fest's Billy McFarland I've Got Somethin' In The Works ... New Festival Coming!?!,"['You Might Want to Rethink', 'Money', 'Crime', 'Music', 'Fairly Legal', 'Famous Food']",10/24/2022 9:00 AM,2022.0,10.0,24.0,9.0,0.0
2023,Olivia Wilde Dances at Harry's Concert in L.A..,"['Olivia Wilde', 'Harry Styles', 'Jason Sudeikis', 'Breakups', 'Relationships', 'Movies', 'Music', 'Fights & Feuds']",10/24/2022 8:22 AM,2022.0,10.0,24.0,8.0,22.0
2024,"WWE Legend Kevin Nash Son, Tristen, Died After Seizure.","['Kevin Nash', 'RIP', 'Celebrity Death', 'TMZ Sports', 'celebrity kids', 'WWE']",10/24/2022 8:03 AM,2022.0,10.0,24.0,8.0,3.0
2025,Blue Ivy Gets into Bidding War for Earrings ... 5-Figure Offer Comes Up Short!!!,"['Blue Ivy Carter', 'Jay-z', 'Beyonce Knowles', 'Keke Palmer', 'Tina Knowles', 'Bling!', 'Money', 'Hip Hop', 'celebrity kids', 'Music']",10/24/2022 7:16 AM,2022.0,10.0,24.0,7.0,16.0
2026,Ted Cruz Booed & Flipped Off At Yankees Game 'You Racist Piece Of S***!!!',"['Ted Cruz', 'Houston Astros', 'TMZ Sports', 'World Series', 'Politix', 'MLB', 'Baseball', 'New York Yankees']",10/24/2022 7:15 AM,2022.0,10.0,24.0,7.0,15.0
2027,"Kim Kardashian, Ivanka Trump Old Friends Back Together 3 Hr. Dinner in Bev Hills.","['Kim Kardashian', 'Ivanka Trump', 'Donald Trump', 'Jared Kushner', 'Money', 'Beauty', 'Reality TV', 'Politix', 'Famous Food']",10/24/2022 7:05 AM,2022.0,10.0,24.0,7.0,5.0
2028,Khloe Kardashian Solidarity with Jewish Community 1st Kardashian to Speak Out.,"['Khloe Kardashian', 'Kanye West', 'Religion/ Spirituality', 'Hip Hop', 'Reality TV', 'Music', 'Celebrity Feuds']",10/24/2022 6:35 AM,2022.0,10.0,24.0,6.0,35.0
2029,"Antonio Brown Tom Keeps Losing, And I Keep Trollin' ... Posts Another Gisele Pic.","['Tom Brady', 'Gisele Bundchen', 'Antonio Brown', 'Relationships', 'TMZ Sports', 'Tampa Bay Buccaneers', 'Celebrity Feuds', 'Football', 'NFL']",10/24/2022 6:17 AM,2022.0,10.0,24.0,6.0,17.0
2030,Zak Bagans I Captured a Ghost Chair ... On Camera in the Murder House!!!,"['Zak Bagans', 'TV', 'Holidaze', 'Exclusive', 'Ghost Adventures', 'Halloween']",10/24/2022 1:00 AM,2022.0,10.0,24.0,1.0,0.0
2031,Big Sean Need Time Off to Master Fatherhood And Pick Baby Names!!!,"['Big Sean', 'Jhene Aiko', 'Hip Hop', 'Relationships', 'Baby Watch', 'Exclusive', 'Music']",10/24/2022 12:50 AM,2022.0,10.0,24.0,0.0,50.0
2032,Ja Morant Cops '12SKII' Diamond Chain ... Matching AP Watch!!!,"['Ja Morant', 'Bling!', 'TMZ Sports', 'Memphis Grizzlies', 'Basketball', 'NBA', 'Exclusive']",10/24/2022 12:40 AM,2022.0,10.0,24.0,0.0,40.0
2033,Stars Dressed As Celebs ... Two For The Price Of One!,"['Photo Galleries', 'Halloween']",10/24/2022 12:30 AM,2022.0,10.0,24.0,0.0,30.0
2034,Brunch With The Dead Enjoy a Meal With Departed Loved Ones ... In New Vegas Production.,"['RIP', 'Hot Vegas', 'Family', 'Weird News', 'Exclusive', 'Famous Food']",10/24/2022 12:20 AM,2022.0,10.0,24.0,0.0,20.0
2035,Pugsley Addams In 'The Addams Family' 'Memba Him?!,"['Kids', 'celebrity kids', 'Photo Galleries', 'Halloween']",10/24/2022 12:01 AM,2022.0,10.0,24.0,0.0,1.0
2036,Adidas On Blast Amid Ye's Anti-Semitism ... Nazi History Resurfaces.,"['Kanye West', 'You Might Want to Rethink', 'Fashion', 'TMZ Sports', 'Controversial S#!T']",10/23/2022 2:46 PM,2022.0,10.0,23.0,14.0,46.0
2037,Brad Pitt Snubs F1 Journo Martin Brundle Racing Community Pissed.,"['Brad Pitt', 'You Might Want to Rethink', 'Movies', 'TMZ Sports', 'NASCAR', 'Viral', 'Controversial S#!T', 'Formula 1']",10/23/2022 1:58 PM,2022.0,10.0,23.0,13.0,58.0
2038,"Celeb Chef Curtis Stone Corden's Great at My Restaurant ... Don't Out Patrons, Y'all.","['James Corden', 'TV', 'Exclusive', 'Controversial S#!T', 'Late Night', 'Famous Food']",10/23/2022 12:38 PM,2022.0,10.0,23.0,12.0,38.0
2039,"Perry Collaborator, 'AGT' Star Zuri Craig Dead at 44.","['Tyler Perry', ""America's Got Talent"", 'RIP', 'Movies', 'Celebrity Death', 'Music']",10/23/2022 12:00 PM,2022.0,10.0,23.0,12.0,0.0
2040,Climate Change Activists Dirty Up Monet Painting ... Thanksgiving Style?!?,"['Viral', 'Controversial S#!T', 'Famous Food']",10/23/2022 11:19 AM,2022.0,10.0,23.0,11.0,19.0
2041,Ye Anti-Semitic Banners Fly in L.A. ... Kanye's 'Right About the Jews',"['Kanye West', 'Hip Hop', 'Controversial S#!T', 'Music']",10/23/2022 10:33 AM,2022.0,10.0,23.0,10.0,33.0
2042,Cardi B Goes Nuclear on Madonna ... For 'Pave the Way' Note.,"['Cardi B', 'Madonna', 'You Might Want to Rethink', 'Hip Hop', 'Twitter', 'Controversial S#!T', 'Music', 'Celebrity Feuds']",10/23/2022 10:23 AM,2022.0,10.0,23.0,10.0,23.0
2043,Travis Scott 'I Don't Know This Person' ... Denies Hanging with Ex-GF.,"['Travis Scott', 'Hip Hop', 'Relationships', 'Music']",10/23/2022 9:35 AM,2022.0,10.0,23.0,9.0,35.0
2044,J Lo & Ben Affleck Someone's Getting the Boot!!! Go Wild Western Shopping.,"['Jennifer Lopez', 'Ben Affleck', 'Family', 'Relationships', 'Movies', 'celebrity kids', 'Couples', 'Holidaze', 'Music', 'Halloween']",10/23/2022 8:23 AM,2022.0,10.0,23.0,8.0,23.0
2045,Stacey Abrams Crashes Latto Show ... Give Me 'Big Energy' on Election Day!!!,"['Latto', 'Hip Hop', 'Politix', 'Viral', 'Music']",10/23/2022 7:47 AM,2022.0,10.0,23.0,7.0,47.0
2046,"Robbie Coltrane 'Harry Potter' Star's Cause of Death ... Infection, Heart Issues.","['Robbie Coltrane', 'RIP', 'Movies', 'Celebrity Death', 'Health']",10/23/2022 7:22 AM,2022.0,10.0,23.0,7.0,22.0
2047,Kim Kardashian Vegas Party Flight Forced Back to L.A. ... Plan B: Shots & Late Night Burgers!!!,"['Kim Kardashian', 'Hot Vegas', 'Reality TV', 'Birthdays', 'Party All The Time', 'Famous Food']",10/23/2022 6:56 AM,2022.0,10.0,23.0,6.0,56.0
2048,Day Care Horror Mask Stunt Workers Deserve Jail Time For Traumatizing My Kid.,"['Kids', 'Viral', 'Exclusive', 'Controversial S#!T', 'Fairly Legal', 'Halloween']",10/23/2022 1:00 AM,2022.0,10.0,23.0,1.0,0.0
2049,Gavin DeGraw Late Cancel on Boys & Girls Club ... Falls Ill on Day of Event.,"['Gavin DeGraw', 'Kids', 'Exclusive', 'Music', 'Health']",10/23/2022 12:50 AM,2022.0,10.0,23.0,0.0,50.0
2050,Jake Paul Warns Bettors Picking Silva ... 'Ya Shouldn't Have Done It!!!',"['Anderson Silva', 'Jake Paul', 'Money', 'Boxing', 'Fights', 'TMZ Sports', 'MMA', 'UFC', 'Exclusive', 'Influencers']",10/23/2022 12:40 AM,2022.0,10.0,23.0,0.0,40.0
2051,Robert Englund Good Genes or Good Docs?!,"['Photo Galleries', 'Good Genes or Good Docs', 'Halloween']",10/23/2022 12:30 AM,2022.0,10.0,23.0,0.0,30.0
2052,'Love Island USA' Timmy Pandolfi & Zeta Morrison ... We Still Goin' Strong!!!,"['TV', 'Reality TV', 'Relationships', 'Couples', 'Exclusive']",10/23/2022 12:15 AM,2022.0,10.0,23.0,0.0,15.0
2053,Celebrity Scramble Guess Who!,"['Celebrity Scramble', 'Photo Galleries', 'Halloween']",10/23/2022 12:01 AM,2022.0,10.0,23.0,0.0,1.0
2054,"Tycoon Rainer Schaller He & Fam Missing, Plane Vanishes ... Co. Owns Gold's Gym.","['RIP', 'Weird News', 'Celebrity Death', 'TMZ Sports', 'Breaking News', 'Fitness & Exercise', 'Viral']",10/22/2022 3:40 PM,2022.0,10.0,22.0,15.0,40.0
2055,Beyoncé Fans Slam Kelis for Hair Play Video ... More Mad at Bey Than This?,"['Beyonce Knowles', 'Kelis', 'Hip Hop', 'Twitter', 'Controversial S#!T', 'Music', 'Celebrity Feuds']",10/22/2022 2:40 PM,2022.0,10.0,22.0,14.0,40.0
2056,RIP Monkey Seems to Mourn Dead Guy ... Supposedly Pet to Owner.,"['RIP', 'Animals', 'Viral']",10/22/2022 1:39 PM,2022.0,10.0,22.0,13.0,39.0
2057,Meghan Markle No 'Deals' Here in Montecito ... Luxury Shopping Time!!!,"['Meghan Markle', 'You Might Want to Rethink', 'Fashion', 'Royal Family', 'Exclusive', 'Controversial S#!T']",10/22/2022 1:00 PM,2022.0,10.0,22.0,13.0,0.0
2058,Superman 'Black Adam' Cameo was Headless ... Before Cavill Deal Struck.,"['Henry Cavill', 'DC Comics', 'Twitter', 'Movies', 'Superman']",10/22/2022 11:55 AM,2022.0,10.0,22.0,11.0,55.0
2059,Jeffrey Dahmer Pizza Finger and Eyeball Toppings!?! TX Spot Dishing Controversy.,"['Jeffrey Dahmer', 'You Might Want to Rethink', 'TV', 'Netflix', 'Controversial S#!T', 'Famous Food']",10/22/2022 11:01 AM,2022.0,10.0,22.0,11.0,1.0
2060,Indiana School Board Candidate ... Not All Nazis Were Bad.,"['Politix', 'Controversial S#!T', 'Coronavirus']",10/22/2022 10:39 AM,2022.0,10.0,22.0,10.0,39.0
2061,John Lennon Final Letter Sells for Nearly $64K ... Higher Than Expected!!!,"['John Lennon', 'Money', 'Celebrity Death', 'Exclusive', 'Music', 'The Beatles']",10/22/2022 9:54 AM,2022.0,10.0,22.0,9.0,54.0
2062,French Montana Honored As 'Innovator' ... Raises $226 Mil for African Healthcare.,"['French Montana', 'Money', 'Hip Hop', 'Exclusive Details', 'Music', 'Health']",10/22/2022 9:35 AM,2022.0,10.0,22.0,9.0,35.0
2063,Kim Kardashian Family Rallies for 42nd Celebration!!! B-Day Party & Vintage Vids.,"['Kim Kardashian', 'TV', 'Family', 'Reality TV', 'Birthdays', 'Party All The Time', 'The Kardashians']",10/22/2022 9:22 AM,2022.0,10.0,22.0,9.0,22.0
2064,Doja Cat Puts Celebs in a Masquerade ... Illuminati-Themed Bday Gala!!!,"['Doja Cat', 'Hip Hop', 'Fashion', 'Birthdays', 'Party All The Time', 'Music']",10/22/2022 8:30 AM,2022.0,10.0,22.0,8.0,30.0
2065,Ye Backlash Against Me Proves My Anti-Semitic Theory ... Echoes Hitler in Odd News Conference.,"['Kanye West', 'Hip Hop', 'Controversial S#!T', 'Music']",10/22/2022 7:48 AM,2022.0,10.0,22.0,7.0,48.0
2066,Kanye West Wintour Is Not Coming!!! Vogue Honcho Severs Ties With Ye.,"['Kanye West', 'Anna Wintour', 'Fashion Week', 'Hip Hop', 'Fashion', 'Controversial S#!T', 'Music']",10/22/2022 6:59 AM,2022.0,10.0,22.0,6.0,59.0
2067,"Kanye West Yeezy Resale Market Unmoved, For Now ... All Eyes on Adidas.","['Kanye West', 'Money', 'Hip Hop', 'Fashion', 'TMZ Sports', 'Exclusive', 'Controversial S#!T', 'Music']",10/22/2022 1:00 AM,2022.0,10.0,22.0,1.0,0.0
2068,ADAM SANDLER DAUGHTERS MAKING $65K FOR NEW MOVIE.,"['Adam Sandler', 'Netflix', 'Money', 'Movies', 'Kids', 'celebrity kids', 'Exclusive']",10/22/2022 12:55 AM,2022.0,10.0,22.0,0.0,55.0
2069,Stars and Scars You Be the Judge.,[],10/22/2022 12:45 AM,2022.0,10.0,22.0,0.0,45.0
2070,Dana White Sean O'Malley Can Be UFC's Next Star ... But He Needs To Win!,"['Dana White', 'Conor McGregor', ""Sean O'Malley"", 'Fights', 'TMZ Sports', 'MMA', 'UFC', 'Exclusive']",10/22/2022 12:40 AM,2022.0,10.0,22.0,0.0,40.0
2071,TMZ's Celebrity Pumpkin Stencils .... Cut It Out!,"['Photo Galleries', 'Halloween']",10/22/2022 12:30 AM,2022.0,10.0,22.0,0.0,30.0
2072,Bill Paxton Son Supports 'Twister' Sequel ... Dad Would OK Female Lead.,"['Bill Paxton', 'Helen Hunt', 'RIP', 'Family', 'Movies', 'Celebrity Death', 'celebrity kids', 'Exclusive']",10/22/2022 12:15 AM,2022.0,10.0,22.0,0.0,15.0
2073,What's The Big Frigin' Difference?!,"['Photo Galleries', ""What's The Big Frigin' Difference"", 'Halloween']",10/22/2022 12:01 AM,2022.0,10.0,22.0,0.0,1.0
2074,Cardi B Wins Lawsuit Over Mixtape Cover ... 'I Was Pretty Nervous!!!',"['Cardi B', 'Hip Hop', 'Music', 'Fairly Legal']",10/21/2022 5:38 PM,2022.0,10.0,21.0,17.0,38.0
2075,Brad Pitt I've Got The Formula ... Hits F1 Race In Texas.,"['Brad Pitt', 'Movies', 'TMZ Sports', 'Formula 1']",10/21/2022 4:15 PM,2022.0,10.0,21.0,16.0,15.0
2076,'House Of The Dragon' Season Finale Leaks Early Online!!! ... HBO Calls Out Distribution Partner.,"['You Might Want to Rethink', 'TV', 'Game of Thrones']",10/21/2022 3:02 PM,2022.0,10.0,21.0,15.0,2.0
2077,Camdan McWright SJSU Football Player Killed In Scooter Accident ... 18 Years Old.,"['RIP', 'TMZ Sports', 'NCAA', 'Football']",10/21/2022 12:53 PM,2022.0,10.0,21.0,12.0,53.0
2078,"Johnny Depp, Jeff Beck SUE MAN WHO SAYS THEY STOLE LYRICS ... It's Textbook Shakedown!!!","['Johnny Depp', 'Money', 'Movies', 'Exclusive', 'Music', 'Fairly Legal']",10/21/2022 12:47 PM,2022.0,10.0,21.0,12.0,47.0
2079,Kanye West Hires Johnny Depp's Attorney from Heard Trial As Fallout Continues.,"['Johnny Depp', 'Kanye West', 'Amber Heard', 'Hip Hop', 'Exclusive', 'Music', 'Fairly Legal', 'The Kardashians']",10/21/2022 12:10 PM,2022.0,10.0,21.0,12.0,10.0
2080,Day Care Scare Freddy Kruger Comes to Play!!!,"['Kids', 'Crime', 'Viral', 'Controversial S#!T', 'Fairly Legal', 'Halloween']",10/21/2022 11:03 AM,2022.0,10.0,21.0,11.0,3.0
2081,"Jimmy G, Christian McCaffrey S.F. Forty-Finers Who'd You Rather?!?","['Jimmy Garoppolo', 'Christian McCaffrey', 'Hot Bodies', 'San Francisco 49ers', 'TMZ Sports', 'Football', 'NFL']",10/21/2022 10:19 AM,2022.0,10.0,21.0,10.0,19.0
2082,DAY CARE MADNESS Parents Demanded Felony Charges Over Horror Mask Scares.,"['Kids', 'Crime', 'Controversial S#!T', 'Fairly Legal', 'Halloween']",10/21/2022 9:59 AM,2022.0,10.0,21.0,9.0,59.0
2083,"Mental Health Crisis in America Man Stabs Mother, Dog with Samurai Sword.","['Pets', 'Family', 'Nurse!', 'Fairly Legal', 'Health', 'Police']",10/21/2022 7:45 AM,2022.0,10.0,21.0,7.0,45.0
2084,Fivio Foreign Nets Performance Wasn't My Fault... I Need a Do-Over!!!,"['Fivio Foreign', 'Hip Hop', 'Brooklyn Nets', 'TMZ Sports', 'Basketball', 'NBA', 'Music']",10/21/2022 7:26 AM,2022.0,10.0,21.0,7.0,26.0
2085,"Olivia Wilde, Jason Sudeikis Alleged Dog Walker Says ... I Was Cut Off from Gordon!!!","['Jason Sudeikis', 'Olivia Wilde', 'Harry Styles', 'Pets', 'Breakups', 'Relationships', 'Movies']",10/21/2022 7:09 AM,2022.0,10.0,21.0,7.0,9.0
2086,Kanye West Balenciaga Ends Relationship.,"['Kanye West', 'Religion/ Spirituality', 'Money', 'Hip Hop', 'Fashion', 'Controversial S#!T', 'Music']",10/21/2022 6:20 AM,2022.0,10.0,21.0,6.0,20.0
2087,"James Corden Ya Know, I Don't Apologize After All.","['James Corden', 'TV', 'Controversial S#!T', 'Late Night', 'Famous Food']",10/21/2022 5:47 AM,2022.0,10.0,21.0,5.0,47.0
2088,"Taylor Swift Album Drops, Spotify Flops ... But Great Recovery!!!","['Taylor Swift', 'Money', 'Viral', 'Music']",10/21/2022 5:46 AM,2022.0,10.0,21.0,5.0,46.0
2089,Kanye West Condemned Over Using R-Word.,"['Kanye West', 'Hip Hop', 'Exclusive', 'Controversial S#!T', 'Music', 'Health']",10/21/2022 1:00 AM,2022.0,10.0,21.0,1.0,0.0
2090,'RHOBH' Kathy Hilton Lisa Rinna & Erika Jayne Are Bullies!!! ... And I Ain't Coming Back Unless They're Gone.,"['Erika Jayne', 'Lisa Rinna', 'Kathy Hilton', 'TV', 'Reality TV', 'Real Housewives', 'Exclusive', 'Celebrity Feuds']",10/21/2022 12:50 AM,2022.0,10.0,21.0,0.0,50.0
2091,"Amanda Bynes Back Together with Ex-Fiancé ... Romantic, But Not Engaged.","['Amanda Bynes', 'TV', 'Relationships', 'Couples', 'Exclusive']",10/21/2022 12:40 AM,2022.0,10.0,21.0,0.0,40.0
2092,Celebrity Halloween Costumes Who'd You Rather?!,"['Hot Bodies', 'TMZ Sports', 'Holidaze', 'Photo Galleries', 'Halloween']",10/21/2022 12:30 AM,2022.0,10.0,21.0,0.0,30.0
2093,Ric Flair Undecided On Wrestling Again ... 'Never Say Never',"['Ric Flair', 'Fights', 'TMZ Sports', 'Drugs & Alcohol', 'Exclusive', 'WWE']",10/21/2022 12:15 AM,2022.0,10.0,21.0,0.0,15.0
2094,Guess Who This Little Ghost Rider Turned Into!,"['Kids', 'celebrity kids', 'Photo Galleries', 'Halloween']",10/21/2022 12:01 AM,2022.0,10.0,21.0,0.0,1.0
2095,Daycare Madness Horror Mask Pranksters Charged with Multiple Felonies.,"['Kids', 'Crime', 'Viral', 'Fairly Legal']",10/20/2022 4:04 PM,2022.0,10.0,20.0,16.0,4.0
2096,Jay-Z Sues I'm Selling My Stake in D'Ussé ... But Bacardi's Trying to Lowball Me!!!,"['Jay-z', 'Money', 'Hip Hop', 'Exclusive', 'Music', 'commerce']",10/20/2022 3:50 PM,2022.0,10.0,20.0,15.0,50.0
2097,TLC's 'Welcome To Plathville' Kim Plath Arrested For DUI ... Following Crash In June.,"['TV', 'Crime & Arrests', 'Reality TV', 'Exclusive Details', 'Car Crashes', 'Drugs & Alcohol', 'Fairly Legal']",10/20/2022 3:42 PM,2022.0,10.0,20.0,15.0,42.0
2098,MSU's Sam Westmoreland Found Dead At A Church ... Cops Say.,"['RIP', 'TMZ Sports', 'NCAA', 'Exclusive', 'Football']",10/20/2022 3:28 PM,2022.0,10.0,20.0,15.0,28.0
2099,'Southern Charm' Naomie Olindo Sued By Former Business Partner ... You Forced Me Out!!!,"['Money', 'Reality TV', 'Fashion', 'Exclusive', 'Fairly Legal']",10/20/2022 3:20 PM,2022.0,10.0,20.0,15.0,20.0
2100,Tia Mowry's Divorce It's 'Going Well' with Cory & Kids!!! As for Reconciliation ....,"['Tia Mowry', 'Relationships', 'celebrity kids', 'Celebrity Divorce']",10/20/2022 2:34 PM,2022.0,10.0,20.0,14.0,34.0
2101,Chess Grandmaster Hans Niemann Sues Rival For $100 Million ... Your False Cheating Claims Ruined My Life!!!,"['Money', 'TMZ Sports', 'Fairly Legal']",10/20/2022 2:20 PM,2022.0,10.0,20.0,14.0,20.0
2102,Kevin Spacey Found Not Liable In Sex Abuse Suit.,"['Kevin Spacey', 'Movies', 'Sex', 'Kids', 'Crime', 'Fairly Legal']",10/20/2022 1:33 PM,2022.0,10.0,20.0,13.0,33.0
2103,Peter Rosenberg Kanye Calling Me Out Is Scary ... But He's Got Little Influence.,"['Kanye West', 'Hip Hop', 'Exclusive', 'Controversial S#!T', 'Music']",10/20/2022 1:25 PM,2022.0,10.0,20.0,13.0,25.0
2104,WWE Legend Kevin Nash Son Dead At 26.,"['Kevin Nash', 'Scott Hall', 'RIP', 'Family', 'Celebrity Death', 'TMZ Sports', 'celebrity kids', 'WWE']",10/20/2022 12:03 PM,2022.0,10.0,20.0,12.0,3.0
2105,Taylor Swift's Ex Conor Kennedy Fought In Ukraine ... Recalls 'Scary' Time While Serving.,"['Taylor Swift', 'Conor Kennedy', 'Ukraine', 'Politix', 'Music', 'News']",10/20/2022 11:37 AM,2022.0,10.0,20.0,11.0,37.0
2106,Olivia Wilde Enough With The Salad Dressing ... Get Out And Vote!!!,"['Jason Sudeikis', 'Olivia Wilde', 'Harry Styles', 'Relationships', 'Hollywood Exes', 'Politix', 'Viral', 'Famous Food']",10/20/2022 11:30 AM,2022.0,10.0,20.0,11.0,30.0
2107,Kanye West Business Partners Should Pull The Plug ... Says Endeavor CEO.,"['Ari Emanuel', 'Kanye West', 'Religion/ Spirituality', 'Hip Hop', 'Fashion', 'Controversial S#!T', 'Music']",10/20/2022 11:21 AM,2022.0,10.0,20.0,11.0,21.0
2108,Tom Brady Sorry For Military Comparison ... 'Poor Choice Of Words',"['Tom Brady', 'TMZ Sports', 'Controversial S#!T', 'Tampa Bay Buccaneers', 'Football', 'NFL']",10/20/2022 11:01 AM,2022.0,10.0,20.0,11.0,1.0
2109,Astroworld Family of Victim Settles Lawsuit.,"['Travis Scott', 'Money', 'Family', 'Hip Hop', 'Music', 'Fairly Legal']",10/20/2022 9:54 AM,2022.0,10.0,20.0,9.0,54.0
2110,Fivio Foreign Airballs BK Nets Halftime Performance.,"['Fivio Foreign', 'Hip Hop', 'Brooklyn Nets', 'TMZ Sports', 'Basketball', 'NBA', 'Music']",10/20/2022 9:41 AM,2022.0,10.0,20.0,9.0,41.0
2111,Cardi B Gets Homecoming Proposal at Court As High Schoolers Swarm.,"['Cardi B', 'Hip Hop', 'Kids', 'Music', 'Fairly Legal']",10/20/2022 8:09 AM,2022.0,10.0,20.0,8.0,9.0
