,headline,tags,timestamp,year,month,day,hour,minute
219, Jim Harbaugh I'm Willing To Raise My Players' Baby ... If Pregnancy Unplanned,,7/26/2022 10:04 AM,2022,7,26,10,4
220, 'RHONY' Star Sonja Morgan Lists NYC Townhouse ... Let's Try This Again!!!,,7/26/2022 9:50 AM,2022,7,26,9,50
221, Tony Dow 'Leave it to Beaver' Star Still Alive ... Despite Facebook Death Post,,7/26/2022 8:56 AM,2022,7,26,8,56
222, Helicopter Tragedy Man Dies Walking into Blades ... Cops Fear He Was Attempting Selfie,,7/26/2022 6:58 AM,2022,7,26,6,58
223, California Soccer Player Dies Following In-Game Brawl ... Involving Players & Fans,,7/26/2022 6:53 AM,2022,7,26,6,53
224, Lana Del Rey Gets TRO Against Alleged Stalker ... He Stole My Car!!!,,7/26/2022 6:37 AM,2022,7,26,6,37
225, Taco Bell Employee Allegedly Throws Boiling Hot Water at Customers,,7/26/2022 6:27 AM,2022,7,26,6,27
226, Brittney Griner Sends Message To Wife In Court ... 'Good Luck On The Bar Exam',,7/26/2022 6:13 AM,2022,7,26,6,13
227, PetSmart Sued Your Groomers Killed My Dog!!!,,7/26/2022 1:00 AM,2022,7,26,1,0
228, 'RHOA' STAR SHEREE WHITFIELD Dating Martell Holt ... From 'Love & Marriage Huntsville',,7/26/2022 12:50 AM,2022,7,26,0,50
229, 'SHAHS OF SUNSET' Mike CHARGED WITH DOMESTIC VIOLENCE,,7/26/2022 12:40 AM,2022,7,26,0,40
