,headline,tags,timestamp,year,month,day,hour,minute
744,Whitney Houston Naomie Ackie Films New Scenes ... Hops In Porsche For Biopic.,"['Whitney Houston', 'Movies', 'Ride Me', 'Music']",8/12/2022 1:21 PM,2022.0,8.0,12.0,13.0,21.0
745,"R. Kelly Lawyer Says Joycelyn Is Not Pregnant With His Baby ... Pushes Back Against Fiancée, Alleged Victim.","['R. Kelly', 'Joycelyn Savage', 'Hip Hop', 'Exclusive Details', 'Relationships', 'Baby Watch', 'Couples', 'Music', 'Fairly Legal']",8/12/2022 1:00 PM,2022.0,8.0,12.0,13.0,0.0
746,Kobe Bryant Photo Trial Leaked Crime Scene Pics An Issue Since O.J. Murder Case ... Ex-LAPD Officer Testifies.,"['Kobe Bryant', 'Vanessa Bryant', 'O.J. Simpson', 'RIP', 'TMZ Sports', 'Basketball', 'NBA', 'Los Angeles Lakers', 'Controversial S#!T', 'Fairly Legal', 'Police']",8/12/2022 11:43 AM,2022.0,8.0,12.0,11.0,43.0
747,Anne Heche Dead at 53.,"['Anne Heche', 'RIP', 'TV', 'Movies', 'Car Crashes', 'Celebrity Death', 'Fairly Legal', 'Health']",8/12/2022 11:19 AM,2022.0,8.0,12.0,11.0,19.0
748,Author Salman Rushdie Attacked On Stage Stabbed in Neck.,"['Weapons & Guns', 'Religion/ Spirituality', 'Crime & Arrests', 'Top Chef', 'Stars In Danger', 'Nurse!', 'Health']",8/12/2022 9:05 AM,2022.0,8.0,12.0,9.0,5.0
749,The Game Shreds Eminem & 50 Cent Bow To Black Slim Shady!!!,"['Eminem', '50 Cent', 'The Game', 'Hip Hop', 'Controversial S#!T', 'Music', 'Celebrity Feuds']",8/12/2022 8:37 AM,2022.0,8.0,12.0,8.0,37.0
750,Michelle Branch Arrested for Domestic Assault Amid Split from Husband.,"['Michelle Branch', 'Patrick Carney', 'Crime & Arrests', 'Relationships', 'Hollywood Exes', 'Celebrity Divorce', 'Exclusive', 'Music', 'Fairly Legal']",8/12/2022 7:55 AM,2022.0,8.0,12.0,7.0,55.0
751,Jason Alexander Cops Plea in Britney Wedding Crasher Case.,"['Britney Spears', 'Hollywood Exes', 'Crime', 'Tying The Knot', 'Music', 'Fairly Legal']",8/12/2022 7:18 AM,2022.0,8.0,12.0,7.0,18.0
752,Rihanna & A$AP Rocky Date Night in NYC ... What Shooting Lawsuit???,"['A$AP Rocky', 'Rihanna', 'Hip Hop', 'Relationships', 'Restaurants & Nightclubs', 'Couples', 'Music', 'Fairly Legal']",8/12/2022 7:06 AM,2022.0,8.0,12.0,7.0,6.0
753,Dave Chappelle Kickin' It With Trans Comedian Flame Monroe ... After She Backed His Comedy.,"['Dave Chappelle', 'Humor', 'LGBT', 'Comedy', 'Exclusive', 'Controversial S#!T']",8/12/2022 6:53 AM,2022.0,8.0,12.0,6.0,53.0
754,Trump vs. Justice Dept. Nuclear War Games Trump Wants Search Warrant Made Public.,"['Donald Trump', 'President Trump', 'Weapons & Guns', 'Crime', 'Politix', 'Controversial S#!T', 'Fairly Legal', 'Police']",8/12/2022 6:38 AM,2022.0,8.0,12.0,6.0,38.0
755,Tim Lincecum Wife Dies After Cancer Battle ... S.F. Giants Mourn.,"['Tim Lincecum', 'RIP', 'Relationships', 'TMZ Sports', 'Couples', 'San Francisco Giants', 'Health', 'MLB', 'Baseball']",8/12/2022 6:16 AM,2022.0,8.0,12.0,6.0,16.0
756,A$AP Rocky Alleged Shooting Has Left Ex-Friend With Death Threats & In Therapy!!!,"['A$AP Rocky', 'A$AP Bari', 'Hip Hop', 'Crime', 'Exclusive', 'Music', 'Fairly Legal', 'Celebrity Feuds', 'Police']",8/12/2022 1:00 AM,2022.0,8.0,12.0,1.0,0.0
757,Alan Ruck 'Succession' Can't Hold a Candle to Trump World!!!,"['Donald Trump', 'President Trump', 'TV', 'Money', 'Family', 'Politix', 'Exclusive']",8/12/2022 12:45 AM,2022.0,8.0,12.0,0.0,45.0
758,'90 Day Fiancé' Jesse Meester I Didn't Forget About You Joe Exotic!!! ... But Don't Count on a Pardon.,"['Joe Biden', 'Joe Exotic', 'TLC', 'Netflix', 'Reality TV', 'White House', 'Crime', 'Politix', 'Exclusive']",8/12/2022 12:30 AM,2022.0,8.0,12.0,0.0,30.0
759,"Yasiel Puig Korea Now, MLB Return Next??? ... That's The Goal!!!","['Yasiel Puig', 'Los Angeles Dodgers', 'You Might Want to Rethink', 'TMZ Sports', 'Exclusive', 'MLB', 'Baseball']",8/12/2022 12:15 AM,2022.0,8.0,12.0,0.0,15.0
760,Guess Who This Golden Girl Turned Into!,"['Memba Them', 'Kids', 'Photo Galleries']",8/12/2022 12:01 AM,2022.0,8.0,12.0,0.0,1.0
761,Anne Heche Not Expected to Survive ... Suffered Severe Brain Injury.,[],8/11/2022 8:36 PM,2022.0,8.0,11.0,20.0,36.0
762,Donald Trump FBI Searched For Docs On Nukes ... In Raid at Mar-a-Lago.,"['Donald Trump', 'Melania Trump', 'President Trump', 'Crime', 'Politix', 'Controversial S#!T', 'Fairly Legal', 'Stars In Heat', 'Police']",8/11/2022 5:34 PM,2022.0,8.0,11.0,17.0,34.0
763,"Kim Kardashian Hit Me with Your Best Shot! No, Not that One!!!","['Kim Kardashian', 'Kylie Jenner', 'Family', 'Reality TV', 'Birthdays', 'Party All The Time', 'Drugs & Alcohol', 'The Kardashians']",8/11/2022 4:07 PM,2022.0,8.0,11.0,16.0,7.0
764,Kobe Bryant Photo Trial Bartender Laughed After Seeing Pics ... Bar Employee Denies.,"['Kobe Bryant', 'Vanessa Bryant', 'RIP', 'TMZ Sports', 'NBA', 'Los Angeles Lakers', 'Fairly Legal']",8/11/2022 3:07 PM,2022.0,8.0,11.0,15.0,7.0
765,Michelle Branch Splits with Husband.,"['Patrick Carney', 'Exclusive Details', 'Relationships', 'celebrity kids', 'Couples', 'Celebrity Divorce', 'Music']",8/11/2022 2:50 PM,2022.0,8.0,11.0,14.0,50.0
766,Marshawn Lynch Arrest Video Cops Forcibly Removed Ex-NFL Star From Car ... 'No More Games Today',"['Marshawn Lynch', 'Crime & Arrests', 'Seattle Seahawks', 'TMZ Sports', 'Drugs & Alcohol', 'Controversial S#!T', 'Stars In Heat', 'Football', 'NFL']",8/11/2022 1:23 PM,2022.0,8.0,11.0,13.0,23.0
767,OF MODEL COURTNEY TAILOR Cops Say Security Video Shows Her Attacking BF Months Before His Murder.,"['RIP', 'Crime & Arrests', 'Relationships', 'Models']",8/11/2022 1:15 PM,2022.0,8.0,11.0,13.0,15.0
768,Anne Heche Under the Influence of Cocaine at time of Crash  ... Condition is Dire.,"['Anne Heche', 'Movies', 'Car Crashes', 'Drugs & Alcohol', 'Health', 'Police']",8/11/2022 10:51 AM,2022.0,8.0,11.0,10.0,51.0
769,Marshawn Lynch Told Cops He Stole Car During Arrest ... Police Say.,"['Marshawn Lynch', 'Hot Vegas', 'DUI', 'Car Crashes', 'TMZ Sports', 'Drugs & Alcohol', 'Exclusive', 'Fairly Legal', 'Football', 'NFL']",8/11/2022 10:20 AM,2022.0,8.0,11.0,10.0,20.0
770,Britney Spears Lawyer Rips K-Fed In Feud Over Kids ... Stop Bullying Britney!!!,"['Britney Spears', 'Kevin Federline', 'Jayden James', 'Sean Preston', 'celebrity kids', 'Hollywood Exes', 'Instagram', 'Music', 'Fairly Legal', 'Celebrity Feuds']",8/11/2022 9:50 AM,2022.0,8.0,11.0,9.0,50.0
771,Lamar Odom I Got My Instagram Back!!! ... After HQ Visit.,"['Lamar Odom', 'TMZ Sports', 'Basketball', 'NBA', 'Instagram']",8/11/2022 8:49 AM,2022.0,8.0,11.0,8.0,49.0
772,Tommy Lee Full Frontal Nude Honk If You Like it!!!,"['Tommy Lee', 'Pamela Anderson', 'Instagram', 'Controversial S#!T', 'Music', 'Motley Crue']",8/11/2022 7:02 AM,2022.0,8.0,11.0,7.0,2.0
773,"Madonna Gets Groovy, Baby At Roller Skate Disco Party.","['Madonna', 'Family', 'Kids', 'Exclusive', 'Music']",8/11/2022 6:57 AM,2022.0,8.0,11.0,6.0,57.0
774,Jason Oppenheim I've Got a New Super Hot Model GF!!!,"['Jason Oppenheim', 'Netflix', 'Reality TV', 'Relationships', 'Dating', 'Hollywood Exes', 'Models']",8/11/2022 6:51 AM,2022.0,8.0,11.0,6.0,51.0
775,Iraqi Actress Enas Taleb How Dare You Use My Photo in Story About 'Fat' Women.,"['Movies', 'Dating', 'Controversial S#!T', 'Fairly Legal', 'Weight Loss & Weight Gain']",8/11/2022 6:36 AM,2022.0,8.0,11.0,6.0,36.0
776,Beto O'Rourke Calls Abbott Supporter 'Mother F****r' For Laughing About Uvalde Shooting.,"[""Beto O'Rourke"", 'Weapons & Guns', 'Kids', 'Politix', 'Controversial S#!T', 'Fairly Legal']",8/11/2022 6:23 AM,2022.0,8.0,11.0,6.0,23.0
777,"Karl-Anthony Towns, Jordyn Woods Jewelry Shopping In Italy ... Are Those Diamond Rings?!?","['Karl-Anthony Towns', 'Jordyn Woods', 'Bling!', 'TMZ Sports', 'Basketball', 'Couples', 'NBA', 'Tying The Knot', 'Exclusive', 'Vacations']",8/11/2022 6:09 AM,2022.0,8.0,11.0,6.0,9.0
778,"Britney Spears Kids Are Angry at Her ... Haven't Communicated in 5 Months, K-Fed Lawyer.","['Britney Spears', 'Kevin Federline', 'Relationships', 'Kids', 'Hollywood Exes', 'Exclusive', 'Music', 'Fairly Legal']",8/11/2022 1:00 AM,2022.0,8.0,11.0,1.0,0.0
779,'Batman' Stuntman Dave Lea Dead At 67.,"['Sylvester Stallone', 'Michael Keaton', 'RIP', 'Batman', 'Movies', 'Exclusive']",8/11/2022 12:40 AM,2022.0,8.0,11.0,0.0,40.0
780,"Drake This 'Honestly, Nevermind' Painting Is Legit, I Found My New IG Profile Pic!!!","['Drake', 'Hip Hop', 'Instagram', 'Exclusive', 'Music']",8/11/2022 12:25 AM,2022.0,8.0,11.0,0.0,25.0
781,Nurse Olivia Harper In 'Grey's Anatomy' 'Memba Her?!,"['Patrick Dempsey', 'Ellen Pompeo', 'ABC', 'Memba Them', 'Photo Galleries']",8/11/2022 12:01 AM,2022.0,8.0,11.0,0.0,1.0
782,Kevin Federline Posts Videos of Britney Arguing with Sons 'The Lies Have to Stop',"['Britney Spears', 'Kevin Federline', 'Jayden James', 'Sean Preston', 'Kids', 'Hollywood Exes', 'Music']",8/10/2022 9:17 PM,2022.0,8.0,10.0,21.0,17.0
783,A$AP ROCKY SUED EX-A$AP MOB MEMBER SAYS HE'S SHOOTING VICTIM.,"['A$AP Rocky', 'Hip Hop', 'Crime', 'Music', 'Fairly Legal', 'Celebrity Feuds', 'Police']",8/10/2022 5:29 PM,2022.0,8.0,10.0,17.0,29.0
784,Anne Heche Cops Investigating Crash as Felony DUI.,"['Anne Heche', 'Movies', 'Car Crashes', 'Nurse!', 'Drugs & Alcohol', 'Crime', 'Exclusive', 'Fairly Legal', 'Health', 'Police']",8/10/2022 4:00 PM,2022.0,8.0,10.0,16.0,0.0
785,Edmonton Oilers 6-Year-Old Super Fan Dies ... After Cancer Battle.,"['Connor McDavid', 'RIP', 'TMZ Sports', 'Kids', 'Health']",8/10/2022 3:31 PM,2022.0,8.0,10.0,15.0,31.0
786,Kobe Bryant Photo Trial Vanessa Sobs During Opening Statements ... Deputy Bragged About 'Piles of Meat' at Death Scene.,"['Kobe Bryant', 'Gianna Bryant', 'Vanessa Bryant', 'Family', 'TMZ Sports', 'Basketball', 'celebrity kids', 'NBA', 'Los Angeles Lakers', 'Fairly Legal', 'Police']",8/10/2022 3:09 PM,2022.0,8.0,10.0,15.0,9.0
787,OF Model Courtney Tailor Charged with Murdering Boyfriend ... Arrested in Hawaii.,"['Miami', 'RIP', 'Crime & Arrests', 'Relationships', 'Drugs & Alcohol', 'Models', 'Fairly Legal']",8/10/2022 3:05 PM,2022.0,8.0,10.0,15.0,5.0
788,"Rep. Eric Swalwell Death Threats Left on Racist, Homophobic Voicemail.","['You Might Want to Rethink', 'Family', 'Kids', 'Politix', 'Controversial S#!T']",8/10/2022 2:06 PM,2022.0,8.0,10.0,14.0,6.0
789,Olivia Wilde Wins Legal Battle vs. Jason Sudeikis You Embarrassed Me On Purpose!!!,"['Jason Sudeikis', 'Olivia Wilde', 'Relationships', 'Kids', 'Hollywood Exes', 'Fairly Legal']",8/10/2022 1:07 PM,2022.0,8.0,10.0,13.0,7.0
790,Olivia Newton-John's Heartfelt Tribute from Husband.,"['Olivia Newton-John', 'RIP', 'Relationships', 'Movies', 'Celebrity Death', 'Couples', 'Music', 'Health']",8/10/2022 12:54 PM,2022.0,8.0,10.0,12.0,54.0
791,Andrew Yang Trump Raid Better Turn Up The Goods ... Or Else It's A Stain on FBI.,"['Donald Trump', 'President Trump', 'Crime', 'Politix', 'Exclusive', 'Controversial S#!T', 'Stars In Heat']",8/10/2022 12:41 PM,2022.0,8.0,10.0,12.0,41.0
792,'Breakfast Club's' Angela Yee I'll Stick Around to Help Find Replacement.,"['Angela Yee', 'DJ Envy', 'Charlamagne Tha God', 'Breakups', 'Hip Hop', 'Exclusive', 'Music']",8/10/2022 11:01 AM,2022.0,8.0,10.0,11.0,1.0
793,Cops: Frank Gore Dragged Naked Woman By Her Hair ... In Atlantic City Incident.,"['Frank Gore', 'Exclusive Details', 'San Francisco 49ers', 'TMZ Sports', 'Crime', 'Controversial S#!T', 'Fairly Legal', 'Football', 'NFL']",8/10/2022 9:39 AM,2022.0,8.0,10.0,9.0,39.0
794,Jon Stewart Attends Biden's Signing of Vet Bill ... Props from Prez.,"['Joe Biden', 'Jon Stewart', 'TV', 'White House', 'Politix']",8/10/2022 7:43 AM,2022.0,8.0,10.0,7.0,43.0
795,"Donald Trump I'm Being Persecuted, So ... I'm Taking the 5th in NY Attorney General Probe.","['Donald Trump', 'Politix', 'Controversial S#!T', 'Fairly Legal', 'News']",8/10/2022 7:32 AM,2022.0,8.0,10.0,7.0,32.0
796,Kanye West Geminis Rule ... Matching Tats With Lil Uzi & Steve Lacy!!!,"['Kanye West', 'Lil Uzi Vert', 'Hip Hop', 'Music', 'Tattoos']",8/10/2022 7:23 AM,2022.0,8.0,10.0,7.0,23.0
797,J Lo and Ben Screw the House Hunt!!! We're All Movin' to Jen's Place.,"['Jennifer Lopez', 'Ben Affleck', 'Family', 'Relationships', 'Couples', 'Celebrity Homes']",8/10/2022 7:15 AM,2022.0,8.0,10.0,7.0,15.0
798,Cody Simpson Gets Spot On Team Australia ... For Meet Against USA.,"['Cody Simpson', 'Olympics', 'TMZ Sports', 'Music']",8/10/2022 6:55 AM,2022.0,8.0,10.0,6.0,55.0
799,Olivia Newton-John Daughter Leaves Heartbreaking Voicemail ... Following Mom's Death.,"['Olivia Newton-John', 'RIP', 'Family', 'Movies', 'Celebrity Death', 'celebrity kids', 'Music']",8/10/2022 6:48 AM,2022.0,8.0,10.0,6.0,48.0
800,"Shawn Mendes Doing Simple Things, Therapy After Cancelling World Tour.","['Shawn Mendes', 'Exclusive', 'Music', 'Health']",8/10/2022 1:00 AM,2022.0,8.0,10.0,1.0,0.0
801,'Big Brother' Fiance Upset HOH Letter Not Aired ... No Love For Gay Couple?!?,"['Big Brother', 'LGBT', 'Reality TV', 'Relationships', 'Couples', 'CBS', 'Exclusive']",8/10/2022 12:50 AM,2022.0,8.0,10.0,0.0,50.0
802,Travis Scott London Concert Merch Tops $1 Mil ... Breaks BTS U.K. Sales Record.,"['BTS', 'Travis Scott', 'Money', 'Hip Hop', 'Exclusive', 'Music']",8/10/2022 12:40 AM,2022.0,8.0,10.0,0.0,40.0
803,Drake Tattoo Artist Slams Drake and His Dad They Broke the Unwritten Tattoo Rule!!!,"['Dennis Graham', 'Drake', 'Family', 'Hip Hop', 'Exclusive', 'Music', 'Tattoo']",8/10/2022 12:30 AM,2022.0,8.0,10.0,0.0,30.0
804,TLC's Chilli Spotted Beachin' It in Hawaii with Matthew Lawrence.,"['Chilli', 'Matthew Lawrence', 'Cheryl Burke', 'TV', 'Summer/Beach', 'Hip Hop', 'Relationships', 'Movies', 'Couples', 'Exclusive', 'Dancing with the Stars', 'Music']",8/10/2022 12:20 AM,2022.0,8.0,10.0,0.0,20.0
805,Jake Paul My New Gambling/Media Biz Will Surpass $1 Bil.,"['Jake Paul', 'You Might Want to Rethink', 'Money', 'Boxing', 'TMZ Sports', 'YouTube', 'Exclusive']",8/10/2022 12:10 AM,2022.0,8.0,10.0,0.0,10.0
806,Guess Who This Little Princess Turned Into!,"['Kids', 'celebrity kids', 'Photo Galleries']",8/10/2022 12:01 AM,2022.0,8.0,10.0,0.0,1.0
807,NFL's Frank Gore Charged With Simple Assault ... Allegedly Involved In Dom. Violence Incident.,"['Frank Gore', 'San Francisco 49ers', 'TMZ Sports', 'Crime', 'Fairly Legal', 'Football', 'Fights & Feuds', 'NFL']",8/9/2022 9:22 PM,2022.0,8.0,9.0,21.0,22.0
808,"Marshawn Lynch Car Had Missing, Flat Tires ... During DUI Arrest.","['Marshawn Lynch', 'Crime & Arrests', 'Seattle Seahawks', 'Exclusive Details', 'TMZ Sports', 'Oakland Raiders', 'Drugs & Alcohol', 'Stars In Heat', 'Buffalo Bills', 'Football', 'NFL']",8/9/2022 4:34 PM,2022.0,8.0,9.0,16.0,34.0
809,"Oprah's Co. Sues Podcast Hosts You Can Talk About Me,  But Don't Use My Logo!!!","['Oprah Winfrey', 'TV', 'CELEBRITY JUSTICE ™', 'Exclusive', 'Fairly Legal']",8/9/2022 3:19 PM,2022.0,8.0,9.0,15.0,19.0
810,Ben Affleck Lists Palisades Mansion for $30M.,"['Ben Affleck', 'Jennifer Lopez', 'Money', 'Relationships', 'Movies', 'Exclusive', 'Celebrity Homes']",8/9/2022 3:15 PM,2022.0,8.0,9.0,15.0,15.0
811,ESPN Reporter M.A. Voepel 'I'm Transitioning To Male',"['LGBT', 'TMZ Sports', 'ESPN', 'WNBA']",8/9/2022 3:01 PM,2022.0,8.0,9.0,15.0,1.0
812,Steven Seagal Poses at Russian-Controlled Prison Where 50 Ukrainians Were Killed.,"['Steven Seagal', 'Vladimir Putin', 'TMZ Sports', 'Ukraine', 'Politix', 'Viral']",8/9/2022 2:56 PM,2022.0,8.0,9.0,14.0,56.0
813,Plane Crash Catches Fire On CA Freeway ... Passengers Escape Flames.,"['Viral', 'Health', 'News']",8/9/2022 2:12 PM,2022.0,8.0,9.0,14.0,12.0
814,Sesame Place Announces Comprehensive Plan ... Amid Racism Accusations.,"['Sesame Street', 'Kids', 'Controversial S#!T']",8/9/2022 1:28 PM,2022.0,8.0,9.0,13.0,28.0
815,'Insecure' Star Denise Dowse in Coma After Case of Meningitis.,"['TV', 'Nurse!', 'Exclusive', 'Health']",8/9/2022 12:41 PM,2022.0,8.0,9.0,12.0,41.0
816,Emmett Till Mississippi Grand Jury ... Declines to Indict White Accuser.,"['Emmett Till', 'RIP', 'Breaking News', 'Crime', 'Fairly Legal']",8/9/2022 12:08 PM,2022.0,8.0,9.0,12.0,8.0
817,Marshawn Lynch Arrested For DUI ... Mug Shot Released.,"['Marshawn Lynch', 'Crime & Arrests', 'Seattle Seahawks', 'TMZ Sports', 'Oakland Raiders', 'Breaking News', 'Drugs & Alcohol', 'Buffalo Bills', 'Football', 'NFL']",8/9/2022 12:02 PM,2022.0,8.0,9.0,12.0,2.0
818,Little League Baseball Batter Drilled In Head By Fastball ... Comforts Pitcher Afterward.,"['TMZ Sports', 'Kids', 'Nurse!', 'Baseball']",8/9/2022 11:43 AM,2022.0,8.0,9.0,11.0,43.0
819,San Diego Padres Fan Kicks Man Down Stairs At Game ... Wild Brawl At Petco!!!,"['TMZ Sports', 'MLB', 'Baseball', 'Fights & Feuds']",8/9/2022 10:47 AM,2022.0,8.0,9.0,10.0,47.0
820,Morgan Wallen Brings Out Jeezy ... Chugging Beers & Kickin' It Onstage!!!,"['Morgan Wallen', 'Hip Hop', 'Drugs & Alcohol', 'Music']",8/9/2022 10:03 AM,2022.0,8.0,9.0,10.0,3.0
821,Jockey Taiki Yanagida Dead At 28 ... Horrific Horse Racing Accident.,"['RIP', 'Celebrity Death', 'TMZ Sports', 'Nurse!', 'Health']",8/9/2022 8:29 AM,2022.0,8.0,9.0,8.0,29.0
822,FBI Raid Feds Waited for Trump to Leave Town ... Before Conducting Raid.,"['Donald Trump', 'Politix', 'Exclusive']",8/9/2022 8:24 AM,2022.0,8.0,9.0,8.0,24.0
823,"China New, Potentially Fatal Langya Virus Detected ... Cause For Alarm Overseas.","['Nurse!', 'Health', 'News']",8/9/2022 7:36 AM,2022.0,8.0,9.0,7.0,36.0
824,Lance Armstrong Ties The Knot With Longtime GF ... 'Best. Day. Ever.',"['Lance Armstrong', 'Relationships', 'TMZ Sports', 'Couples', 'Tying The Knot']",8/9/2022 7:26 AM,2022.0,8.0,9.0,7.0,26.0
825,Jared Kushner & Ivanka Trump Dinner Date Night After Dad Gets Raided.,"['Donald Trump', 'Jared Kushner', 'Ivanka Trump', 'Relationships', 'White House', 'Politix', 'Fairly Legal', 'Famous Food', 'Celebrity Homes']",8/9/2022 7:05 AM,2022.0,8.0,9.0,7.0,5.0
826,FBI Raid Trump Supporters Protest at Mar-a-Lago After FBI Raid's Ex-Prez's Home.,"['Donald Trump', 'White House', 'Politix', 'Fairly Legal', 'News', 'Police']",8/9/2022 6:49 AM,2022.0,8.0,9.0,6.0,49.0
827,Ashton Kutcher I Had A Super Rare Autoimmune Disease ... Threatened Hearing and Sight.,"['Ashton Kutcher', 'Bear Grylls', 'Mila Kunis', 'Clayton Kershaw', 'Los Angeles Dodgers', 'TV', 'Reality TV', 'Movies', 'TMZ Sports', 'Nurse!', 'Health']",8/9/2022 6:44 AM,2022.0,8.0,9.0,6.0,44.0
828,JOHNNY DEPP I'm Back With Dior New 7-Figure Deal As Fragrance Face.,"['Johnny Depp', 'Beauty', 'Movies', 'Exclusive', 'Fairly Legal']",8/9/2022 1:00 AM,2022.0,8.0,9.0,1.0,0.0
829,Issa Rae Donates to Family of Pregnant Woman Killed in Fiery L.A. Crash.,"['Issa Rae', 'RIP', 'Money', 'Car Crashes', 'Kids', 'Exclusive', 'News']",8/9/2022 12:50 AM,2022.0,8.0,9.0,0.0,50.0
830,Rae Sremmurd's Slim Jxmmi Busted at LAX Georgia Wants Him Extradited on Drug Charges.,"['Slim Jxmmi', 'Crime & Arrests', 'Hip Hop', 'Drugs & Alcohol', 'Music']",8/9/2022 12:40 AM,2022.0,8.0,9.0,0.0,40.0
831,Judge Mathis Ashanti Should Gag Irv Gotti’s Revenge Rampage.,"['Ashanti', 'Judge Mathis', 'Hip Hop', 'Relationships', 'Sex', 'Music', 'Fairly Legal']",8/9/2022 12:30 AM,2022.0,8.0,9.0,0.0,30.0
832,"DeMar DeRozan Poses For Pics, Signs Autographs After Big Drew League Game.","['DeMar DeRozan', 'Chicago Bulls', 'TMZ Sports', 'Basketball', 'Birthdays', 'NBA', 'Exclusive']",8/9/2022 12:20 AM,2022.0,8.0,9.0,0.0,20.0
833,Tony Little 'Memba Him?!,"['Hotties & Bodies', 'Hot Bodies', 'Memba Them']",8/9/2022 12:01 AM,2022.0,8.0,9.0,0.0,1.0
834,Donald Trump FBI Agents Raiding Mar-A-Lago ... They Broke Into My Safe!!!,"['Donald Trump', 'Breaking News', 'Politix']",8/8/2022 4:31 PM,2022.0,8.0,8.0,16.0,31.0
835,Anne Heche Still in Coma Fighting for Her Life.,"['Anne Heche', 'Movies', 'Car Crashes', 'Nurse!', 'Fairly Legal', 'Health', 'Police']",8/8/2022 2:46 PM,2022.0,8.0,8.0,14.0,46.0
836,Aaron Rodgers Balks At COVID Death Joke ... 'I Don't Find That Part Funny',"['Aaron Rodgers', 'Green Bay Packers', 'TMZ Sports', 'Football', 'Coronavirus', 'NFL']",8/8/2022 2:06 PM,2022.0,8.0,8.0,14.0,6.0
837,Ezra Miller Accused Of Burglary ... Allegedly Stole Booze From Vermont Home.,"['Ezra Miller', 'Crime & Arrests', 'Movies', 'Drugs & Alcohol', 'Exclusive']",8/8/2022 2:02 PM,2022.0,8.0,8.0,14.0,2.0
838,Fetty Wap Busted On Parole Violation... Allegedly Waving Guns On FaceTime Will Do That!,"['Fetty Wap', 'Crime & Arrests', 'Hip Hop', 'Exclusive Details', 'Music', 'Fairly Legal']",8/8/2022 1:35 PM,2022.0,8.0,8.0,13.0,35.0
839,Britney Spears 'Tiny Dancer' Remake with Elton Has Dance Vibe.,"['Britney Spears', 'Elton John', 'Music']",8/8/2022 1:34 PM,2022.0,8.0,8.0,13.0,34.0
840,Olivia Newton-John Dead at 73.,"['Olivia Newton-John', 'RIP', 'Exclusive Details', 'Movies', 'Celebrity Death', 'Music']",8/8/2022 12:25 PM,2022.0,8.0,8.0,12.0,25.0
841,"Gabby Petito Family Files Notice Of Complaint ... Seeks $50M In Damages From Moab, Utah PD.","['Gabby Petito', 'RIP', 'Money', 'Family', 'Fights', 'Crime', 'Fairly Legal', 'Police']",8/8/2022 11:44 AM,2022.0,8.0,8.0,11.0,44.0
842,Kevin Federline Vs. Britney Spears K-Fed Attorney Fires Back Kids Support Jamie!,"['Britney Spears', 'Kevin Federline', 'Jamie Spears', 'Jayden James', 'Mark Vincent Kaplan', 'Sean Preston', 'Family', 'celebrity kids', 'Music', 'Fairly Legal', 'Fights & Feuds']",8/8/2022 10:56 AM,2022.0,8.0,8.0,10.0,56.0
843,Josh Allen Rips Autograph Seeker Over Football Throw ... 'Disrespectful!!!',"['Josh Allen', 'Stefon Diggs', 'TMZ Sports', 'Controversial S#!T', 'Buffalo Bills', 'Football', 'NFL']",8/8/2022 10:32 AM,2022.0,8.0,8.0,10.0,32.0
844,"Lori Loughlin Oh Canada, I Want to Visit ... Judge Approves, but Canada Could Shut Her Down.","['Lori Loughlin', 'Full House', 'CELEBRITY JUSTICE ™', 'Movies', 'Crime', 'Fairly Legal']",8/8/2022 9:55 AM,2022.0,8.0,8.0,9.0,55.0
845,Anne Heche New Video Shows She Almost Hit Woman ... Before Crashing into House.,"['Anne Heche', 'TV', 'Movies', 'Car Crashes', 'Nurse!', 'Drugs & Alcohol', 'Exclusive', 'Health']",8/8/2022 9:30 AM,2022.0,8.0,8.0,9.0,30.0
846,'Street Outlaws' Driver Ryan Fellows Dies in Crash ... Filming for Show in Vegas.,"['RIP', 'Hot Vegas', 'Reality TV', 'Car Crashes', 'Celebrity Death', 'TMZ Sports', 'Exclusive']",8/8/2022 8:25 AM,2022.0,8.0,8.0,8.0,25.0
847,"Attorney Bert Fields Repped Beatles, Cruise, Madonna, MJ Dead at 92.","['Bert Fields', 'Tom Cruise', 'Michael Jackson', 'RIP', 'CELEBRITY JUSTICE ™', 'Movies', 'Celebrity Death', 'Music', 'Fairly Legal', 'Health', 'The Beatles']",8/8/2022 7:01 AM,2022.0,8.0,8.0,7.0,1.0
848,Anne Heche Cops Think She was Intoxicated During Wreck into House ... Get Warrant for Blood.,"['Anne Heche', 'Movies', 'Nurse!', 'Drugs & Alcohol', 'Exclusive', 'Fairly Legal', 'Health', 'Police']",8/8/2022 6:50 AM,2022.0,8.0,8.0,6.0,50.0
849,Kanye 'Skete is Dead!!!' Celebratory Post After Kim & Pete Split.,"['Kanye West', 'Pete Davidson', 'Kid Cudi', 'Kim Kardashian', 'Hip Hop', 'Relationships', 'Celebrity Divorce', 'Instagram', 'Music', 'Celebrity Feuds']",8/8/2022 6:23 AM,2022.0,8.0,8.0,6.0,23.0
850,Prince Harry Underwear From Naked Vegas Romp Going Up For Sale ... Ex-Stripper Running Auction.,"['Prince Harry', 'Money', 'Hot Vegas', 'Strippers', 'Party All The Time', 'Prince Harry Vegas Pictures', 'Viral', 'Exclusive']",8/8/2022 1:00 AM,2022.0,8.0,8.0,1.0,0.0
851,'Grease' Actor Eddie Deezen Not Competent to Stand Trial ... In Maryland Assault Case.,"['Crime & Arrests', 'CELEBRITY JUSTICE ™', 'Movies', 'Exclusive', 'Fairly Legal', 'Health']",8/8/2022 12:40 AM,2022.0,8.0,8.0,0.0,40.0
852,Barry Sanders Saquon Will Rebound This Year ... Book It!!!,"['Barry Sanders', 'Saquon Barkley', 'TMZ Sports', 'Exclusive', 'Football', 'NFL']",8/8/2022 12:20 AM,2022.0,8.0,8.0,0.0,20.0
853,"Billie Eilish Night Racing Go-Karts ... I'm the Fast Guy, Duh!!!","['Billie Eilish', 'Family', 'TMZ Sports', 'Exclusive', 'Music']",8/8/2022 12:10 AM,2022.0,8.0,8.0,0.0,10.0
854,Guess Who This Confident Kid Turned Into!,"['Kids', 'celebrity kids', 'Photo Galleries']",8/8/2022 12:01 AM,2022.0,8.0,8.0,0.0,1.0
855,Bernie Sanders Sparks New Meme w/ Capitol Steps Pic ... Amid Vote-A-Rama in D.C.!!!,"['Bernie Sanders', 'Politix', 'Viral']",8/7/2022 3:12 PM,2022.0,8.0,7.0,15.0,12.0
856,Pink Floyd's Roger Waters Argues with CNN Host ... About Conflicts in Ukraine and China.,"['Ukraine', 'Music', 'CNN']",8/7/2022 1:54 PM,2022.0,8.0,7.0,13.0,54.0
857,Pete Rose Phillies Ceremony Criticized ... Amid Old Rape Claims/Qs.,"['Pete Rose', 'TMZ Sports', 'Philadelphia Phillies', 'MLB', 'Baseball']",8/7/2022 12:52 PM,2022.0,8.0,7.0,12.0,52.0
858,'Magnum P.I.' Star Roger E. Mosley Dead at 83.,"['RIP', 'TV', 'Celebrity Death']",8/7/2022 11:43 AM,2022.0,8.0,7.0,11.0,43.0
859,'Top Gun: Maverick' Beats 'Titanic' to Become #7 ... Highest Grossing Film.,"['Tom Cruise', 'Money', 'Movies']",8/7/2022 11:14 AM,2022.0,8.0,7.0,11.0,14.0
860,Drake Here Are the GOATs of Rap ... Lil Wayne and Nicki Minaj!!!,"['Nicki Minaj', 'Lil Wayne', 'Drake', 'Hip Hop', 'Music']",8/7/2022 10:31 AM,2022.0,8.0,7.0,10.0,31.0
861,Britney and Sam Attack Kevin Federline ... How Dare You Say Her Kids Avoid Her!!!,"['Britney Spears', 'Kevin Federline', 'Sam Asghari', 'Family', 'Relationships', 'Kids', 'Hollywood Exes', 'Music']",8/7/2022 7:15 AM,2022.0,8.0,7.0,7.0,15.0
862,Travis Scott Kylie and Stormi Go Nuts for Him ... During Sold-Out London Concert.,"['Kylie Jenner', 'Stormi Webster', 'Travis Scott', 'Family', 'Hip Hop', 'TMZ Sports', 'Music']",8/7/2022 6:42 AM,2022.0,8.0,7.0,6.0,42.0
863,"Teresa Giudice Luis, I Say 'I Do' to You!!! Glitzy Wedding Brings Out 'Real Housewives'","['Teresa Giudice', 'Reality TV', 'Relationships', 'Couples', 'Real Housewives', 'Tying The Knot']",8/7/2022 6:16 AM,2022.0,8.0,7.0,6.0,16.0
864,"Fred Durst Married Man Once Again ... Wedding #4, Sucka!!!","['Fred Durst', 'Relationships', 'Couples', 'Tying The Knot', 'Exclusive', 'Music']",8/7/2022 1:00 AM,2022.0,8.0,7.0,1.0,0.0
865,Kourtney & Travis Flying Commercial Works for Us ... What Carbon Footprint???,"['Kourtney Kardashian', 'Travis Barker', 'Family', 'Reality TV', 'Couples', 'Exclusive', 'Controversial S#!T', 'Music']",8/7/2022 12:50 AM,2022.0,8.0,7.0,0.0,50.0
